id, name, base, counter, api, priceBTC, volume24h, percentChange1h,percentChange24h, percentChange7d, dateTimeUSD, milisec, timeframe
null, Bitcoin, BTC, BTC, coinmarketcap, 1, 1730944.3528818896, 0, 0, 0, 2019-06-20T11:59:28, 1561031968000, 1h
null, Ethereum, ETH, BTC, coinmarketcap, 0.028941786007841346, 626028.1617691619, 0.0249, -1.4377, -9.2193, 2019-06-20T11:59:21, 1561031961000, 1h
null, XRP, XRP, BTC, coinmarketcap, 0.00004625000499438502, 127720.07654367683, -0.3239, -2.4373, -6.7864, 2019-06-20T11:59:02, 1561031942000, 1h
null, Litecoin, LTC, BTC, coinmarketcap, 0.014586264257371029, 448137.5932879926, -0.01, -2.9141, -12.2606, 2019-06-20T11:59:02, 1561031942000, 1h
null, Bitcoin Cash, BCH, BTC, coinmarketcap, 0.04427998435264217, 136309.73122765878, -0.466, -2.7766, -10.1654, 2019-06-20T11:59:04, 1561031944000, 1h
null, EOS, EOS, BTC, coinmarketcap, 0.000732720382919581, 178545.61344589174, -0.0382, -2.8157, -8.6364, 2019-06-20T11:59:06, 1561031946000, 1h
null, Binance Coin, BNB, BTC, coinmarketcap, 0.0037599868762501656, 53144.07954984782, -0.0398, -2.4415, -13.6762, 2019-06-20T11:59:05, 1561031945000, 1h
null, Bitcoin SV, BSV, BTC, coinmarketcap, 0.023959036820931225, 30122.355598684328, -0.607, -2.5145, -5.0718, 2019-06-20T11:59:10, 1561031950000, 1h
null, Stellar, XLM, BTC, coinmarketcap, 0.000013256701603583561, 28815.871196606557, 0.1115, -3.5743, -14.6336, 2019-06-20T11:59:03, 1561031943000, 1h
null, Cardano, ADA, BTC, coinmarketcap, 0.00000950189620359075, 15189.674736923344, -0.3124, -4.4527, -17.0998, 2019-06-20T11:59:05, 1561031945000, 1h
null, TRON, TRX, BTC, coinmarketcap, 0.0000035722454923690007, 57242.54801120361, -0.2351, -2.3608, -12.6847, 2019-06-20T11:59:06, 1561031946000, 1h
null, Monero, XMR, BTC, coinmarketcap, 0.011263597295351148, 18024.9044536382, -0.6528, 2.8796, 0.8128, 2019-06-20T11:59:02, 1561031942000, 1h
null, Dash, DASH, BTC, coinmarketcap, 0.017411512586587925, 28781.460022271796, 0.1808, -0.7515, -9.5468, 2019-06-20T11:59:02, 1561031942000, 1h
null, Cosmos, ATOM, BTC, coinmarketcap, 0.0006892163256517215, 4962.207688586133, -1.2441, -5.8768, -9.4929, 2019-06-20T11:59:11, 1561031951000, 1h
null, IOTA, MIOTA, BTC, coinmarketcap, 0.00004600511642288822, 4523.9892604267225, -0.2011, -4.253, -14.6137, 2019-06-20T11:59:03, 1561031943000, 1h
null, NEO, NEO, BTC, coinmarketcap, 0.0014515830707732941, 38135.737952525895, -0.3538, -4.1552, -10.0348, 2019-06-20T11:59:03, 1561031943000, 1h
null, Ethereum Classic, ETC, BTC, coinmarketcap, 0.0009080199506055881, 61175.754340609994, -0.3383, -2.9493, -13.6003, 2019-06-20T11:59:03, 1561031943000, 1h
null, NEM, XEM, BTC, coinmarketcap, 0.000009274558385241031, 1886.0581482119405, -0.6079, -2.6523, -12.2405, 2019-06-20T11:59:02, 1561031942000, 1h
null, Tezos, XTZ, BTC, coinmarketcap, 0.00012554821054179858, 751.5727315401988, -1.0985, -7.3586, -19.901, 2019-06-20T11:59:04, 1561031944000, 1h
null, Zcash, ZEC, BTC, coinmarketcap, 0.011630082954580928, 35489.28444196266, -1.1223, -5.5782, 6.8198, 2019-06-20T11:59:04, 1561031944000, 1h
null, Ontology, ONT, BTC, coinmarketcap, 0.0001534564058256264, 16648.39720325288, -0.8566, -3.313, -12.4719, 2019-06-20T11:59:07, 1561031947000, 1h
null, Bitcoin Gold, BTG, BTC, coinmarketcap, 0.0029891387984082697, 2177.2319714995583, -0.0056, 1.5862, -7.8127, 2019-06-20T11:59:05, 1561031945000, 1h
null, VeChain, VET, BTC, coinmarketcap, 7.770576549037229E-7, 2174.1204408262893, -0.1017, -2.9976, -16.7857, 2019-06-20T11:59:09, 1561031949000, 1h
null, Dogecoin, DOGE, BTC, coinmarketcap, 3.411666615979485E-7, 3613.118136357196, 0.5917, -0.2819, -9.1198, 2019-06-20T11:59:03, 1561031943000, 1h
null, Qtum, QTUM, BTC, coinmarketcap, 0.00038201852491746515, 21874.970333406905, 0.4018, -3.7281, -4.0262, 2019-06-20T11:59:04, 1561031944000, 1h
null, Decred, DCR, BTC, coinmarketcap, 0.0029785417312755175, 328.16403634375615, 0.3237, -3.2117, -14.0846, 2019-06-20T11:59:02, 1561031942000, 1h
null, Lisk, LSK, BTC, coinmarketcap, 0.0002239413222164199, 859.1625818856114, 0.2345, -1.7404, -12.5622, 2019-06-20T11:59:02, 1561031942000, 1h
null, Waves, WAVES, BTC, coinmarketcap, 0.00025792901724441646, 1720.0647265053228, 0.0208, -1.5852, -14.8972, 2019-06-20T11:59:02, 1561031942000, 1h
null, Ravencoin, RVN, BTC, coinmarketcap, 0.00000665601652823027, 2300.0762377104807, 0.2565, -5.7431, -17.3916, 2019-06-20T11:59:06, 1561031946000, 1h
null, Bitcoin Diamond, BCD, BTC, coinmarketcap, 0.00013511960998295087, 409.9954744616925, -0.609, -4.294, -10.9896, 2019-06-20T11:59:05, 1561031945000, 1h
null, Nano, NANO, BTC, coinmarketcap, 0.00016391593831072008, 678.4470446127302, 0.3006, -1.9043, -19.0912, 2019-06-20T11:59:03, 1561031943000, 1h
null, Bytecoin, BCN, BTC, coinmarketcap, 1.1273548484665561E-7, 6.665626107588029, 4.0527, -0.0418, -2.3875, 2019-06-20T11:59:01, 1561031941000, 1h
null, Bytom, BTM, BTC, coinmarketcap, 0.000019864107397931045, 2181.212337396077, -0.7831, -4.5419, 6.809, 2019-06-20T11:59:04, 1561031944000, 1h
null, BitShares, BTS, BTC, coinmarketcap, 0.000006756258293403403, 597.0245012010148, -0.9767, -0.7153, -11.6527, 2019-06-20T11:59:02, 1561031942000, 1h
null, DigiByte, DGB, BTC, coinmarketcap, 0.0000015603257341557593, 353.07402158714507, -0.2996, 1.8975, 2.5066, 2019-06-20T11:59:01, 1561031941000, 1h
null, ICON, ICX, BTC, coinmarketcap, 0.000039125427456032866, 956.9386906856033, 0.0447, -1.426, -18.9325, 2019-06-20T11:59:05, 1561031945000, 1h
null, Komodo, KMD, BTC, coinmarketcap, 0.0001589357061027112, 308.8687840654822, 0.1504, -6.2578, -21.8155, 2019-06-20T11:59:03, 1561031943000, 1h
null, MonaCoin, MONA, BTC, coinmarketcap, 0.00025118923483813843, 1383.1856059688853, -0.6587, -0.5821, 0.2802, 2019-06-20T11:59:01, 1561031941000, 1h
null, Metaverse ETP, ETP, BTC, coinmarketcap, 0.00022220968546461572, 4066.441183574537, 0.3276, 0.496, -3.5566, 2019-06-20T11:59:03, 1561031943000, 1h
null, Verge, XVG, BTC, coinmarketcap, 9.78642476095993E-7, 265.1621954987584, -0.1903, -1.4173, -13.2551, 2019-06-20T11:59:02, 1561031942000, 1h
null, GXChain, GXC, BTC, coinmarketcap, 0.00025221051608886874, 1110.5847717408874, -0.4581, -4.8239, -9.6778, 2019-06-20T11:59:03, 1561031943000, 1h
null, Aeternity, AE, BTC, coinmarketcap, 0.000055731256094810504, 4232.8211638308785, -0.05, -4.5482, -11.2179, 2019-06-20T11:59:03, 1561031943000, 1h
null, HyperCash, HC, BTC, coinmarketcap, 0.0003465571753426536, 1880.963954891383, -0.5576, 5.4053, 25.7828, 2019-06-20T11:59:04, 1561031944000, 1h
null, Steem, STEEM, BTC, coinmarketcap, 0.0000440087936244252, 199.2175889048713, -1.2089, -3.3165, -14.24, 2019-06-20T11:59:02, 1561031942000, 1h
null, Siacoin, SC, BTC, coinmarketcap, 3.265162742269036E-7, 218.59300314578752, -0.6306, -4.0504, -18.1046, 2019-06-20T11:59:02, 1561031942000, 1h
null, Ardor, ARDR, BTC, coinmarketcap, 0.000013097787996813881, 823.8545035546225, -0.3761, -9.0802, -1.5967, 2019-06-20T11:59:02, 1561031942000, 1h
null, THETA, THETA, BTC, coinmarketcap, 0.000014383639558309572, 309.0157563816521, -0.5942, -0.7281, -14.9605, 2019-06-20T11:59:06, 1561031946000, 1h
null, Zcoin, XZC, BTC, coinmarketcap, 0.00150395979687068, 914.7374555388081, -1.1393, 2.188, -3.5331, 2019-06-20T11:59:03, 1561031943000, 1h
null, Stratis, STRAT, BTC, coinmarketcap, 0.00010475382418251902, 221.4694694752488, -0.9601, -1.7762, -10.9359, 2019-06-20T11:59:02, 1561031942000, 1h
null, ABBC Coin, ABBC, BTC, coinmarketcap, 0.00001872436867561065, 5112.197660300854, -1.1243, -2.2811, -19.067, 2019-06-20T11:59:09, 1561031949000, 1h
null, TrueChain, TRUE, BTC, coinmarketcap, 0.0001089027556843709, 6981.3118036723545, 1.0922, 0.2684, -15.1366, 2019-06-20T11:59:06, 1561031946000, 1h
null, Grin, GRIN, BTC, coinmarketcap, 0.0006047596807773356, 3603.469216752338, -0.6508, -5.7629, 34.6383, 2019-06-20T11:59:10, 1561031950000, 1h
null, NULS, NULS, BTC, coinmarketcap, 0.0001126949501297644, 1790.5373966005036, 1.7124, 1.5966, 3.6033, 2019-06-20T11:59:05, 1561031945000, 1h
null, Nebulas, NAS, BTC, coinmarketcap, 0.00016314992665462098, 636.3271661918548, 1.1228, -3.8017, -21.291, 2019-06-20T11:59:04, 1561031944000, 1h
null, Horizen, ZEN, BTC, coinmarketcap, 0.0011755530317260246, 130.3417190061761, -0.2298, -1.8183, -12.2576, 2019-06-20T11:59:03, 1561031943000, 1h
null, Energi, NRG, BTC, coinmarketcap, 0.0004536913941626848, 32.89238959985774, 0.5122, 5.4442, 18.242, 2019-06-20T11:59:09, 1561031949000, 1h
null, Project Pai, PAI, BTC, coinmarketcap, 0.000005061900075282811, 170.97253413627342, -3.031, -7.0919, -16.8394, 2019-06-20T11:59:08, 1561031948000, 1h
null, ReddCoin, RDD, BTC, coinmarketcap, 2.3599822610230378E-7, 40.81938801438737, -0.4363, 0.4293, 7.8675, 2019-06-20T11:59:01, 1561031941000, 1h
null, Ark, ARK, BTC, coinmarketcap, 0.00005902419898963153, 76.39325675757797, -0.4441, -4.9203, -20.2563, 2019-06-20T11:59:03, 1561031943000, 1h
null, Factom, FCT, BTC, coinmarketcap, 0.0006699280911445745, 52.55760387138786, 1.3421, 1.0502, -8.2822, 2019-06-20T11:59:02, 1561031942000, 1h
null, Thunder Token, TT, BTC, coinmarketcap, 0.0000021369061037089107, 1186.2038582146454, -0.1413, -3.2236, -18.1132, 2019-06-20T11:59:11, 1561031951000, 1h
null, Elastos, ELA, BTC, coinmarketcap, 0.0004049231651907467, 541.2148993697567, -0.0197, -2.4945, -7.6603, 2019-06-20T11:59:06, 1561031946000, 1h
null, Electroneum, ETN, BTC, coinmarketcap, 6.348154007991725E-7, 29.309313821351825, 0.061, 0.9574, 6.3717, 2019-06-20T11:59:05, 1561031945000, 1h
null, WaykiChain, WICC, BTC, coinmarketcap, 0.000030702934547058614, 461.4123692374026, -2.0086, -2.2661, -6.2205, 2019-06-20T11:59:05, 1561031945000, 1h
null, Aion, AION, BTC, coinmarketcap, 0.000017036221090932774, 139.76315711745585, -0.0232, -2.7126, -27.2774, 2019-06-20T11:59:05, 1561031945000, 1h
null, Theta Fuel, TFUEL, BTC, coinmarketcap, 0.0000013470296712601786, 825.8687590878818, 0.1073, -0.4158, -18.3529, 2019-06-20T11:59:11, 1561031951000, 1h
null, Wanchain, WAN, BTC, coinmarketcap, 0.00004723096566319054, 188.26414681022558, 0.9971, 2.656, -18.3438, 2019-06-20T11:59:06, 1561031946000, 1h
null, Ether Zero, ETZ, BTC, coinmarketcap, 0.000030636486144818475, 290.25288385150037, 0.109, -2.3709, -7.4043, 2019-06-20T11:59:08, 1561031948000, 1h
null, IPChain, IPC, BTC, coinmarketcap, 0.00006121048438813807, 343.9709616341683, 1.9474, -8.0979, 1.1413, 2019-06-20T11:59:06, 1561031946000, 1h
null, MOAC, MOAC, BTC, coinmarketcap, 0.00007500878018832636, 4.134526237150436, 0.5461, -1.9156, -23.4577, 2019-06-20T11:59:06, 1561031946000, 1h
null, Newton, NEW, BTC, coinmarketcap, 3.8643582573925945E-7, 1170.6313333019502, -0.1618, -0.2481, -10.1399, 2019-06-20T11:59:11, 1561031951000, 1h
null, PIVX, PIVX, BTC, coinmarketcap, 0.00008127913873874652, 68.45444483929232, -0.3722, -3.4246, -10.8989, 2019-06-20T11:59:02, 1561031942000, 1h
null, Metadium, META, BTC, coinmarketcap, 0.000003601076679972053, 776.957704768273, -0.8135, 0.4658, -6.3031, 2019-06-20T11:59:09, 1561031949000, 1h
null, TomoChain, TOMO, BTC, coinmarketcap, 0.00007082670567240785, 238.9349709510843, 0.1769, 4.4235, 5.3747, 2019-06-20T11:59:07, 1561031947000, 1h
null, Nxt, NXT, BTC, coinmarketcap, 0.000004186996095377299, 192.08309709088786, 0.0699, -3.3672, -7.9111, 2019-06-20T11:59, 1561031940000, 1h
null, CyberMiles, CMT, BTC, coinmarketcap, 0.000004965199482321242, 962.153930860099, 0.587, -4.0924, 7.4493, 2019-06-20T11:59:05, 1561031945000, 1h
null, Beam, BEAM, BTC, coinmarketcap, 0.0001605320050126891, 2288.198235804903, -1.748, 7.5668, 101.3839, 2019-06-20T11:59:10, 1561031950000, 1h
null, Syscoin, SYS, BTC, coinmarketcap, 0.0000062090835666058135, 58.928781664452735, 0.5547, -8.1651, -27.2163, 2019-06-20T11:59:01, 1561031941000, 1h
null, Groestlcoin, GRS, BTC, coinmarketcap, 0.00004633628269844323, 161.4712056924828, -0.2384, -3.2811, -15.6921, 2019-06-20T11:59:01, 1561031941000, 1h
null, CasinoCoin, CSC, BTC, coinmarketcap, 8.49542092156407E-8, 4.661670863225144, 2.0156, -4.0389, -19.9092, 2019-06-20T11:59, 1561031940000, 1h
null, Vertcoin, VTC, BTC, coinmarketcap, 0.000060771865573205286, 119.91113696420481, -0.0971, 1.836, -8.3395, 2019-06-20T11:59, 1561031940000, 1h
null, #MetaHash, MHC, BTC, coinmarketcap, 0.0000024776352508128602, 16.56365237630793, -0.0824, -1.4321, -17.4138, 2019-06-20T11:59:10, 1561031950000, 1h
null, BOScoin, BOS, BTC, coinmarketcap, 0.000004683679759938166, 8.102710410991108, 1.416, 18.2976, 141.8815, 2019-06-20T11:59:05, 1561031945000, 1h
null, Einsteinium, EMC2, BTC, coinmarketcap, 0.000012646997839852072, 216.20252953344647, 0.9876, -3.5556, -20.1357, 2019-06-20T11:59:01, 1561031941000, 1h
null, Skycoin, SKY, BTC, coinmarketcap, 0.00018358651485088945, 69.29284051554271, -0.3206, -1.9429, -11.1557, 2019-06-20T11:59:03, 1561031943000, 1h
null, Quantum Resistant Ledger, QRL, BTC, coinmarketcap, 0.00003933090768192876, 5.207222461191712, 5.0554, 6.2091, 1.2103, 2019-06-20T11:59:03, 1561031943000, 1h
null, BHPCoin, BHP, BTC, coinmarketcap, 0.00016506511596662548, 713.0717947619928, -0.3699, 1.6555, -13.0283, 2019-06-20T11:59:08, 1561031948000, 1h
null, Nexus, NXS, BTC, coinmarketcap, 0.00004150593949641555, 80.47433612407856, -0.2736, 4.1342, -8.4601, 2019-06-20T11:59:01, 1561031941000, 1h
null, Obyte, GBYTE, BTC, coinmarketcap, 0.0036454052942338265, 3.781158717904604, 0.825, -5.7045, -19.7251, 2019-06-20T11:59:02, 1561031942000, 1h
null, High Performance Blockchain, HPB, BTC, coinmarketcap, 0.00005613188870646638, 359.61853646196545, -0.2544, -0.4552, 1.5226, 2019-06-20T11:59:05, 1561031945000, 1h
null, IRISnet, IRIS, BTC, coinmarketcap, 0.0000074376690982152585, 109.63901487775277, -0.5187, -0.1618, -11.3439, 2019-06-20T11:59:11, 1561031951000, 1h
null, Pirate Chain, ARRR, BTC, coinmarketcap, 0.00002320508124472524, 1.3521987679587633, -4.0672, 8.877, 25.0992, 2019-06-20T11:59:11, 1561031951000, 1h
null, PLATINCOIN, PLC, BTC, coinmarketcap, 0.0033827805363095633, 332.9318927948131, 1.3274, 0.5176, -4.725, 2019-06-20T11:59:09, 1561031949000, 1h
null, Apollo Currency, APL, BTC, coinmarketcap, 1.6045469309168342E-7, 8.019374438776667, -0.1272, -3.4567, -22.2671, 2019-06-20T11:59:08, 1561031948000, 1h
null, Particl, PART, BTC, coinmarketcap, 0.00027888761928138774, 9.99099293950829, -0.5204, -4.3483, -30.5924, 2019-06-20T11:59:03, 1561031943000, 1h
null, TTC Protocol, TTC, BTC, coinmarketcap, 0.000010677817413305913, 271.400942620213, -0.9842, -6.4697, -25.8037, 2019-06-20T11:59:09, 1561031949000, 1h
null, Lightning Bitcoin, LBTC, BTC, coinmarketcap, 0.000520840436297618, 721.3587863323107, 0.5685, -1.1636, -16.5244, 2019-06-20T11:59:05, 1561031945000, 1h
null, SaluS, SLS, BTC, coinmarketcap, 0.0019762450984683435, 0.5422329708016382, 0.0291, 1.0666, -4.928, 2019-06-20T11:59:02, 1561031942000, 1h
null, ILCoin, ILC, BTC, coinmarketcap, 0.000006274798141780298, 96.60825102649869, -0.9455, -5.6578, -14.0192, 2019-06-20T11:59:10, 1561031950000, 1h
null, Neblio, NEBL, BTC, coinmarketcap, 0.00012574552373723476, 49.96887479391358, -0.3702, -5.3713, -25.9486, 2019-06-20T11:59:04, 1561031944000, 1h