id, name, base, counter, api, priceBTC, volume24h, percentChange1h,percentChange24h, percentChange7d, dateTimeUSD, milisec, timeframe
null, Bitcoin, BTC, BTC, coinmarketcap, 1, 1908563.3533972385, 0, 0, 0, 2019-06-24T16:59:27, 1561395567000, 1h
null, Ethereum, ETH, BTC, coinmarketcap, 0.02843210153966017, 753385.5954683218, -0.0718, -1.928, -3.454, 2019-06-24T16:59:23, 1561395563000, 1h
null, XRP, XRP, BTC, coinmarketcap, 0.00004259422787556828, 173044.51755546452, -0.0234, -3.6638, -8.6441, 2019-06-24T16:59:03, 1561395543000, 1h
null, Litecoin, LTC, BTC, coinmarketcap, 0.012451804419890439, 365384.79610918503, 0.0705, -5.048, -14.9509, 2019-06-24T16:59:02, 1561395542000, 1h
null, Bitcoin Cash, BCH, BTC, coinmarketcap, 0.04328809351872019, 190440.39969315307, 0.0066, -3.9041, -7.3961, 2019-06-24T16:59:04, 1561395544000, 1h
null, EOS, EOS, BTC, coinmarketcap, 0.0006602958659996178, 211218.45363929568, 0.1324, -3.9719, -13.8661, 2019-06-24T16:59:06, 1561395546000, 1h
null, Binance Coin, BNB, BTC, coinmarketcap, 0.0034303242763257663, 33353.81171886827, 0.4317, -3.2808, -5.5631, 2019-06-24T16:59:03, 1561395543000, 1h
null, Bitcoin SV, BSV, BTC, coinmarketcap, 0.02152424901956138, 45650.79314598124, -1.2204, -3.5237, -10.2907, 2019-06-24T16:59:11, 1561395551000, 1h
null, TRON, TRX, BTC, coinmarketcap, 0.0000035884329912498385, 90098.78970485638, 0.3096, 3.5711, -0.7899, 2019-06-24T16:59:04, 1561395544000, 1h
null, Cardano, ADA, BTC, coinmarketcap, 0.000009048306852221689, 18623.45772866856, -0.124, 0.2467, -9.8436, 2019-06-24T16:59:04, 1561395544000, 1h
null, Stellar, XLM, BTC, coinmarketcap, 0.00001171070060881376, 33929.84986601638, 0.2824, -2.6367, -16.2843, 2019-06-24T16:59:02, 1561395542000, 1h
null, Monero, XMR, BTC, coinmarketcap, 0.01064336883583506, 13280.62930769227, 0.1999, -1.3188, 0.2717, 2019-06-24T16:59:01, 1561395541000, 1h
null, Dash, DASH, BTC, coinmarketcap, 0.016202240508348283, 35169.71358474087, 0.2579, -0.9854, -5.7719, 2019-06-24T16:59:02, 1561395542000, 1h
null, Cosmos, ATOM, BTC, coinmarketcap, 0.0006150947755981392, 5261.879903362924, 0.6581, -5.5492, -16.0755, 2019-06-24T16:59:12, 1561395552000, 1h
null, IOTA, MIOTA, BTC, coinmarketcap, 0.00004169285616474261, 2269.4049460612305, -0.1159, -4.2203, -12.5726, 2019-06-24T16:59:02, 1561395542000, 1h
null, NEO, NEO, BTC, coinmarketcap, 0.001638426331657286, 64862.09564620724, -0.0502, 2.003, 5.7396, 2019-06-24T16:59:03, 1561395543000, 1h
null, Ethereum Classic, ETC, BTC, coinmarketcap, 0.000852137974308985, 80337.21238593003, 0.0648, -0.6385, -9.8586, 2019-06-24T16:59:02, 1561395542000, 1h
null, NEM, XEM, BTC, coinmarketcap, 0.000008355337143277824, 2599.519118439838, 0.4832, -2.3603, -14.6654, 2019-06-24T16:59:02, 1561395542000, 1h
null, Ontology, ONT, BTC, coinmarketcap, 0.00014489181579195135, 14170.168174298595, 0.0429, -0.2231, -10.0533, 2019-06-24T16:59:06, 1561395546000, 1h
null, Tezos, XTZ, BTC, coinmarketcap, 0.00010683629553592168, 433.0442956273403, -0.0249, -5.0533, -25.0674, 2019-06-24T16:59:04, 1561395544000, 1h
null, Zcash, ZEC, BTC, coinmarketcap, 0.01004680326888077, 39829.69346399528, 0.2676, -4.5395, -5.4111, 2019-06-24T16:59:02, 1561395542000, 1h
null, Bitcoin Gold, BTG, BTC, coinmarketcap, 0.00280050771054942, 2000.763089404943, 0.194, -1.3495, -7.0517, 2019-06-24T16:59:04, 1561395544000, 1h
null, VeChain, VET, BTC, coinmarketcap, 6.67161013470238E-7, 3313.83882546622, 0.805, -2.0482, -17.3074, 2019-06-24T16:59:08, 1561395548000, 1h
null, Dogecoin, DOGE, BTC, coinmarketcap, 3.067677643773433E-7, 4040.2948331696657, -0.292, 0.1489, -10.9789, 2019-06-24T16:59:02, 1561395542000, 1h
null, Qtum, QTUM, BTC, coinmarketcap, 0.00036165486212986125, 23371.14445270072, -0.2461, -0.8343, -8.1827, 2019-06-24T16:59:02, 1561395542000, 1h
null, Decred, DCR, BTC, coinmarketcap, 0.003041765534140575, 2078.192664411818, -0.6892, 3.5364, -1.6317, 2019-06-24T16:59:02, 1561395542000, 1h
null, Ravencoin, RVN, BTC, coinmarketcap, 0.000005980382965817603, 3285.275792411558, -0.3261, 0.1138, -10.5477, 2019-06-24T16:59:06, 1561395546000, 1h
null, Bitcoin Diamond, BCD, BTC, coinmarketcap, 0.00012116588768889148, 629.337392168743, -0.8749, -2.5358, -14.3639, 2019-06-24T16:59:04, 1561395544000, 1h
null, Lisk, LSK, BTC, coinmarketcap, 0.00019066291805838287, 955.6951027434812, -0.3919, -3.977, -17.8055, 2019-06-24T16:59:02, 1561395542000, 1h
null, Waves, WAVES, BTC, coinmarketcap, 0.00022145779937768627, 1640.0757181360443, 0.8466, -0.7134, -17.2341, 2019-06-24T16:59:02, 1561395542000, 1h
null, Nano, NANO, BTC, coinmarketcap, 0.000135818757604934, 498.3494231010566, -0.0639, -5.9387, -19.8839, 2019-06-24T16:59:02, 1561395542000, 1h
null, BitShares, BTS, BTC, coinmarketcap, 0.000006455155440247587, 1353.4077860391983, -0.5372, 6.3445, -7.1415, 2019-06-24T16:59:01, 1561395541000, 1h
null, Bytecoin, BCN, BTC, coinmarketcap, 9.552341345758572E-8, 4.336184629148521, 3.5777, -1.1253, -14.6046, 2019-06-24T16:59:01, 1561395541000, 1h
null, Bytom, BTM, BTC, coinmarketcap, 0.0000172315710990168, 2165.850051498734, -0.2135, -4.8647, -21.5909, 2019-06-24T16:59:03, 1561395543000, 1h
null, MonaCoin, MONA, BTC, coinmarketcap, 0.0002479859568359696, 1391.6920874666312, -0.3982, 1.9495, 5.4307, 2019-06-24T16:59:01, 1561395541000, 1h
null, GXChain, GXC, BTC, coinmarketcap, 0.00025571277954566956, 3848.152732869514, 6.505, 5.0359, 2.1454, 2019-06-24T16:59:03, 1561395543000, 1h
null, HyperCash, HC, BTC, coinmarketcap, 0.0003509608067853456, 686.8619405674516, 0.7278, 0.0013, 18.6141, 2019-06-24T16:59:03, 1561395543000, 1h
null, DigiByte, DGB, BTC, coinmarketcap, 0.0000012795652246702507, 124.40773422744857, 1.2112, -4.4864, -6.799, 2019-06-24T16:59:01, 1561395541000, 1h
null, ICON, ICX, BTC, coinmarketcap, 0.00003198069756083631, 1020.4694562398137, 0.8643, -2.5497, -20.5079, 2019-06-24T16:59:04, 1561395544000, 1h
null, Komodo, KMD, BTC, coinmarketcap, 0.00012990300772780503, 568.7517051812723, 1.0231, -5.7849, -27.2687, 2019-06-24T16:59:02, 1561395542000, 1h
null, Aeternity, AE, BTC, coinmarketcap, 0.00005463538605423611, 6369.281500391624, 0.7072, 13.4461, -5.6036, 2019-06-24T16:59:03, 1561395543000, 1h
null, Verge, XVG, BTC, coinmarketcap, 8.481760780989219E-7, 341.905766275897, 0.2438, -8.1859, -15.695, 2019-06-24T16:59:01, 1561395541000, 1h
null, Metaverse ETP, ETP, BTC, coinmarketcap, 0.000175936502290267, 2754.2599640419126, 0.349, -0.0186, -13.9387, 2019-06-24T16:59:02, 1561395542000, 1h
null, Siacoin, SC, BTC, coinmarketcap, 2.94794845300878E-7, 253.20528415027349, -1.6329, -2.5586, -15.072, 2019-06-24T16:59:01, 1561395541000, 1h
null, Steem, STEEM, BTC, coinmarketcap, 0.00003773143177126002, 133.92888956013488, 0.2387, -0.6085, -16.8598, 2019-06-24T16:59:02, 1561395542000, 1h
null, THETA, THETA, BTC, coinmarketcap, 0.000012628873522258355, 391.7839116960421, 1.0446, 1.3027, -9.694, 2019-06-24T16:59:05, 1561395545000, 1h
null, Ardor, ARDR, BTC, coinmarketcap, 0.000010728970375404746, 105.24994856426449, 0.3776, -3.937, -6.3987, 2019-06-24T16:59:02, 1561395542000, 1h
null, ABBC Coin, ABBC, BTC, coinmarketcap, 0.000020676487467744088, 5806.578885093263, 0.2345, -1.136, 4.8528, 2019-06-24T16:59:10, 1561395550000, 1h
null, Energi, NRG, BTC, coinmarketcap, 0.0005335093282017788, 42.461908804318526, 1.8787, 3.1716, 16.6316, 2019-06-24T16:59:09, 1561395549000, 1h
null, Zcoin, XZC, BTC, coinmarketcap, 0.0011835549665421615, 284.54939445595045, -0.1817, -3.5206, -5.8346, 2019-06-24T16:59:02, 1561395542000, 1h
null, Stratis, STRAT, BTC, coinmarketcap, 0.00008875121081966766, 194.15805949770882, -0.1958, -2.7121, -18.086, 2019-06-24T16:59:02, 1561395542000, 1h
null, Nebulas, NAS, BTC, coinmarketcap, 0.000175363627816547, 2260.921400426808, -0.5886, 9.5115, 5.4339, 2019-06-24T16:59:03, 1561395543000, 1h
null, Grin, GRIN, BTC, coinmarketcap, 0.0005381764046608005, 4492.042693814967, 1.0015, -2.8653, -14.653, 2019-06-24T16:59:12, 1561395552000, 1h
null, TrueChain, TRUE, BTC, coinmarketcap, 0.00009117540106510633, 5380.662490034934, 0.1152, -2.6672, -19.2087, 2019-06-24T16:59:05, 1561395545000, 1h
null, Project Pai, PAI, BTC, coinmarketcap, 0.000004607270267803342, 212.99738316789987, 0.2804, -2.3862, -19.7568, 2019-06-24T16:59:07, 1561395547000, 1h
null, Horizen, ZEN, BTC, coinmarketcap, 0.0009418674624094252, 67.27819669310006, 0.3569, -6.56, -15.8149, 2019-06-24T16:59:02, 1561395542000, 1h
null, NULS, NULS, BTC, coinmarketcap, 0.00008655242420823281, 994.6428005546725, -0.3521, -5.9937, -19.2675, 2019-06-24T16:59:04, 1561395544000, 1h
null, ReddCoin, RDD, BTC, coinmarketcap, 2.1011628578626238E-7, 18.455667812693147, -1.5038, -3.623, -6.0216, 2019-06-24T16:59:01, 1561395541000, 1h
null, Elastos, ELA, BTC, coinmarketcap, 0.00036829769426409995, 700.3757198129911, -1.9062, -2.611, -12.4567, 2019-06-24T16:59:06, 1561395546000, 1h
null, Ark, ARK, BTC, coinmarketcap, 0.00004821342338171899, 67.78499859225667, 0.7442, -4.5001, -22.4288, 2019-06-24T16:59:02, 1561395542000, 1h
null, Beam, BEAM, BTC, coinmarketcap, 0.00021755579709597812, 6071.4426232445485, 1.6314, 33.7418, 68.45, 2019-06-24T16:59:12, 1561395552000, 1h
null, Electroneum, ETN, BTC, coinmarketcap, 5.323810244974281E-7, 21.89273152967316, -0.4705, -4.9931, -22.7102, 2019-06-24T16:59:04, 1561395544000, 1h
null, Factom, FCT, BTC, coinmarketcap, 0.0005236360777123611, 20.89700648298203, -1.1021, -2.6442, -16.6014, 2019-06-24T16:59:01, 1561395541000, 1h
null, WaykiChain, WICC, BTC, coinmarketcap, 0.000025917843980688382, 190.87824288149113, 1.4929, -1.8003, -16.116, 2019-06-24T16:59:05, 1561395545000, 1h
null, Thunder Token, TT, BTC, coinmarketcap, 0.000001616729203805166, 1312.9325591210984, 0.6658, -2.7834, -24.6657, 2019-06-24T16:59:13, 1561395553000, 1h
null, Aion, AION, BTC, coinmarketcap, 0.000013351884067633842, 188.24204613225655, 0.7985, -4.5366, -30.3426, 2019-06-24T16:59:04, 1561395544000, 1h
null, Theta Fuel, TFUEL, BTC, coinmarketcap, 0.0000010352367658244298, 350.48048154137524, 1.6754, -2.4548, -22.1141, 2019-06-24T16:59:12, 1561395552000, 1h
null, PIVX, PIVX, BTC, coinmarketcap, 0.0000688935641389761, 64.91049663524107, 0.2553, 1.2533, -16.048, 2019-06-24T16:59:01, 1561395541000, 1h
null, Ether Zero, ETZ, BTC, coinmarketcap, 0.000023951974774578565, 218.4095742647439, -1.6868, -3.3411, -21.1256, 2019-06-24T16:59:07, 1561395547000, 1h
null, Newton, NEW, BTC, coinmarketcap, 3.2293173879934515E-7, 1108.4987748776327, -0.2956, -4.5589, -17.6983, 2019-06-24T16:59:12, 1561395552000, 1h
null, Metadium, META, BTC, coinmarketcap, 0.000003023634640169578, 181.81600280030398, 0.1718, -0.8643, -18.3603, 2019-06-24T16:59:10, 1561395550000, 1h
null, Wanchain, WAN, BTC, coinmarketcap, 0.000035398538018852135, 171.3260530718402, 0.6148, -5.5213, -26.3269, 2019-06-24T16:59:06, 1561395546000, 1h
null, MOAC, MOAC, BTC, coinmarketcap, 0.000057940371197067086, 3.349424803525511, 1.2319, -4.4438, -23.9563, 2019-06-24T16:59:05, 1561395545000, 1h
null, IPChain, IPC, BTC, coinmarketcap, 0.00004594958588794285, 269.34223659112774, 1.4974, -5.5807, -27.8891, 2019-06-24T16:59:05, 1561395545000, 1h
null, Nxt, NXT, BTC, coinmarketcap, 0.0000034426567277677125, 106.85051283349914, -0.2255, -3.2564, -12.5353, 2019-06-24T16:59:01, 1561395541000, 1h
null, CyberMiles, CMT, BTC, coinmarketcap, 0.000004256060567364297, 1126.5742902742884, -1.143, -2.0276, -21.3773, 2019-06-24T16:59:04, 1561395544000, 1h
null, TomoChain, TOMO, BTC, coinmarketcap, 0.00005158870136865893, 202.4643630809888, -0.3555, -10.247, -15.6988, 2019-06-24T16:59:06, 1561395546000, 1h
null, CasinoCoin, CSC, BTC, coinmarketcap, 7.602332221343717E-8, 5.191100629365134, 8.3154, 5.1835, -13.3291, 2019-06-24T16:59, 1561395540000, 1h
null, Groestlcoin, GRS, BTC, coinmarketcap, 0.00003901608943411667, 110.08374421110533, 0.0297, -1.4364, -16.6381, 2019-06-24T16:59:01, 1561395541000, 1h
null, Vertcoin, VTC, BTC, coinmarketcap, 0.00005619367031142511, 46.12460200430915, 1.1045, 1.0625, -4.9529, 2019-06-24T16:59:01, 1561395541000, 1h
null, Unobtanium, UNO, BTC, coinmarketcap, 0.014002117729599264, 0.5483563461419791, 0.0931, -4.6882, -2.5874, 2019-06-24T16:59, 1561395540000, 1h
null, Syscoin, SYS, BTC, coinmarketcap, 0.000004642713965565608, 36.05644723292076, -0.0977, -6.1939, -28.4606, 2019-06-24T16:59:01, 1561395541000, 1h
null, #MetaHash, MHC, BTC, coinmarketcap, 0.000002022014881069867, 23.34815438404157, 0.3825, -4.4651, -21.2602, 2019-06-24T16:59:12, 1561395552000, 1h
null, Skycoin, SKY, BTC, coinmarketcap, 0.00016464676537237822, 68.03225412957894, -0.1162, -8.1639, -6.9596, 2019-06-24T16:59:02, 1561395542000, 1h
null, Pirate Chain, ARRR, BTC, coinmarketcap, 0.000023467891690311105, 3.971023741088993, -1.2176, -7.8592, 15.6537, 2019-06-24T16:59:13, 1561395553000, 1h
null, BHPCoin, BHP, BTC, coinmarketcap, 0.00014643965224204916, 535.2663488311545, 0.7052, 1.4737, -15.5968, 2019-06-24T16:59:08, 1561395548000, 1h
null, Einsteinium, EMC2, BTC, coinmarketcap, 0.000010423005111346869, 74.66809031810068, 1.5604, -0.2385, -19.6771, 2019-06-24T16:59:01, 1561395541000, 1h
null, Obyte, GBYTE, BTC, coinmarketcap, 0.0031845177793163445, 1.7547675486274072, -0.0701, -7.7918, -21.495, 2019-06-24T16:59:02, 1561395542000, 1h
null, Nexus, NXS, BTC, coinmarketcap, 0.00003398181648161613, 36.48554935321985, 0.3841, -5.2597, -12.5042, 2019-06-24T16:59:01, 1561395541000, 1h
null, SaluS, SLS, BTC, coinmarketcap, 0.002064303895317005, 0.9358140609229124, 0.754, 0.5034, 0.9001, 2019-06-24T16:59:01, 1561395541000, 1h
null, Apollo Currency, APL, BTC, coinmarketcap, 1.4203095920859988E-7, 5.748707317438751, -0.2599, 2.5179, -24.9176, 2019-06-24T16:59:08, 1561395548000, 1h
null, TTC, TTC, BTC, coinmarketcap, 0.000010416784717338159, 174.37886740572088, 0.47, 3.3138, -10.2369, 2019-06-24T16:59:09, 1561395549000, 1h
null, IRISnet, IRIS, BTC, coinmarketcap, 0.000006320951426919824, 207.20253218952138, -0.2546, -1.9219, -20.0991, 2019-06-24T16:59:12, 1561395552000, 1h
null, BOScoin, BOS, BTC, coinmarketcap, 0.0000032241378672139872, 2.6144716376870236, 0.0099, -12.4269, 3.8446, 2019-06-24T16:59:04, 1561395544000, 1h
null, High Performance Blockchain, HPB, BTC, coinmarketcap, 0.00004564797894547022, 510.98782584382144, 0.5552, -3.8004, -18.9303, 2019-06-24T16:59:05, 1561395545000, 1h
null, Quantum Resistant Ledger, QRL, BTC, coinmarketcap, 0.000028815756402975233, 2.3078002401671114, 0.428, -4.5026, -27.1826, 2019-06-24T16:59:02, 1561395542000, 1h
null, PLATINCOIN, PLC, BTC, coinmarketcap, 0.0026830371578533884, 288.79268693399695, 1.8381, -35.5067, -19.1084, 2019-06-24T16:59:10, 1561395550000, 1h
null, Achain, ACT, BTC, coinmarketcap, 0.0000019463910359382714, 225.0265721714583, 0.5008, 3.1962, -6.2737, 2019-06-24T16:59:03, 1561395543000, 1h
null, Particl, PART, BTC, coinmarketcap, 0.00021350097546931, 7.744308453112709, -1.7262, -3.4534, -27.739, 2019-06-24T16:59:03, 1561395543000, 1h
null, HYCON, HYC, BTC, coinmarketcap, 8.411274122071766E-7, 186.94501524264598, 1.1304, 3.5375, -8.8529, 2019-06-24T16:59:09, 1561395549000, 1h