id, name, base, counter, api, priceETH, volume24h, percentChange1h,percentChange24h, percentChange7d, dateTimeUSD, milisec, timeframe
null, Bitcoin, BTC, ETH, coinmarketcap, 34.970249953931734, 81880110.79523759, 0.3268, 2.9243, 6.7346, 2019-06-22T11:59:28, 1561204768000, 1h
null, Ethereum, ETH, ETH, coinmarketcap, 1, 32382080.843227398, 0, 0, 0, 2019-06-22T11:59:19, 1561204759000, 1h
null, XRP, XRP, ETH, coinmarketcap, 0.0014829252191016294, 6675738.271200704, -0.1614, -3.1415, -3.5201, 2019-06-22T11:59:05, 1561204745000, 1h
null, Litecoin, LTC, ETH, coinmarketcap, 0.4577812494022014, 15912064.449103119, -0.3205, -4.4429, -10.5383, 2019-06-22T11:59:03, 1561204743000, 1h
null, Bitcoin Cash, BCH, ETH, coinmarketcap, 1.452770920435449, 6875851.747600046, 0.133, -2.1675, -8.2566, 2019-06-22T11:59:05, 1561204745000, 1h
null, EOS, EOS, ETH, coinmarketcap, 0.023620128153822403, 9538775.03427341, -0.0523, -3.4777, -6.6115, 2019-06-22T11:59:04, 1561204744000, 1h
null, Binance Coin, BNB, ETH, coinmarketcap, 0.12671160212495883, 1536297.8049508343, -0.8168, -3.1181, 1.0516, 2019-06-22T11:59:04, 1561204744000, 1h
null, Bitcoin SV, BSV, ETH, coinmarketcap, 0.7317110853983229, 1579491.2447997937, -0.1687, -5.6263, -8.9287, 2019-06-22T11:59:09, 1561204749000, 1h
null, Stellar, XLM, ETH, coinmarketcap, 0.0004079061503169815, 873967.1610831935, -1.4365, -5.6864, -14.2991, 2019-06-22T11:59:03, 1561204743000, 1h
null, Cardano, ADA, ETH, coinmarketcap, 0.0002969152816462427, 464946.44635913346, -0.0932, -4.9039, -13.9573, 2019-06-22T11:59:03, 1561204743000, 1h
null, TRON, TRX, ETH, coinmarketcap, 0.00011265323987815855, 2199869.6711908937, -0.2894, -3.1033, -8.4588, 2019-06-22T11:59:05, 1561204745000, 1h
null, Monero, XMR, ETH, coinmarketcap, 0.3693127561007142, 468471.45954002306, -0.1838, -2.1839, 5.0324, 2019-06-22T11:59:01, 1561204741000, 1h
null, Dash, DASH, ETH, coinmarketcap, 0.5702276549157097, 1368857.5603362955, -1.0499, -0.5725, -2.0796, 2019-06-22T11:59:02, 1561204742000, 1h
null, Cosmos, ATOM, ETH, coinmarketcap, 0.02189447737352674, 224688.0749247525, -0.0546, -4.236, -7.0927, 2019-06-22T11:59:09, 1561204749000, 1h
null, IOTA, MIOTA, ETH, coinmarketcap, 0.0014424006388890247, 96395.06585533638, -0.039, -4.0929, -12.1202, 2019-06-22T11:59:02, 1561204742000, 1h
null, NEO, NEO, ETH, coinmarketcap, 0.04746207174358423, 1567165.9811265278, 0.0287, -1.2535, -9.6196, 2019-06-22T11:59:03, 1561204743000, 1h
null, Ethereum Classic, ETC, ETH, coinmarketcap, 0.028991688593781286, 3193951.3222956094, -0.0046, -3.5006, -10.379, 2019-06-22T11:59:03, 1561204743000, 1h
null, NEM, XEM, ETH, coinmarketcap, 0.0002902319367644151, 101314.52478230486, -0.3549, -4.0671, -10.1283, 2019-06-22T11:59:02, 1561204742000, 1h
null, Zcash, ZEC, ETH, coinmarketcap, 0.36736219519349755, 1940357.8135175037, -0.2241, -6.5479, 5.583, 2019-06-22T11:59:02, 1561204742000, 1h
null, Tezos, XTZ, ETH, coinmarketcap, 0.0037269179311749125, 24209.901487116073, -1.7748, -11.6648, -19.8598, 2019-06-22T11:59:03, 1561204743000, 1h
null, Ontology, ONT, ETH, coinmarketcap, 0.004769650234836506, 537926.8868371013, -0.8356, -4.7083, -12.4188, 2019-06-22T11:59:05, 1561204745000, 1h
null, Bitcoin Gold, BTG, ETH, coinmarketcap, 0.09702376888103989, 71777.3725637812, 0.5555, -2.1775, -5.2538, 2019-06-22T11:59:03, 1561204743000, 1h
null, Dogecoin, DOGE, ETH, coinmarketcap, 0.000010497520272735893, 165249.4122497043, -1.1534, -5.1708, -11.1191, 2019-06-22T11:59:03, 1561204743000, 1h
null, VeChain, VET, ETH, coinmarketcap, 0.000021536855375846548, 127623.13093907047, -1.7461, -11.5591, -23.116, 2019-06-22T11:59:08, 1561204748000, 1h
null, Qtum, QTUM, ETH, coinmarketcap, 0.011772944117077501, 825237.9449616345, -1.1637, -5.0055, -11.3935, 2019-06-22T11:59:03, 1561204743000, 1h
null, Decred, DCR, ETH, coinmarketcap, 0.0971689795697312, 29689.63860256611, 0.0589, -6.4114, -4.7172, 2019-06-22T11:59:01, 1561204741000, 1h
null, Lisk, LSK, ETH, coinmarketcap, 0.0069159590277694345, 37392.725490927514, -1.528, -5.6074, -10.2524, 2019-06-22T11:59:01, 1561204741000, 1h
null, Bitcoin Diamond, BCD, ETH, coinmarketcap, 0.0042500634236517865, 20547.646687350247, -0.4461, -6.6206, -8.1861, 2019-06-22T11:59:03, 1561204743000, 1h
null, Waves, WAVES, ETH, coinmarketcap, 0.007686634334327131, 72578.5680047439, -0.2792, -8.5129, -14.495, 2019-06-22T11:59:02, 1561204742000, 1h
null, Ravencoin, RVN, ETH, coinmarketcap, 0.00019665022759653218, 72870.21808211503, -0.5969, -8.9678, -17.0873, 2019-06-22T11:59:04, 1561204744000, 1h
null, Nano, NANO, ETH, coinmarketcap, 0.004738256933282763, 23813.95368000861, 0.8786, -8.7044, -21.8838, 2019-06-22T11:59:02, 1561204742000, 1h
null, Bytecoin, BCN, ETH, coinmarketcap, 0.000003395726458770533, 446.7480592037213, 0.6223, -2.6351, -6.2105, 2019-06-22T11:59:01, 1561204741000, 1h
null, Bytom, BTM, ETH, coinmarketcap, 0.0005963618192226642, 100846.59661219399, -0.4564, -6.6743, -5.9473, 2019-06-22T11:59:02, 1561204742000, 1h
null, MonaCoin, MONA, ETH, coinmarketcap, 0.008872152186202657, 264899.70426759555, -0.0639, -2.1413, 17.7642, 2019-06-22T11:59:01, 1561204741000, 1h
null, BitShares, BTS, ETH, coinmarketcap, 0.00021045741954820037, 23009.91928561101, 0.6738, -4.2581, -10.9349, 2019-06-22T11:59:01, 1561204741000, 1h
null, DigiByte, DGB, ETH, coinmarketcap, 0.0000460574117971724, 6141.242365767638, 0.5057, -4.5339, -4.6156, 2019-06-22T11:59:01, 1561204741000, 1h
null, ICON, ICX, ETH, coinmarketcap, 0.0010878952833179455, 42202.61043933687, -0.1828, -8.0251, -23.4438, 2019-06-22T11:59:03, 1561204743000, 1h
null, Komodo, KMD, ETH, coinmarketcap, 0.004450452983249028, 13779.788533072608, -0.7534, -10.2529, -26.9738, 2019-06-22T11:59:02, 1561204742000, 1h
null, HyperCash, HC, ETH, coinmarketcap, 0.010962806482129382, 29356.89636571564, -0.3729, -1.7447, 10.1078, 2019-06-22T11:59:03, 1561204743000, 1h
null, Metaverse ETP, ETP, ETH, coinmarketcap, 0.006366242685280249, 138749.02422702638, -1.6158, -8.4167, -8.5878, 2019-06-22T11:59:02, 1561204742000, 1h
null, Aeternity, AE, ETH, coinmarketcap, 0.0016709558497531507, 94478.08487653274, -0.2583, -8.565, -16.4677, 2019-06-22T11:59:02, 1561204742000, 1h
null, Verge, XVG, ETH, coinmarketcap, 0.0000285743421418121, 12133.164691461454, -1.5954, -8.7197, -15.2881, 2019-06-22T11:59:01, 1561204741000, 1h
null, GXChain, GXC, ETH, coinmarketcap, 0.0073845264541834285, 55038.864693162686, -0.6955, -8.4132, -13.1118, 2019-06-22T11:59:02, 1561204742000, 1h
null, Siacoin, SC, ETH, coinmarketcap, 0.000010113599408197686, 10208.922747624703, -0.7797, -5.8186, -16.5157, 2019-06-22T11:59:01, 1561204741000, 1h
null, Steem, STEEM, ETH, coinmarketcap, 0.0012678273286868718, 7554.2529514919615, -0.4693, -8.7155, -16.8672, 2019-06-22T11:59:01, 1561204741000, 1h
null, Ardor, ARDR, ETH, coinmarketcap, 0.00039001612419620684, 10953.49760478611, -0.3784, -5.5323, -0.3303, 2019-06-22T11:59:01, 1561204741000, 1h
null, THETA, THETA, ETH, coinmarketcap, 0.0004028161426292976, 12349.224744115802, -0.7548, -8.7386, -18.0389, 2019-06-22T11:59:04, 1561204744000, 1h
null, Zcoin, XZC, ETH, coinmarketcap, 0.04229002212945784, 12177.350628155746, 0.8567, -6.9515, -0.2648, 2019-06-22T11:59:02, 1561204742000, 1h
null, ABBC Coin, ABBC, ETH, coinmarketcap, 0.0006461060176604343, 159479.93548756823, 0.5208, 8.4375, -10.4811, 2019-06-22T11:59:10, 1561204750000, 1h
null, Stratis, STRAT, ETH, coinmarketcap, 0.002978481258418115, 9493.539471184502, -0.615, -6.9009, -14.211, 2019-06-22T11:59:02, 1561204742000, 1h
null, Energi, NRG, ETH, coinmarketcap, 0.015797561031122988, 1684.1547407981152, -2.5866, 7.5572, 9.0934, 2019-06-22T11:59:07, 1561204747000, 1h
null, TrueChain, TRUE, ETH, coinmarketcap, 0.0032013823745606347, 184963.43303933434, -0.0784, -7.3037, -19.2505, 2019-06-22T11:59:05, 1561204745000, 1h
null, Horizen, ZEN, ETH, coinmarketcap, 0.035180551033355635, 4614.739894615944, -0.4876, -5.8664, -10.0788, 2019-06-22T11:59:02, 1561204742000, 1h
null, ReddCoin, RDD, ETH, coinmarketcap, 0.000008030977061721999, 2054.675847085725, 4.3894, 2.3369, 19.5844, 2019-06-22T11:59, 1561204740000, 1h
null, Nebulas, NAS, ETH, coinmarketcap, 0.004723534932540916, 23643.931368676214, -0.0422, -7.9311, -19.5071, 2019-06-22T11:59:03, 1561204743000, 1h
null, Project Pai, PAI, ETH, coinmarketcap, 0.00015404959925663437, 7612.1882937829, 0.344, -4.2815, -22.4136, 2019-06-22T11:59:08, 1561204748000, 1h
null, Grin, GRIN, ETH, coinmarketcap, 0.01667204299764421, 128303.42572613127, -1.6882, -7.7326, 6.4043, 2019-06-22T11:59:09, 1561204749000, 1h
null, NULS, NULS, ETH, coinmarketcap, 0.0030626996823574287, 30929.395489053553, 0.3318, -12.1428, -20.562, 2019-06-22T11:59:03, 1561204743000, 1h
null, Elastos, ELA, ETH, coinmarketcap, 0.01239991926409927, 33850.79582638326, 3.2909, -4.6466, -13.6793, 2019-06-22T11:59:05, 1561204745000, 1h
null, Ark, ARK, ETH, coinmarketcap, 0.0016779723774824143, 2799.3737362178467, -1.1731, -10.4289, -24.7415, 2019-06-22T11:59:02, 1561204742000, 1h
null, WaykiChain, WICC, ETH, coinmarketcap, 0.0009551627049846382, 9102.658716464264, -1.1731, -4.3041, -4.601, 2019-06-22T11:59:03, 1561204743000, 1h
null, Factom, FCT, ETH, coinmarketcap, 0.018660130630750334, 2004.6579431509724, 0.8959, -7.3554, -16.4153, 2019-06-22T11:59:01, 1561204741000, 1h
null, Electroneum, ETN, ETH, coinmarketcap, 0.000017991613774441388, 1533.9666428111852, -2.2061, -5.2686, -9.3922, 2019-06-22T11:59:03, 1561204743000, 1h
null, Thunder Token, TT, ETH, coinmarketcap, 0.00005839374184028248, 33943.09570485959, 1.9971, -12.1287, -22.5988, 2019-06-22T11:59:09, 1561204749000, 1h
null, Aion, AION, ETH, coinmarketcap, 0.00047277587908881513, 9067.682757400291, -0.1423, -12.9607, -30.2688, 2019-06-22T11:59:03, 1561204743000, 1h
null, Ether Zero, ETZ, ETH, coinmarketcap, 0.0008959173134465664, 7295.752490786349, 0.6147, -6.5132, -13.3769, 2019-06-22T11:59:05, 1561204745000, 1h
null, MOAC, MOAC, ETH, coinmarketcap, 0.002265272243594729, 141.90139157179053, -2.5863, -3.7096, -22.1318, 2019-06-22T11:59:03, 1561204743000, 1h
null, Theta Fuel, TFUEL, ETH, coinmarketcap, 0.000036860512998966084, 21236.793880628473, -0.8282, -13.3142, -21.3053, 2019-06-22T11:59:09, 1561204749000, 1h
null, Newton, NEW, ETH, coinmarketcap, 0.000011500861941562861, 28378.62335096319, -0.7385, -6.0552, -15.9218, 2019-06-22T11:59:09, 1561204749000, 1h
null, PIVX, PIVX, ETH, coinmarketcap, 0.0022921229838669486, 2905.99813431633, 0.2465, -10.7925, -15.5454, 2019-06-22T11:59:01, 1561204741000, 1h
null, IPChain, IPC, ETH, coinmarketcap, 0.0016608562309739887, 10544.95679321547, 0.2552, -10.9196, -10.4489, 2019-06-22T11:59:04, 1561204744000, 1h
null, Wanchain, WAN, ETH, coinmarketcap, 0.0012104901662138756, 6996.047071192592, -0.523, -13.2316, -29.8688, 2019-06-22T11:59:04, 1561204744000, 1h
null, Metadium, META, ETH, coinmarketcap, 0.00010240869693997584, 22504.66596212915, 1.3996, -6.8649, -15.5534, 2019-06-22T11:59:08, 1561204748000, 1h
null, TomoChain, TOMO, ETH, coinmarketcap, 0.002127262844165985, 6703.9115494954485, 0.4914, -7.1218, 5.7415, 2019-06-22T11:59:04, 1561204744000, 1h
null, Nxt, NXT, ETH, coinmarketcap, 0.0001271546290933895, 4353.460175262916, -1.1258, -3.2262, -8.3842, 2019-06-22T11:59, 1561204740000, 1h
null, CyberMiles, CMT, ETH, coinmarketcap, 0.00013949878519263498, 29791.3013159782, -1.1928, -7.7143, -28.8237, 2019-06-22T11:59:04, 1561204744000, 1h
null, Beam, BEAM, ETH, coinmarketcap, 0.004262902032074006, 75191.3340184451, -1.5162, -11.6256, 57.5016, 2019-06-22T11:59:09, 1561204749000, 1h
null, Unobtanium, UNO, ETH, coinmarketcap, 0.5062644846573395, 3.8172386021411637, 0.2, 2.9458, 6.6724, 2019-06-22T11:59, 1561204740000, 1h
null, Groestlcoin, GRS, ETH, coinmarketcap, 0.0013448651118115839, 5714.983165607181, -0.3326, -8.5744, -16.1568, 2019-06-22T11:59:01, 1561204741000, 1h
null, Vertcoin, VTC, ETH, coinmarketcap, 0.0018914202732455876, 2006.7652432833354, -0.1417, -2.7406, -6.4766, 2019-06-22T11:59, 1561204740000, 1h
null, Skycoin, SKY, ETH, coinmarketcap, 0.006217092042594136, 4545.963741792699, -1.1699, -3.8802, -0.5109, 2019-06-22T11:59:02, 1561204742000, 1h
null, #MetaHash, MHC, ETH, coinmarketcap, 0.00007625616034502245, 1017.3148745331835, -0.0859, -5.1687, -14.8082, 2019-06-22T11:59:10, 1561204750000, 1h
null, Syscoin, SYS, ETH, coinmarketcap, 0.0001635316601538962, 2307.5375950789075, -1.6763, -12.5856, -31.831, 2019-06-22T11:59:01, 1561204741000, 1h
null, BOScoin, BOS, ETH, coinmarketcap, 0.00013966147320881224, 117.4888309544135, 0.4172, 16.9634, 76.5368, 2019-06-22T11:59:03, 1561204743000, 1h
null, BHPCoin, BHP, ETH, coinmarketcap, 0.005398106197445017, 22399.07658370827, -0.0645, -1.3012, -11.7175, 2019-06-22T11:59:06, 1561204746000, 1h
null, CasinoCoin, CSC, ETH, coinmarketcap, 0.000002252651774171462, 167.90550402754607, 1.7425, -12.1233, -26.3192, 2019-06-22T11:59, 1561204740000, 1h
null, Nexus, NXS, ETH, coinmarketcap, 0.0012535600920633946, 1388.8651371416368, 1.0493, -6.4617, -7.4142, 2019-06-22T11:59:01, 1561204741000, 1h
null, Quantum Resistant Ledger, QRL, ETH, coinmarketcap, 0.0011509131802289452, 764.4469187308201, 0.3332, 3.6372, -16.6851, 2019-06-22T11:59:02, 1561204742000, 1h
null, Obyte, GBYTE, ETH, coinmarketcap, 0.11001882912181242, 117.2045729907373, 2.7878, -4.643, -21.9815, 2019-06-22T11:59:01, 1561204741000, 1h
null, Einsteinium, EMC2, ETH, coinmarketcap, 0.0003538032416510903, 5761.529229639976, -1.2671, -8.657, -22.6668, 2019-06-22T11:59, 1561204740000, 1h
null, Pirate Chain, ARRR, ETH, coinmarketcap, 0.0007405203227785357, 37.95263960427815, 0.3137, 0.0711, 11.9718, 2019-06-22T11:59:10, 1561204750000, 1h
null, PLATINCOIN, PLC, ETH, coinmarketcap, 0.11005484378058203, 10604.481207636954, 1.4433, -0.7671, -1.3353, 2019-06-22T11:59:07, 1561204747000, 1h
null, IRISnet, IRIS, ETH, coinmarketcap, 0.0002237928717680256, 4662.504830494218, 0.3385, -6.4072, -9.9494, 2019-06-22T11:59:09, 1561204749000, 1h
null, High Performance Blockchain, HPB, ETH, coinmarketcap, 0.001643087455022492, 19114.98394552032, -0.0551, -13.7236, -10.8192, 2019-06-22T11:59:04, 1561204744000, 1h
null, Apollo Currency, APL, ETH, coinmarketcap, 0.000004822731031803251, 137.93063154788283, -0.7513, -3.6866, -25.9703, 2019-06-22T11:59:06, 1561204746000, 1h
null, SaluS, SLS, ETH, coinmarketcap, 0.0671378176966402, 26.332890354487905, 0.0275, 0.0844, 0.4361, 2019-06-22T11:59:01, 1561204741000, 1h
null, Particl, PART, ETH, coinmarketcap, 0.008116469324832596, 225.6258228274948, 1.193, -9.7118, -22.7866, 2019-06-22T11:59:02, 1561204742000, 1h
null, TTC, TTC, ETH, coinmarketcap, 0.0003090068819172082, 9675.905932535223, -0.4415, -8.0592, -25.8936, 2019-06-22T11:59:07, 1561204747000, 1h
null, ILCoin, ILC, ETH, coinmarketcap, 0.0002029961587466692, 3166.3707205100663, 0.6131, -4.435, -11.6008, 2019-06-22T11:59:09, 1561204749000, 1h
null, HYCON, HYC, ETH, coinmarketcap, 0.000029122099248891268, 6464.350953527022, -1.2477, -3.9694, -0.5927, 2019-06-22T11:59:07, 1561204747000, 1h