id, name, base, counter, api, priceETH, volume24h, percentChange1h,percentChange24h, percentChange7d, dateTimeUSD, milisec, timeframe
null, Bitcoin, BTC, ETH, coinmarketcap, 34.92601290472604, 97657489.00746486, 0.0625, 3.2367, 6.458, 2019-06-22T22:59:28, 1561244368000, 1h
null, Ethereum, ETH, ETH, coinmarketcap, 1, 34799335.469178714, 0, 0, 0, 2019-06-22T22:59:19, 1561244359000, 1h
null, XRP, XRP, ETH, coinmarketcap, 0.0015603976283812054, 11427519.181161849, 0.093, 3.4494, 2.1088, 2019-06-22T22:59:03, 1561244343000, 1h
null, Litecoin, LTC, ETH, coinmarketcap, 0.4652887154852882, 17689918.270694353, 0.026, -0.7816, -9.0697, 2019-06-22T22:59:04, 1561244344000, 1h
null, Bitcoin Cash, BCH, ETH, coinmarketcap, 1.5631548787444012, 11261250.683358267, -0.0691, 5.4148, -0.219, 2019-06-22T22:59:05, 1561244345000, 1h
null, EOS, EOS, ETH, coinmarketcap, 0.024478213598085448, 11763693.452130709, -0.1411, 2.0378, -4.0184, 2019-06-22T22:59:06, 1561244346000, 1h
null, Binance Coin, BNB, ETH, coinmarketcap, 0.12555876536882418, 1491033.704065653, 0.2919, -3.2877, 2.7024, 2019-06-22T22:59:04, 1561244344000, 1h
null, Bitcoin SV, BSV, ETH, coinmarketcap, 0.783770812984348, 2557642.3981116535, 0.0592, 4.0407, -0.0366, 2019-06-22T22:59:09, 1561244349000, 1h
null, Stellar, XLM, ETH, coinmarketcap, 0.00042559910091977864, 1665852.0561634346, -0.1586, 1.0411, -9.3171, 2019-06-22T22:59:03, 1561244343000, 1h
null, Cardano, ADA, ETH, coinmarketcap, 0.00031156614091518137, 770807.3680955307, 0.0092, 2.0539, -8.7472, 2019-06-22T22:59:05, 1561244345000, 1h
null, TRON, TRX, ETH, coinmarketcap, 0.00012032033400578794, 3025645.4701535823, 0.0759, 5.6716, -1.1063, 2019-06-22T22:59:05, 1561244345000, 1h
null, Monero, XMR, ETH, coinmarketcap, 0.37480413248003147, 484235.7749093111, -0.3927, 2.1195, 7.2516, 2019-06-22T22:59:02, 1561244342000, 1h
null, Dash, DASH, ETH, coinmarketcap, 0.5757802657911802, 1548304.4046826817, 0.3496, 1.9253, -0.413, 2019-06-22T22:59:02, 1561244342000, 1h
null, Cosmos, ATOM, ETH, coinmarketcap, 0.021789799582538613, 267395.4545324152, -1.3756, -1.3855, -5.507, 2019-06-22T22:59:10, 1561244350000, 1h
null, IOTA, MIOTA, ETH, coinmarketcap, 0.0014815361648785016, 126682.3656599431, -0.1796, 2.3424, -8.788, 2019-06-22T22:59:03, 1561244343000, 1h
null, NEO, NEO, ETH, coinmarketcap, 0.055339424385584306, 3135211.7067244956, 0.2898, 16.6101, 5.8711, 2019-06-22T22:59:03, 1561244343000, 1h
null, Ethereum Classic, ETC, ETH, coinmarketcap, 0.029866069738912288, 3586171.778145922, 0.2018, 1.0256, -6.9153, 2019-06-22T22:59:03, 1561244343000, 1h
null, NEM, XEM, ETH, coinmarketcap, 0.00030246618923287594, 112803.66754595781, 1.0507, 1.2045, -5.0927, 2019-06-22T22:59:02, 1561244342000, 1h
null, Tezos, XTZ, ETH, coinmarketcap, 0.003955615369160119, 32882.405751859485, -0.1267, -0.3203, -14.6829, 2019-06-22T22:59:04, 1561244344000, 1h
null, Ontology, ONT, ETH, coinmarketcap, 0.005119557163018621, 844953.0154672173, -0.1415, 6.3787, -4.5135, 2019-06-22T22:59:06, 1561244346000, 1h
null, Zcash, ZEC, ETH, coinmarketcap, 0.3715616249861371, 2360435.0554675497, 0.2766, -0.9974, 7.6108, 2019-06-22T22:59:03, 1561244343000, 1h
null, Bitcoin Gold, BTG, ETH, coinmarketcap, 0.1002647144339719, 103001.86930709332, -1.336, 3.4468, 0.0427, 2019-06-22T22:59:04, 1561244344000, 1h
null, VeChain, VET, ETH, coinmarketcap, 0.000023638662977231453, 195972.04710109442, -0.5076, 0.1001, -14.2812, 2019-06-22T22:59:07, 1561244347000, 1h
null, Dogecoin, DOGE, ETH, coinmarketcap, 0.000010703078970725347, 185706.9420687449, -0.252, -1.8975, -8.7777, 2019-06-22T22:59:03, 1561244343000, 1h
null, Qtum, QTUM, ETH, coinmarketcap, 0.012735867709474775, 1115864.8545871757, -1.6857, 5.0989, -3.2333, 2019-06-22T22:59:04, 1561244344000, 1h
null, Decred, DCR, ETH, coinmarketcap, 0.10026412055176673, 147411.0317108149, 0.4883, 0.7235, -2.1107, 2019-06-22T22:59:02, 1561244342000, 1h
null, Ravencoin, RVN, ETH, coinmarketcap, 0.0002199722920846466, 108916.8541522662, 3.5898, 5.7887, -4.6035, 2019-06-22T22:59:06, 1561244346000, 1h
null, Bitcoin Diamond, BCD, ETH, coinmarketcap, 0.004397186129982204, 47574.01502843997, -0.494, 0.0831, -4.0014, 2019-06-22T22:59:05, 1561244345000, 1h
null, Lisk, LSK, ETH, coinmarketcap, 0.0068745508396703845, 39995.498793736224, -0.3086, -2.1616, -9.0176, 2019-06-22T22:59:02, 1561244342000, 1h
null, Waves, WAVES, ETH, coinmarketcap, 0.008021770338259111, 83437.53289043478, 0.073, -0.3029, -10.3118, 2019-06-22T22:59:03, 1561244343000, 1h
null, Nano, NANO, ETH, coinmarketcap, 0.004912470030728446, 31319.85285017942, -0.4711, 0.9311, -16.9784, 2019-06-22T22:59:03, 1561244343000, 1h
null, Bytom, BTM, ETH, coinmarketcap, 0.0006295227631526025, 100375.31525198274, -0.2799, 0.541, -0.5238, 2019-06-22T22:59:04, 1561244344000, 1h
null, Bytecoin, BCN, ETH, coinmarketcap, 0.000003400353304190298, 376.54291432780576, 0.8236, 1.6515, -5.8298, 2019-06-22T22:59:01, 1561244341000, 1h
null, BitShares, BTS, ETH, coinmarketcap, 0.00020957243226545956, 27958.209095563125, 0.099, -3.1555, -11.1751, 2019-06-22T22:59:02, 1561244342000, 1h
null, MonaCoin, MONA, ETH, coinmarketcap, 0.008583666444307183, 130321.34926751311, -1.3506, -9.6666, 16.5008, 2019-06-22T22:59:01, 1561244341000, 1h
null, DigiByte, DGB, ETH, coinmarketcap, 0.000046414383427561416, 7200.916194712146, -0.1393, -0.9921, -2.7393, 2019-06-22T22:59:02, 1561244342000, 1h
null, ICON, ICX, ETH, coinmarketcap, 0.0011342427507358087, 56527.085353955496, -0.6392, -0.6854, -18.6277, 2019-06-22T22:59:04, 1561244344000, 1h
null, HyperCash, HC, ETH, coinmarketcap, 0.012308971151208456, 50760.79537630044, 0.5162, 11.0815, 27.4903, 2019-06-22T22:59:04, 1561244344000, 1h
null, Komodo, KMD, ETH, coinmarketcap, 0.004588714307375858, 17971.480884892822, -0.077, -3.9777, -22.8147, 2019-06-22T22:59:03, 1561244343000, 1h
null, Verge, XVG, ETH, coinmarketcap, 0.000029713054476298064, 13956.719131178304, -0.231, -1.2903, -12.9551, 2019-06-22T22:59:02, 1561244342000, 1h
null, Aeternity, AE, ETH, coinmarketcap, 0.0017329910905084474, 134410.6064118514, -0.2011, -0.3126, -12.5522, 2019-06-22T22:59:03, 1561244343000, 1h
null, GXChain, GXC, ETH, coinmarketcap, 0.007731310617308862, 69087.99819044009, 0.096, 0.4432, -12.1651, 2019-06-22T22:59:03, 1561244343000, 1h
null, Metaverse ETP, ETP, ETH, coinmarketcap, 0.006266946444438961, 145917.0808375602, 0.1721, -6.541, -9.3357, 2019-06-22T22:59:03, 1561244343000, 1h
null, Siacoin, SC, ETH, coinmarketcap, 0.000010210902009647937, 17755.771754493544, -0.5823, -1.673, -15.1844, 2019-06-22T22:59:02, 1561244342000, 1h
null, Steem, STEEM, ETH, coinmarketcap, 0.001313154035955782, 8187.73871434093, 0.6265, -1.0711, -12.3496, 2019-06-22T22:59:02, 1561244342000, 1h
null, ABBC Coin, ABBC, ETH, coinmarketcap, 0.0007944424044078309, 166651.74279214372, 3.9117, 33.7343, 11.2543, 2019-06-22T22:59:09, 1561244349000, 1h
null, Ardor, ARDR, ETH, coinmarketcap, 0.00038269147844572683, 12458.673353930872, 0.0855, -2.5458, -1.4305, 2019-06-22T22:59:03, 1561244343000, 1h
null, THETA, THETA, ETH, coinmarketcap, 0.000432579964742127, 20082.879932035972, 0.5572, 1.9654, -10.1746, 2019-06-22T22:59:05, 1561244345000, 1h
null, Zcoin, XZC, ETH, coinmarketcap, 0.04248155877424858, 16717.597472563142, 1.0126, -0.7132, -3.927, 2019-06-22T22:59:03, 1561244343000, 1h
null, Stratis, STRAT, ETH, coinmarketcap, 0.003095037434406694, 11402.932218056574, -0.0556, -2.5029, -9.434, 2019-06-22T22:59:03, 1561244343000, 1h
null, Energi, NRG, ETH, coinmarketcap, 0.017092336504416217, 2748.677181719896, -0.7912, 15.4402, 17.4635, 2019-06-22T22:59:08, 1561244348000, 1h
null, TrueChain, TRUE, ETH, coinmarketcap, 0.0032869611056992607, 208855.66654525194, -0.9871, -1.9774, -16.4802, 2019-06-22T22:59:05, 1561244345000, 1h
null, Nebulas, NAS, ETH, coinmarketcap, 0.005018594974989483, 36765.33442156772, -0.9416, 3.4245, -14.5318, 2019-06-22T22:59:04, 1561244344000, 1h
null, Grin, GRIN, ETH, coinmarketcap, 0.017490726713078487, 178858.49744643408, 1.6018, 2.0441, 5.5223, 2019-06-22T22:59:09, 1561244349000, 1h
null, Horizen, ZEN, ETH, coinmarketcap, 0.03487381655216487, 5067.143393871602, 0.2181, -3.0215, -10.4481, 2019-06-22T22:59:03, 1561244343000, 1h
null, Project Pai, PAI, ETH, coinmarketcap, 0.0001611817676874292, 10413.447850402099, -0.1676, -1.9531, -22.4114, 2019-06-22T22:59:07, 1561244347000, 1h
null, NULS, NULS, ETH, coinmarketcap, 0.0031584995769501586, 41884.021674507465, 0.0989, -3.2826, -15.0728, 2019-06-22T22:59:04, 1561244344000, 1h
null, ReddCoin, RDD, ETH, coinmarketcap, 0.000007677216925770068, 2276.1891189090857, -3.3117, -0.6575, 11.5705, 2019-06-22T22:59:01, 1561244341000, 1h
null, Elastos, ELA, ETH, coinmarketcap, 0.012558289088334096, 38581.202074995046, 0.2361, -1.7442, -14.472, 2019-06-22T22:59:06, 1561244346000, 1h
null, Ark, ARK, ETH, coinmarketcap, 0.001664178675423116, 3352.53671749287, -0.5564, -5.0979, -22.7123, 2019-06-22T22:59:03, 1561244343000, 1h
null, Factom, FCT, ETH, coinmarketcap, 0.01871397941588064, 1856.603929301332, -0.3254, -0.8387, -14.0594, 2019-06-22T22:59:02, 1561244342000, 1h
null, Electroneum, ETN, ETH, coinmarketcap, 0.00001862784849802249, 1569.1087707043396, -0.0091, -0.0943, -10.3977, 2019-06-22T22:59:04, 1561244344000, 1h
null, WaykiChain, WICC, ETH, coinmarketcap, 0.0009410331752618012, 9256.6121421328, -0.0802, -3.0045, -3.185, 2019-06-22T22:59:05, 1561244345000, 1h
null, Thunder Token, TT, ETH, coinmarketcap, 0.00005815110124034207, 45741.652785024555, -0.8176, -10.6259, -21.8632, 2019-06-22T22:59:10, 1561244350000, 1h
null, Aion, AION, ETH, coinmarketcap, 0.0004770467765125813, 11749.754282930791, -0.6752, -7.8191, -27.8404, 2019-06-22T22:59:04, 1561244344000, 1h
null, Theta Fuel, TFUEL, ETH, coinmarketcap, 0.00003722589760914269, 24785.009633792324, -0.0572, -7.4248, -18.4458, 2019-06-22T22:59:10, 1561244350000, 1h
null, Ether Zero, ETZ, ETH, coinmarketcap, 0.0008624444223343372, 6813.841122143452, 0.6708, -8.3608, -14.88, 2019-06-22T22:59:07, 1561244347000, 1h
null, MOAC, MOAC, ETH, coinmarketcap, 0.002203259218486514, 127.78917726519362, -0.5931, -7.9324, -23.6276, 2019-06-22T22:59:05, 1561244345000, 1h
null, Newton, NEW, ETH, coinmarketcap, 0.000011446877494017199, 33642.737020811066, -0.6934, -6.3113, -16.4071, 2019-06-22T22:59:10, 1561244350000, 1h
null, IPChain, IPC, ETH, coinmarketcap, 0.001761157776428892, 9536.543693979425, -0.1382, -0.4389, -6.1189, 2019-06-22T22:59:05, 1561244345000, 1h
null, Wanchain, WAN, ETH, coinmarketcap, 0.0012786873841923458, 10147.19790443548, -0.1214, -4.595, -24.0637, 2019-06-22T22:59:06, 1561244346000, 1h
null, PIVX, PIVX, ETH, coinmarketcap, 0.0023558755506917213, 3663.570047524095, 0.3503, -3.7296, -13.6679, 2019-06-22T22:59:02, 1561244342000, 1h
null, Nxt, NXT, ETH, coinmarketcap, 0.00012583842981394127, 4571.386108528275, 0.2895, -2.4118, -7.8065, 2019-06-22T22:59:01, 1561244341000, 1h
null, Metadium, META, ETH, coinmarketcap, 0.00010018409742289164, 20844.416881901638, 0.5511, -7.4077, -16.5486, 2019-06-22T22:59:08, 1561244348000, 1h
null, TomoChain, TOMO, ETH, coinmarketcap, 0.0020699271358417056, 6142.087658472366, 0.0087, -5.4805, 4.3078, 2019-06-22T22:59:06, 1561244346000, 1h
null, CyberMiles, CMT, ETH, coinmarketcap, 0.00014647851748856967, 33521.85098558551, 0.846, -2.5126, -31.1308, 2019-06-22T22:59:05, 1561244345000, 1h
null, Beam, BEAM, ETH, coinmarketcap, 0.004771188730814638, 117890.3557907149, -0.6686, 24.1278, 57.3075, 2019-06-22T22:59:09, 1561244349000, 1h
null, Groestlcoin, GRS, ETH, coinmarketcap, 0.0014113379403471024, 6867.825771025313, 0.2245, -1.5588, -11.6919, 2019-06-22T22:59:01, 1561244341000, 1h
null, Unobtanium, UNO, ETH, coinmarketcap, 0.5059033556747156, 5.166956149243497, 0.1478, 3.276, 6.379, 2019-06-22T22:59:01, 1561244341000, 1h
null, Syscoin, SYS, ETH, coinmarketcap, 0.00017762648723708053, 3388.0419535546403, 2.7914, 1.1476, -24.1941, 2019-06-22T22:59:01, 1561244341000, 1h
null, Vertcoin, VTC, ETH, coinmarketcap, 0.0019088773293914976, 2990.132947085189, 0.0616, -0.0718, -4.3749, 2019-06-22T22:59:01, 1561244341000, 1h
null, Skycoin, SKY, ETH, coinmarketcap, 0.006169030826528226, 5523.619927448826, 0.6866, -4.6253, 0.9094, 2019-06-22T22:59:03, 1561244343000, 1h
null, #MetaHash, MHC, ETH, coinmarketcap, 0.00007428363322225589, 1652.1242342291698, -0.0116, -4.2096, -16.4036, 2019-06-22T22:59:09, 1561244349000, 1h
null, CasinoCoin, CSC, ETH, coinmarketcap, 0.0000023344337113879763, 158.93971401474087, -0.6209, -1.6165, -25.4482, 2019-06-22T22:59:01, 1561244341000, 1h
null, BHPCoin, BHP, ETH, coinmarketcap, 0.005390843246729053, 20924.87734939572, 1.5105, -0.9567, -11.4901, 2019-06-22T22:59:07, 1561244347000, 1h
null, PLATINCOIN, PLC, ETH, coinmarketcap, 0.12107396026784012, 11638.835582598584, 11.4534, 11.6365, 7.8429, 2019-06-22T22:59:08, 1561244348000, 1h
null, BOScoin, BOS, ETH, coinmarketcap, 0.0001292690606491881, 69.79358200317053, 0.3766, -3.8334, 62.1097, 2019-06-22T22:59:04, 1561244344000, 1h
null, Pirate Chain, ARRR, ETH, coinmarketcap, 0.0007802599052743539, 108.26995553083414, 2.7925, -0.9077, 8.7815, 2019-06-22T22:59:10, 1561244350000, 1h
null, Nexus, NXS, ETH, coinmarketcap, 0.0012511855886552835, 1601.4634160881658, -0.2044, -6.2072, -6.5217, 2019-06-22T22:59:01, 1561244341000, 1h
null, Einsteinium, EMC2, ETH, coinmarketcap, 0.0003625035229420825, 6366.0300586070625, 0.8963, -2.3948, -18.7618, 2019-06-22T22:59:01, 1561244341000, 1h
null, Obyte, GBYTE, ETH, coinmarketcap, 0.10886471110339721, 192.80481181293592, -0.7729, -3.6045, -20.0848, 2019-06-22T22:59:03, 1561244343000, 1h
null, Quantum Resistant Ledger, QRL, ETH, coinmarketcap, 0.0010815878625867565, 789.2019162276204, 2.1375, 0.4841, -20.5343, 2019-06-22T22:59:03, 1561244343000, 1h
null, IRISnet, IRIS, ETH, coinmarketcap, 0.0002243848123920814, 6379.361041948648, -0.2189, -3.9197, -10.2025, 2019-06-22T22:59:10, 1561244350000, 1h
null, Apollo Currency, APL, ETH, coinmarketcap, 0.000004848287761681757, 147.95142541995858, 0.0311, -0.8121, -23.7499, 2019-06-22T22:59:07, 1561244347000, 1h
null, High Performance Blockchain, HPB, ETH, coinmarketcap, 0.0015962227990861952, 19938.193174502874, 0.1201, -14.5295, -12.7135, 2019-06-22T22:59:05, 1561244345000, 1h
null, SaluS, SLS, ETH, coinmarketcap, 0.06759863003470401, 22.8400866267692, 0.198, -0.0936, 2.2353, 2019-06-22T22:59:02, 1561244342000, 1h
null, TTC, TTC, ETH, coinmarketcap, 0.00032572134858823847, 10245.168350178747, 0.5006, 1.4708, -18.2002, 2019-06-22T22:59:08, 1561244348000, 1h
null, Particl, PART, ETH, coinmarketcap, 0.007996329859911656, 171.34050015839205, -1.0552, -5.0449, -23.4135, 2019-06-22T22:59:04, 1561244344000, 1h
null, Lightning Bitcoin, LBTC, ETH, coinmarketcap, 0.015477209914866202, 24764.718813800955, 1.1248, -1.8955, -15.6173, 2019-06-22T22:59:05, 1561244345000, 1h
null, VeriBlock, VBK, ETH, coinmarketcap, 0.00012281255730016522, 2723.178806086309, -0.8249, 15.1205, -2.8504, 2019-06-22T22:59:10, 1561244350000, 1h