id, name, base, counter, api, priceETH, volume24h, percentChange1h,percentChange24h, percentChange7d, dateTimeUSD, milisec, timeframe
null, Bitcoin, BTC, ETH, coinmarketcap, 35.156886978321204, 92426761.87936455, 0.6516, 2.6232, 7.214, 2019-06-22T18:59:29, 1561229969000, 1h
null, Ethereum, ETH, ETH, coinmarketcap, 1, 34391875.2611503, 0, 0, 0, 2019-06-22T18:59:18, 1561229958000, 1h
null, XRP, XRP, ETH, coinmarketcap, 0.0015646422176837916, 9930001.631430702, -0.3081, 2.0973, 2.1352, 2019-06-22T18:59:02, 1561229942000, 1h
null, Litecoin, LTC, ETH, coinmarketcap, 0.45760849171712376, 16795240.367477104, -0.6133, -4.4411, -10.755, 2019-06-22T18:59:03, 1561229943000, 1h
null, Bitcoin Cash, BCH, ETH, coinmarketcap, 1.456124586784938, 7420387.787275293, -0.1695, -2.9956, -7.3784, 2019-06-22T18:59:07, 1561229947000, 1h
null, EOS, EOS, ETH, coinmarketcap, 0.02381010798258506, 10653787.536751604, 0.0518, -2.3192, -6.2818, 2019-06-22T18:59:05, 1561229945000, 1h
null, Binance Coin, BNB, ETH, coinmarketcap, 0.12517331480630886, 1551106.1181428884, 0.1, -4.7344, 1.1517, 2019-06-22T18:59:04, 1561229944000, 1h
null, Bitcoin SV, BSV, ETH, coinmarketcap, 0.7690770502134796, 2225640.0802939544, 0.019, 0.3867, -2.7997, 2019-06-22T18:59:11, 1561229951000, 1h
null, Stellar, XLM, ETH, coinmarketcap, 0.0004207237832535178, 1466871.4253581243, -0.6887, -2.4493, -10.6681, 2019-06-22T18:59:02, 1561229942000, 1h
null, Cardano, ADA, ETH, coinmarketcap, 0.0003047184729281894, 712584.0536387147, -0.5771, -2.117, -11.2459, 2019-06-22T18:59:05, 1561229945000, 1h
null, TRON, TRX, ETH, coinmarketcap, 0.0001164105539021388, 2748559.173333154, -1.3002, 0.5669, -4.5324, 2019-06-22T18:59:05, 1561229945000, 1h
null, Monero, XMR, ETH, coinmarketcap, 0.3743639171804463, 477270.29295110196, 0.3839, -0.4321, 6.9519, 2019-06-22T18:59:01, 1561229941000, 1h
null, Dash, DASH, ETH, coinmarketcap, 0.5720087127120385, 1502450.6020536828, -0.4602, 0.4664, -1.3238, 2019-06-22T18:59:02, 1561229942000, 1h
null, Cosmos, ATOM, ETH, coinmarketcap, 0.021858715563289367, 224608.1599367433, -0.6722, -2.61, -6.0116, 2019-06-22T18:59:11, 1561229951000, 1h
null, IOTA, MIOTA, ETH, coinmarketcap, 0.0014722779676128396, 120464.28223074335, 0.7333, -0.672, -9.588, 2019-06-22T18:59:03, 1561229943000, 1h
null, NEO, NEO, ETH, coinmarketcap, 0.05547430544703027, 2900004.455447124, -0.4165, 15.1098, 5.1759, 2019-06-22T18:59:05, 1561229945000, 1h
null, Ethereum Classic, ETC, ETH, coinmarketcap, 0.029299691176268763, 3364310.7305353545, -0.0395, -2.33, -9.0476, 2019-06-22T18:59:04, 1561229944000, 1h
null, NEM, XEM, ETH, coinmarketcap, 0.0002950638119302611, 111333.80073396084, -0.6283, -2.3385, -7.8197, 2019-06-22T18:59:02, 1561229942000, 1h
null, Tezos, XTZ, ETH, coinmarketcap, 0.003938776635368142, 32734.928613388984, -3.2864, -0.6902, -15.0316, 2019-06-22T18:59:04, 1561229944000, 1h
null, Ontology, ONT, ETH, coinmarketcap, 0.005142661758877158, 811988.8688661671, 1.4384, 4.7132, -4.9376, 2019-06-22T18:59:07, 1561229947000, 1h
null, Zcash, ZEC, ETH, coinmarketcap, 0.37083302056568185, 2280840.7462232593, 0.1756, -3.1673, 6.6074, 2019-06-22T18:59:04, 1561229944000, 1h
null, Bitcoin Gold, BTG, ETH, coinmarketcap, 0.09830863882237804, 93062.28054820486, -0.4357, -0.8314, -2.7161, 2019-06-22T18:59:05, 1561229945000, 1h
null, VeChain, VET, ETH, coinmarketcap, 0.000023039347401719118, 170842.30775295198, 0.3999, -4.8128, -17.2565, 2019-06-22T18:59:09, 1561229949000, 1h
null, Dogecoin, DOGE, ETH, coinmarketcap, 0.000010599090326641723, 179626.73922101728, 0.4091, -4.2603, -10.1291, 2019-06-22T18:59:03, 1561229943000, 1h
null, Qtum, QTUM, ETH, coinmarketcap, 0.012639400110092291, 1044188.733951248, 0.9628, 3.1022, -4.4312, 2019-06-22T18:59:04, 1561229944000, 1h
null, Decred, DCR, ETH, coinmarketcap, 0.0972753478268879, 130318.87679679903, 0.3009, -4.4239, -4.7211, 2019-06-22T18:59:02, 1561229942000, 1h
null, Bitcoin Diamond, BCD, ETH, coinmarketcap, 0.004358659688472172, 43448.58205769846, -0.1745, -2.5843, -5.2941, 2019-06-22T18:59:05, 1561229945000, 1h
null, Lisk, LSK, ETH, coinmarketcap, 0.006894965350607782, 40691.83167097003, 0.3856, -4.4797, -9.9492, 2019-06-22T18:59:02, 1561229942000, 1h
null, Waves, WAVES, ETH, coinmarketcap, 0.00786567361561849, 80037.18124268435, 0.4089, -4.7807, -12.2159, 2019-06-22T18:59:03, 1561229943000, 1h
null, Ravencoin, RVN, ETH, coinmarketcap, 0.0002023888290057717, 93010.08680798377, 0.7985, -4.359, -13.12, 2019-06-22T18:59:07, 1561229947000, 1h
null, Nano, NANO, ETH, coinmarketcap, 0.004851138157586683, 29331.719870173878, -0.8898, -3.4357, -18.9125, 2019-06-22T18:59:03, 1561229943000, 1h
null, Bytom, BTM, ETH, coinmarketcap, 0.0006268498864623898, 99456.90184348091, -0.5593, -1.1466, -1.4332, 2019-06-22T18:59:04, 1561229944000, 1h
null, Bytecoin, BCN, ETH, coinmarketcap, 0.000003209619951046282, 422.1934200352787, -4.7025, -4.0163, -10.6787, 2019-06-22T18:59:01, 1561229941000, 1h
null, BitShares, BTS, ETH, coinmarketcap, 0.00021052194510144095, 27790.937526680973, 0.1656, -4.4097, -10.7403, 2019-06-22T18:59:01, 1561229941000, 1h
null, MonaCoin, MONA, ETH, coinmarketcap, 0.008366811190006962, 130252.10224065573, -2.5076, -13.1062, 12.7857, 2019-06-22T18:59:01, 1561229941000, 1h
null, DigiByte, DGB, ETH, coinmarketcap, 0.00004577924123439867, 7106.205374682924, 0.2096, -5.2562, -4.6883, 2019-06-22T18:59:01, 1561229941000, 1h
null, ICON, ICX, ETH, coinmarketcap, 0.0011180130134325783, 54247.91246304196, -0.1324, -5.5234, -20.2984, 2019-06-22T18:59:05, 1561229945000, 1h
null, HyperCash, HC, ETH, coinmarketcap, 0.011743488035134957, 42658.91634118981, 2.477, 4.8376, 21.1603, 2019-06-22T18:59:04, 1561229944000, 1h
null, Komodo, KMD, ETH, coinmarketcap, 0.004383357561351281, 16272.320765513505, -0.394, -11.9417, -27.2354, 2019-06-22T18:59:03, 1561229943000, 1h
null, Verge, XVG, ETH, coinmarketcap, 0.000030173484532590015, 14144.481303612438, 2.2919, -1.9047, -11.0607, 2019-06-22T18:59:01, 1561229941000, 1h
null, GXChain, GXC, ETH, coinmarketcap, 0.0077577289428452986, 70803.07386936445, 0.1272, -1.7478, -11.2616, 2019-06-22T18:59:03, 1561229943000, 1h
null, Aeternity, AE, ETH, coinmarketcap, 0.0016989591906985079, 131856.14452566666, -0.7462, -3.9231, -14.8244, 2019-06-22T18:59:03, 1561229943000, 1h
null, Metaverse ETP, ETP, ETH, coinmarketcap, 0.006294155020842353, 138288.02752900496, 2.7577, -6.6088, -9.3165, 2019-06-22T18:59:03, 1561229943000, 1h
null, Siacoin, SC, ETH, coinmarketcap, 0.000010256010928676815, 13966.644468744364, 0.6618, -2.8997, -14.7345, 2019-06-22T18:59:02, 1561229942000, 1h
null, Steem, STEEM, ETH, coinmarketcap, 0.0012959716295334967, 8259.311178927948, 0.416, -4.3449, -13.768, 2019-06-22T18:59:02, 1561229942000, 1h
null, Ardor, ARDR, ETH, coinmarketcap, 0.00037876900821381916, 12446.742087514722, 0.4506, -5.7972, -2.8188, 2019-06-22T18:59:03, 1561229943000, 1h
null, THETA, THETA, ETH, coinmarketcap, 0.00042385426667696397, 19740.738572623366, 0.0035, -2.1592, -12.0639, 2019-06-22T18:59:06, 1561229946000, 1h
null, ABBC Coin, ABBC, ETH, coinmarketcap, 0.0007112110985161408, 154479.2847027543, 2.6589, 19.1126, -0.9178, 2019-06-22T18:59:10, 1561229950000, 1h
null, Zcoin, XZC, ETH, coinmarketcap, 0.042831128970176637, 18014.31711785487, 0.5825, -5.8426, -3.6838, 2019-06-22T18:59:03, 1561229943000, 1h
null, Stratis, STRAT, ETH, coinmarketcap, 0.0030465560005950108, 10970.913269299455, 0.7215, -5.6497, -11.5063, 2019-06-22T18:59:03, 1561229943000, 1h
null, Energi, NRG, ETH, coinmarketcap, 0.016861727319681764, 2334.031992764245, -0.3436, 12.0471, 15.4875, 2019-06-22T18:59:09, 1561229949000, 1h
null, TrueChain, TRUE, ETH, coinmarketcap, 0.0032482822543957383, 203276.25056270175, -1.1307, -5.3534, -17.9162, 2019-06-22T18:59:06, 1561229946000, 1h
null, Nebulas, NAS, ETH, coinmarketcap, 0.004970081768856164, 35028.77594224911, -0.9903, -0.9361, -16.0891, 2019-06-22T18:59:04, 1561229944000, 1h
null, Horizen, ZEN, ETH, coinmarketcap, 0.034851137784990806, 5205.688696824313, 2.0385, -5.0351, -10.883, 2019-06-22T18:59:03, 1561229943000, 1h
null, Project Pai, PAI, ETH, coinmarketcap, 0.00015708539240819302, 9644.489385935782, -0.3826, -4.2985, -23.3528, 2019-06-22T18:59:08, 1561229948000, 1h
null, Grin, GRIN, ETH, coinmarketcap, 0.01619869203636264, 177705.11014412457, -1.5379, -8.3466, 0.2114, 2019-06-22T18:59:11, 1561229951000, 1h
null, ReddCoin, RDD, ETH, coinmarketcap, 0.000007734449857817844, 2329.4022178072237, 2.1105, -0.062, 14.0328, 2019-06-22T18:59:01, 1561229941000, 1h
null, NULS, NULS, ETH, coinmarketcap, 0.0030992396145516693, 40124.06401747354, -1.4048, -8.2987, -18.0607, 2019-06-22T18:59:05, 1561229945000, 1h
null, Elastos, ELA, ETH, coinmarketcap, 0.01241013038016494, 35180.77172990502, -0.099, -3.62, -14.1939, 2019-06-22T18:59:07, 1561229947000, 1h
null, Ark, ARK, ETH, coinmarketcap, 0.0016675778009404012, 3442.8913231088045, -0.4026, -10.7503, -23.4611, 2019-06-22T18:59:03, 1561229943000, 1h
null, Factom, FCT, ETH, coinmarketcap, 0.018795499999241967, 1896.2050479360778, 1.1167, -4.0103, -14.9516, 2019-06-22T18:59:02, 1561229942000, 1h
null, Electroneum, ETN, ETH, coinmarketcap, 0.00001845251144877362, 1670.3377092565083, 0.8943, -3.6095, -9.084, 2019-06-22T18:59:05, 1561229945000, 1h
null, WaykiChain, WICC, ETH, coinmarketcap, 0.0009366924612762968, 9438.341274038525, -1.9071, -5.4492, -4.7732, 2019-06-22T18:59:06, 1561229946000, 1h
null, Thunder Token, TT, ETH, coinmarketcap, 0.00005904533008903609, 43403.37979046262, 0.5712, -10.7279, -20.849, 2019-06-22T18:59:11, 1561229951000, 1h
null, Aion, AION, ETH, coinmarketcap, 0.0004765896144837595, 11458.861853762877, 0.2196, -11.6093, -28.8128, 2019-06-22T18:59:04, 1561229944000, 1h
null, MOAC, MOAC, ETH, coinmarketcap, 0.0022396653586364964, 128.09337437513636, -0.0899, -8.4811, -22.5373, 2019-06-22T18:59:06, 1561229946000, 1h
null, Theta Fuel, TFUEL, ETH, coinmarketcap, 0.000036364287087820774, 23426.364931539836, -0.1088, -11.1284, -21.0593, 2019-06-22T18:59:11, 1561229951000, 1h
null, Newton, NEW, ETH, coinmarketcap, 0.000011623420136692682, 32789.569469328955, 0.1174, -5.8228, -15.3621, 2019-06-22T18:59:11, 1561229951000, 1h
null, Ether Zero, ETZ, ETH, coinmarketcap, 0.0008510179925553149, 6521.158471920039, -2.7146, -11.4652, -16.6872, 2019-06-22T18:59:08, 1561229948000, 1h
null, IPChain, IPC, ETH, coinmarketcap, 0.001744356635517853, 10835.64188544137, -0.7159, -4.3068, -6.9405, 2019-06-22T18:59:06, 1561229946000, 1h
null, Wanchain, WAN, ETH, coinmarketcap, 0.0012749722996844225, 9538.759923081001, 0.4284, -8.999, -24.9538, 2019-06-22T18:59:07, 1561229947000, 1h
null, PIVX, PIVX, ETH, coinmarketcap, 0.002299140140178028, 3733.3087457671804, -1.2426, -8.3294, -15.6056, 2019-06-22T18:59:02, 1561229942000, 1h
null, TomoChain, TOMO, ETH, coinmarketcap, 0.0021105399390489595, 5983.782522755083, 1.3188, -4.8762, 6.119, 2019-06-22T18:59:07, 1561229947000, 1h
null, Nxt, NXT, ETH, coinmarketcap, 0.00012503129791781987, 4698.333824159443, -0.4995, -5.1435, -8.9995, 2019-06-22T18:59:01, 1561229941000, 1h
null, Metadium, META, ETH, coinmarketcap, 0.00009995016766517672, 20520.164717194144, -0.2763, -8.7684, -16.6063, 2019-06-22T18:59:10, 1561229950000, 1h
null, CyberMiles, CMT, ETH, coinmarketcap, 0.00014157824804908247, 34975.703468161446, -1.069, -7.4811, -30.4524, 2019-06-22T18:59:06, 1561229946000, 1h
null, Beam, BEAM, ETH, coinmarketcap, 0.0045038545020446834, 108083.59353617231, 6.3522, -0.9773, 54.6325, 2019-06-22T18:59:11, 1561229951000, 1h
null, Unobtanium, UNO, ETH, coinmarketcap, 0.5099588187198635, 5.009969605265997, 0.6816, 2.7705, 7.3064, 2019-06-22T18:59:01, 1561229941000, 1h
null, Groestlcoin, GRS, ETH, coinmarketcap, 0.0013694659165964598, 6744.727428332361, -0.1526, -5.7872, -14.3006, 2019-06-22T18:59:01, 1561229941000, 1h
null, Vertcoin, VTC, ETH, coinmarketcap, 0.0018806279626361311, 2687.029849719949, 0.9472, -2.9858, -5.8102, 2019-06-22T18:59:01, 1561229941000, 1h
null, Skycoin, SKY, ETH, coinmarketcap, 0.00627902388762704, 5451.90451236574, -0.7934, -4.1265, 1.3783, 2019-06-22T18:59:03, 1561229943000, 1h
null, CasinoCoin, CSC, ETH, coinmarketcap, 0.000002409961739090005, 181.56949298439176, 2.756, -0.5895, -22.868, 2019-06-22T18:59:01, 1561229941000, 1h
null, Syscoin, SYS, ETH, coinmarketcap, 0.00016831147205593008, 3102.605385170682, 0.9632, -6.7383, -28.9355, 2019-06-22T18:59:01, 1561229941000, 1h
null, #MetaHash, MHC, ETH, coinmarketcap, 0.00007568049860674607, 1267.3488432913648, -0.3502, -5.226, -15.0533, 2019-06-22T18:59:11, 1561229951000, 1h
null, BHPCoin, BHP, ETH, coinmarketcap, 0.005362663959755264, 20612.872449943792, 1.1323, -4.0422, -12.2409, 2019-06-22T18:59:08, 1561229948000, 1h
null, BOScoin, BOS, ETH, coinmarketcap, 0.00013058749279240323, 64.91325046789552, 1.7825, -6.9919, 61.4484, 2019-06-22T18:59:05, 1561229945000, 1h
null, Pirate Chain, ARRR, ETH, coinmarketcap, 0.0007633867868564343, 50.67098980209589, -0.3367, -2.3064, 9.4978, 2019-06-22T18:59:11, 1561229951000, 1h
null, Obyte, GBYTE, ETH, coinmarketcap, 0.111135506755085, 192.1432789055075, 4.0658, -3.4269, -19.2375, 2019-06-22T18:59:03, 1561229943000, 1h
null, Einsteinium, EMC2, ETH, coinmarketcap, 0.00035315310774031866, 6052.542947271233, 0.0156, -5.6658, -21.1521, 2019-06-22T18:59:01, 1561229941000, 1h
null, Nexus, NXS, ETH, coinmarketcap, 0.0012158477305498202, 1579.901330160075, 1.1296, -9.2845, -9.777, 2019-06-22T18:59:01, 1561229941000, 1h
null, PLATINCOIN, PLC, ETH, coinmarketcap, 0.10877207596658327, 10613.529548845358, -0.4353, -1.449, -3.2358, 2019-06-22T18:59:10, 1561229950000, 1h
null, Quantum Resistant Ledger, QRL, ETH, coinmarketcap, 0.0010818175721536664, 811.2860415903097, -0.0256, -1.9026, -20.6489, 2019-06-22T18:59:03, 1561229943000, 1h
null, IRISnet, IRIS, ETH, coinmarketcap, 0.00022324095337061472, 5465.7452830365, -0.9203, -6.3686, -10.3998, 2019-06-22T18:59:11, 1561229951000, 1h
null, Apollo Currency, APL, ETH, coinmarketcap, 0.000004774680417163743, 138.9195829668027, 1.9429, -5.0321, -24.8955, 2019-06-22T18:59:08, 1561229948000, 1h
null, High Performance Blockchain, HPB, ETH, coinmarketcap, 0.0016040236392433351, 19594.572510848546, -3.3788, -15.1592, -12.2318, 2019-06-22T18:59:06, 1561229946000, 1h
null, SaluS, SLS, ETH, coinmarketcap, 0.06799332999796444, 15.49170430302218, 1.1824, -0.6976, 2.8363, 2019-06-22T18:59:02, 1561229942000, 1h
null, Particl, PART, ETH, coinmarketcap, 0.008168289719330899, 208.81861241748936, 1.4504, -4.6366, -22.4618, 2019-06-22T18:59:04, 1561229944000, 1h
null, TTC, TTC, ETH, coinmarketcap, 0.00031938571021839326, 9301.09453328621, 0.0282, -2.4654, -20.7352, 2019-06-22T18:59:09, 1561229949000, 1h
null, Lightning Bitcoin, LBTC, ETH, coinmarketcap, 0.015455248514390129, 24574.276687821064, 1.712, -3.9317, -16.3292, 2019-06-22T18:59:06, 1561229946000, 1h
null, ILCoin, ILC, ETH, coinmarketcap, 0.00019560754078157277, 3088.7301081882138, 0.203, -3.687, -14.6114, 2019-06-22T18:59:10, 1561229950000, 1h