id, name, base, counter, api, priceETH, volume24h, percentChange1h,percentChange24h, percentChange7d, dateTimeUSD, milisec, timeframe
null, Bitcoin, BTC, ETH, coinmarketcap, 35.0517638596231, 65679171.699171185, -0.1916, 1.7531, 9.5907, 2019-06-21T02:59:28, 1561085968000, 1h
null, Ethereum, ETH, ETH, coinmarketcap, 1, 23586803.047778536, 0, 0, 0, 2019-06-21T02:59:17, 1561085957000, 1h
null, XRP, XRP, ETH, coinmarketcap, 0.0015816881018610985, 4769717.203766191, 0.2334, -2.3442, 1.6624, 2019-06-21T02:59:04, 1561085944000, 1h
null, Litecoin, LTC, ETH, coinmarketcap, 0.4986640898982996, 14285638.673586706, 0.25, -1.8903, -1.8859, 2019-06-21T02:59:07, 1561085947000, 1h
null, Bitcoin Cash, BCH, ETH, coinmarketcap, 1.5220416001920105, 4837885.188386321, -0.331, -1.5793, -5.308, 2019-06-21T02:59:06, 1561085946000, 1h
null, EOS, EOS, ETH, coinmarketcap, 0.025193324024677534, 7101205.969398265, 0.3557, -1.2621, 0.1452, 2019-06-21T02:59:06, 1561085946000, 1h
null, Binance Coin, BNB, ETH, coinmarketcap, 0.13502872630198515, 2340682.8238645433, 0.9908, 3.1505, 0.1716, 2019-06-21T02:59:05, 1561085945000, 1h
null, Bitcoin SV, BSV, ETH, coinmarketcap, 0.7985518036240031, 1539417.0639850735, -1.8434, -4.3211, -1.1577, 2019-06-21T02:59:10, 1561085950000, 1h
null, Stellar, XLM, ETH, coinmarketcap, 0.00044705227426298307, 1008473.9911194239, 0.1343, -3.1337, -7.7635, 2019-06-21T02:59:03, 1561085943000, 1h
null, Cardano, ADA, ETH, coinmarketcap, 0.0003216366587476814, 586728.8387376836, 0.1486, -3.3292, -7.9237, 2019-06-21T02:59:05, 1561085945000, 1h
null, TRON, TRX, ETH, coinmarketcap, 0.00012044485825242485, 2116617.2271920224, 0.392, -2.8494, -5.0378, 2019-06-21T02:59:05, 1561085945000, 1h
null, Monero, XMR, ETH, coinmarketcap, 0.38645590738350716, 645384.8598551431, 0.0805, 3.6215, 10.6146, 2019-06-21T02:59:03, 1561085943000, 1h
null, Dash, DASH, ETH, coinmarketcap, 0.5955086027693461, 914408.1656735383, -0.0214, -1.0434, -0.8908, 2019-06-21T02:59:03, 1561085943000, 1h
null, Cosmos, ATOM, ETH, coinmarketcap, 0.02391061534782231, 231623.1561792969, 0.5021, -2.8194, -1.8955, 2019-06-21T02:59:11, 1561085951000, 1h
null, IOTA, MIOTA, ETH, coinmarketcap, 0.0015371785082349935, 147361.30574021465, 0.0615, -5.2346, -10.2537, 2019-06-21T02:59:04, 1561085944000, 1h
null, NEO, NEO, ETH, coinmarketcap, 0.049871560443734156, 1407858.8779147, 0.0953, -2.414, -2.2683, 2019-06-21T02:59:04, 1561085944000, 1h
null, Ethereum Classic, ETC, ETH, coinmarketcap, 0.03128288112359551, 2288937.9867634675, 0.2885, -1.4088, -5.3691, 2019-06-21T02:59:06, 1561085946000, 1h
null, NEM, XEM, ETH, coinmarketcap, 0.0003163884203414809, 132389.1255093601, -0.093, -2.5046, -5.0434, 2019-06-21T02:59:03, 1561085943000, 1h
null, Tezos, XTZ, ETH, coinmarketcap, 0.004161129482417019, 34974.51568479328, 0.1273, -6.6938, -15.8134, 2019-06-21T02:59:04, 1561085944000, 1h
null, Zcash, ZEC, ETH, coinmarketcap, 0.4035827430884677, 1111263.7134249683, 0.2904, -2.0471, 16.9511, 2019-06-21T02:59:04, 1561085944000, 1h
null, Ontology, ONT, ETH, coinmarketcap, 0.005165344481571448, 665291.6438588586, 0.3154, -3.2544, -7.9741, 2019-06-21T02:59:07, 1561085947000, 1h
null, Bitcoin Gold, BTG, ETH, coinmarketcap, 0.10334896002930254, 73572.76544297866, -0.7896, 0.919, -0.0204, 2019-06-21T02:59:06, 1561085946000, 1h
null, VeChain, VET, ETH, coinmarketcap, 0.000025364963912793997, 101747.67868403712, 0.5521, -6.6652, -14.0934, 2019-06-21T02:59:08, 1561085948000, 1h
null, Dogecoin, DOGE, ETH, coinmarketcap, 0.00001165561036951314, 133133.61818524523, 0.5243, 0.2553, -2.7127, 2019-06-21T02:59:04, 1561085944000, 1h
null, Qtum, QTUM, ETH, coinmarketcap, 0.012882800843897391, 647815.5522308523, -0.149, -3.187, -2.5152, 2019-06-21T02:59:05, 1561085945000, 1h
null, Decred, DCR, ETH, coinmarketcap, 0.10807311857869605, 18117.494345897903, 1.6858, 1.9948, -0.5952, 2019-06-21T02:59:03, 1561085943000, 1h
null, Lisk, LSK, ETH, coinmarketcap, 0.007449549649261301, 34230.145669045254, -0.8249, -3.4495, -7.6429, 2019-06-21T02:59:03, 1561085943000, 1h
null, Bitcoin Diamond, BCD, ETH, coinmarketcap, 0.004692069633233882, 15385.378200231607, 0.3986, -1.8937, -1.7588, 2019-06-21T02:59:05, 1561085945000, 1h
null, Ravencoin, RVN, ETH, coinmarketcap, 0.00022943234978846478, 68228.47743999607, -0.07, -3.278, -7.4204, 2019-06-21T02:59:06, 1561085946000, 1h
null, Waves, WAVES, ETH, coinmarketcap, 0.008716572271336435, 63803.965992429396, 0.0812, -3.3754, -9.5744, 2019-06-21T02:59:04, 1561085944000, 1h
null, Nano, NANO, ETH, coinmarketcap, 0.005355383593001603, 21237.67772936141, 0.1744, -8.0699, -19.3427, 2019-06-21T02:59:04, 1561085944000, 1h
null, Bytecoin, BCN, ETH, coinmarketcap, 0.0000037393500042807982, 160.8420780316305, 0.2295, -0.7182, 4.0621, 2019-06-21T02:59:02, 1561085942000, 1h
null, Bytom, BTM, ETH, coinmarketcap, 0.0006671850300585748, 243677.44910542338, -0.2084, -6.2537, 0.722, 2019-06-21T02:59:04, 1561085944000, 1h
null, DigiByte, DGB, ETH, coinmarketcap, 0.000052796290721110936, 7449.400391038669, 0.2271, -7.0956, 9.5615, 2019-06-21T02:59:02, 1561085942000, 1h
null, BitShares, BTS, ETH, coinmarketcap, 0.00023023556557474144, 22560.012696532907, 1.4099, -1.7298, -5.411, 2019-06-21T02:59:03, 1561085943000, 1h
null, ICON, ICX, ETH, coinmarketcap, 0.0012580397733287306, 33463.92613363686, -0.3038, -6.1283, -16.3929, 2019-06-21T02:59:05, 1561085945000, 1h
null, Komodo, KMD, ETH, coinmarketcap, 0.00514790056093116, 9221.883093318702, -0.284, -8.2242, -21.334, 2019-06-21T02:59:03, 1561085943000, 1h
null, MonaCoin, MONA, ETH, coinmarketcap, 0.008683983913221586, 34595.891446116795, -0.2237, -1.9328, 9.4428, 2019-06-21T02:59:01, 1561085941000, 1h
null, HyperCash, HC, ETH, coinmarketcap, 0.012001782100978775, 53749.64934325292, -1.7786, -2.3185, 29.9194, 2019-06-21T02:59:04, 1561085944000, 1h
null, Metaverse ETP, ETP, ETH, coinmarketcap, 0.007253423778744574, 451843.78778654034, -0.7444, -5.5632, -0.762, 2019-06-21T02:59:04, 1561085944000, 1h
null, Verge, XVG, ETH, coinmarketcap, 0.00003271865232799133, 9388.781753988504, -0.1589, -4.9446, -7.4705, 2019-06-21T02:59:02, 1561085942000, 1h
null, Aeternity, AE, ETH, coinmarketcap, 0.0018934693888711727, 116535.88266097836, 0.3703, -3.6887, -5.9522, 2019-06-21T02:59:04, 1561085944000, 1h
null, GXChain, GXC, ETH, coinmarketcap, 0.008325508813804299, 48164.43754419821, 0.0099, -5.8897, -3.5967, 2019-06-21T02:59:04, 1561085944000, 1h
null, Steem, STEEM, ETH, coinmarketcap, 0.0014872674115788951, 7391.367641247437, 0.1257, -3.7474, -8.2889, 2019-06-21T02:59:03, 1561085943000, 1h
null, Siacoin, SC, ETH, coinmarketcap, 0.000011423652932926546, 11006.995251166789, 0.3289, -2.1273, -9.3373, 2019-06-21T02:59:03, 1561085943000, 1h
null, Ardor, ARDR, ETH, coinmarketcap, 0.0004399036814885857, 9409.675144002993, 0.4462, -6.67, 8.9023, 2019-06-21T02:59:03, 1561085943000, 1h
null, THETA, THETA, ETH, coinmarketcap, 0.0004720947215257298, 14153.161140972963, -0.5371, -5.7448, -9.5417, 2019-06-21T02:59:05, 1561085945000, 1h
null, Zcoin, XZC, ETH, coinmarketcap, 0.04839588449535796, 26360.716338745013, 0.141, -4.6933, 3.7323, 2019-06-21T02:59:03, 1561085943000, 1h
null, Stratis, STRAT, ETH, coinmarketcap, 0.0034786115886829803, 10225.016822869282, -0.2281, -4.2677, -3.9864, 2019-06-21T02:59:03, 1561085943000, 1h
null, ABBC Coin, ABBC, ETH, coinmarketcap, 0.0006458672848090027, 151356.73859721055, -1.4044, -2.2293, -11.3938, 2019-06-21T02:59:09, 1561085949000, 1h
null, TrueChain, TRUE, ETH, coinmarketcap, 0.0036519992328570183, 247675.88623889608, -0.0283, 0.4199, -8.9175, 2019-06-21T02:59:06, 1561085946000, 1h
null, Horizen, ZEN, ETH, coinmarketcap, 0.039442179838361055, 3143.1987744195744, 0.1314, -5.9403, -4.766, 2019-06-21T02:59:04, 1561085944000, 1h
null, NULS, NULS, ETH, coinmarketcap, 0.0036536501602333713, 58133.751630087776, 0.5374, -5.4193, 3.1661, 2019-06-21T02:59:04, 1561085944000, 1h
null, Nebulas, NAS, ETH, coinmarketcap, 0.005317622500257405, 20216.329646822665, 0.2223, -6.4837, -14.9454, 2019-06-21T02:59:04, 1561085944000, 1h
null, Grin, GRIN, ETH, coinmarketcap, 0.019159399219779445, 142710.1921750691, -0.5102, -12.356, 33.2542, 2019-06-21T02:59:10, 1561085950000, 1h
null, Energi, NRG, ETH, coinmarketcap, 0.014952668387215826, 886.7860560237914, -5.5177, -3.2842, -0.726, 2019-06-21T02:59:09, 1561085949000, 1h
null, Project Pai, PAI, ETH, coinmarketcap, 0.0001690968293533172, 6004.404642540654, -0.1797, -7.6028, -13.8413, 2019-06-21T02:59:07, 1561085947000, 1h
null, ReddCoin, RDD, ETH, coinmarketcap, 0.00000805788829679383, 1526.5342161302106, 1.5353, 3.3825, 18.1417, 2019-06-21T02:59:01, 1561085941000, 1h
null, Ark, ARK, ETH, coinmarketcap, 0.0019431925722188956, 3575.492241243225, 0.1072, -6.7355, -14.3989, 2019-06-21T02:59:03, 1561085943000, 1h
null, Elastos, ELA, ETH, coinmarketcap, 0.013632163027088551, 15391.383282674477, -2.9471, -3.5128, -3.6544, 2019-06-21T02:59:06, 1561085946000, 1h
null, Thunder Token, TT, ETH, coinmarketcap, 0.00007132623111853436, 34406.85979076177, -0.173, -4.8227, -11.9569, 2019-06-21T02:59:11, 1561085951000, 1h
null, Electroneum, ETN, ETH, coinmarketcap, 0.000021030619889670133, 973.8006140308246, 0.1143, -6.1882, 7.0828, 2019-06-21T02:59:05, 1561085945000, 1h
null, WaykiChain, WICC, ETH, coinmarketcap, 0.0010656082309525217, 10160.15078978912, 0.7966, -2.2509, 1.839, 2019-06-21T02:59:05, 1561085945000, 1h
null, Factom, FCT, ETH, coinmarketcap, 0.02070324123392543, 9257.029927471467, -0.6915, -9.2309, -10.6496, 2019-06-21T02:59:03, 1561085943000, 1h
null, Theta Fuel, TFUEL, ETH, coinmarketcap, 0.00004755108139543328, 40236.02761833884, 1.2612, 3.9209, -7.2912, 2019-06-21T02:59:10, 1561085950000, 1h
null, Aion, AION, ETH, coinmarketcap, 0.0005713702396668893, 8344.49098668336, 1.1907, -4.1043, -20.4627, 2019-06-21T02:59:04, 1561085944000, 1h
null, Ether Zero, ETZ, ETH, coinmarketcap, 0.001039085090151064, 9504.910402689471, 0.144, -1.9862, -6.8203, 2019-06-21T02:59:07, 1561085947000, 1h
null, MOAC, MOAC, ETH, coinmarketcap, 0.002610873481757552, 202.0264651456759, 2.8695, 3.4696, -14.2943, 2019-06-21T02:59:05, 1561085945000, 1h
null, Newton, NEW, ETH, coinmarketcap, 0.000013413221668242352, 41792.533329194914, 1.19, -0.4312, -3.582, 2019-06-21T02:59:11, 1561085951000, 1h
null, IPChain, IPC, ETH, coinmarketcap, 0.0020384891386874136, 12116.740474861694, -1.6742, -7.9534, 9.8148, 2019-06-21T02:59:05, 1561085945000, 1h
null, Wanchain, WAN, ETH, coinmarketcap, 0.0014634496983745445, 9124.688278493111, -0.3731, -7.2944, -21.365, 2019-06-21T02:59:06, 1561085946000, 1h
null, PIVX, PIVX, ETH, coinmarketcap, 0.002729266782688077, 3062.294041306101, 0.295, -6.1439, -6.0955, 2019-06-21T02:59:03, 1561085943000, 1h
null, Metadium, META, ETH, coinmarketcap, 0.00012245398549701975, 28821.145368215057, -0.2427, -1.885, -1.1624, 2019-06-21T02:59:09, 1561085949000, 1h
null, TomoChain, TOMO, ETH, coinmarketcap, 0.002319928345053165, 7843.832454722102, 0.6459, -6.653, 12.1598, 2019-06-21T02:59:06, 1561085946000, 1h
null, Nxt, NXT, ETH, coinmarketcap, 0.00013820982712183137, 6356.1218097228275, 1.0817, -4.4425, -3.1944, 2019-06-21T02:59:01, 1561085941000, 1h
null, Beam, BEAM, ETH, coinmarketcap, 0.005341826544890254, 93801.1389354858, -2.4921, -2.4147, 109.0801, 2019-06-21T02:59:10, 1561085950000, 1h
null, CyberMiles, CMT, ETH, coinmarketcap, 0.00015653923548889187, 32430.008933831778, 0.2566, -9.5865, -9.9949, 2019-06-21T02:59:05, 1561085945000, 1h
null, Groestlcoin, GRS, ETH, coinmarketcap, 0.001582885057056708, 5781.760430379615, 1.3449, -3.0605, -7.9582, 2019-06-21T02:59:02, 1561085942000, 1h
null, Syscoin, SYS, ETH, coinmarketcap, 0.00020053685137311217, 2397.433170675893, 1.2277, -9.2432, -22.0738, 2019-06-21T02:59:02, 1561085942000, 1h
null, CasinoCoin, CSC, ETH, coinmarketcap, 0.000002743966469121623, 363.94676678065167, -0.7021, -6.5919, -16.9272, 2019-06-21T02:59:01, 1561085941000, 1h
null, Vertcoin, VTC, ETH, coinmarketcap, 0.0020647034462408387, 4844.003946366634, 0.5167, -1.0543, -0.4319, 2019-06-21T02:59:01, 1561085941000, 1h
null, #MetaHash, MHC, ETH, coinmarketcap, 0.0000843975204866489, 606.4855114718063, -0.1945, -1.8454, -9.8678, 2019-06-21T02:59:10, 1561085950000, 1h
null, BHPCoin, BHP, ETH, coinmarketcap, 0.0058838480343131275, 25882.72754755831, 0.9468, 3.3913, -3.9421, 2019-06-21T02:59:08, 1561085948000, 1h
null, Skycoin, SKY, ETH, coinmarketcap, 0.006304397356714904, 2073.532324177003, -0.0375, -3.316, -0.4677, 2019-06-21T02:59:03, 1561085943000, 1h
null, Einsteinium, EMC2, ETH, coinmarketcap, 0.0004235454193738006, 6008.302817219738, 0.2778, -5.5412, -13.777, 2019-06-21T02:59:01, 1561085941000, 1h
null, Obyte, GBYTE, ETH, coinmarketcap, 0.12936139467631652, 223.5516293448987, 4.0557, -2.2751, -10.5338, 2019-06-21T02:59:03, 1561085943000, 1h
null, BOScoin, BOS, ETH, coinmarketcap, 0.00014703310479925486, 278.20693463752946, -1.3032, 6.994, 88.6008, 2019-06-21T02:59:05, 1561085945000, 1h
null, Quantum Resistant Ledger, QRL, ETH, coinmarketcap, 0.0013001093408555146, 111.98006829644265, -0.0487, -0.9502, 2.6257, 2019-06-21T02:59:04, 1561085944000, 1h
null, Nexus, NXS, ETH, coinmarketcap, 0.0013612370663803868, 2294.2024849886648, 0.1873, -0.1363, -3.4909, 2019-06-21T02:59:02, 1561085942000, 1h
null, High Performance Blockchain, HPB, ETH, coinmarketcap, 0.001968022816105729, 15297.640272763181, 0.2396, 1.5193, 9.9679, 2019-06-21T02:59:05, 1561085945000, 1h
null, IRISnet, IRIS, ETH, coinmarketcap, 0.0002617970434455216, 9306.731972671507, 0.8979, 1.0699, -1.223, 2019-06-21T02:59:11, 1561085951000, 1h
null, Pirate Chain, ARRR, ETH, coinmarketcap, 0.0007809091151619682, 24.814055297925634, 0.6994, -8.079, 27.1235, 2019-06-21T02:59:11, 1561085951000, 1h
null, PLATINCOIN, PLC, ETH, coinmarketcap, 0.11422386778006205, 11756.151597494178, -0.2396, -2.4004, 1.8723, 2019-06-21T02:59:09, 1561085949000, 1h
null, Particl, PART, ETH, coinmarketcap, 0.009608746160956888, 293.56095286850547, 2.8184, -2.2478, -23.1113, 2019-06-21T02:59:04, 1561085944000, 1h
null, Apollo Currency, APL, ETH, coinmarketcap, 0.000005195765222688903, 163.74875892479358, 1.0752, -10.184, -18.9833, 2019-06-21T02:59:08, 1561085948000, 1h
null, TTC, TTC, ETH, coinmarketcap, 0.0003647331259663142, 11033.111338545352, -0.298, -5.7094, -13.0869, 2019-06-21T02:59:09, 1561085949000, 1h
null, SaluS, SLS, ETH, coinmarketcap, 0.0697170811434597, 29.37869461928634, -1.9947, 2.8216, 5.5794, 2019-06-21T02:59:03, 1561085943000, 1h
null, Lightning Bitcoin, LBTC, ETH, coinmarketcap, 0.01764265491545971, 25239.067162417716, -0.4607, -2.5127, -9.9698, 2019-06-21T02:59:05, 1561085945000, 1h
null, ILCoin, ILC, ETH, coinmarketcap, 0.00022089606474223219, 3813.296093786559, -0.4359, -2.772, -4.4945, 2019-06-21T02:59:10, 1561085950000, 1h
null, Neblio, NEBL, ETH, coinmarketcap, 0.0041815708705223225, 2446.955343017478, -1.7097, -6.6553, -18.8451, 2019-06-21T02:59:04, 1561085944000, 1h