id, name, base, counter, api, priceUSD, volume24h, percentChange1h,percentChange24h, percentChange7d, dateTimeUSD, milisec, timeframe
null, Bitcoin, BTC, USD, coinmarketcap, 11059.5206238, 20477344508.5467, 0.667902, 4.09078, 21.7394, 2019-06-23T23:59:27, 1561334367000, 1h
null, Ethereum, ETH, USD, coinmarketcap, 314.985551871, 7983478839.55532, 0.401868, 3.17318, 16.4443, 2019-06-23T23:59:21, 1561334361000, 1h
null, XRP, XRP, USD, coinmarketcap, 0.479945783779, 2092010155.1676, 0.622995, 1.29535, 12.3731, 2019-06-23T23:59:03, 1561334343000, 1h
null, Litecoin, LTC, USD, coinmarketcap, 139.978279829, 3954548865.33747, -0.233889, -1.12545, 2.57417, 2019-06-23T23:59:04, 1561334344000, 1h
null, Bitcoin Cash, BCH, USD, coinmarketcap, 487.82229194, 2321098401.52281, 0.965067, 2.20709, 13.5457, 2019-06-23T23:59:04, 1561334344000, 1h
null, EOS, EOS, USD, coinmarketcap, 7.41521065927, 2382651580.7026, 0.175871, -0.510249, 5.63848, 2019-06-23T23:59:04, 1561334344000, 1h
null, Binance Coin, BNB, USD, coinmarketcap, 37.3179718737, 363650474.331502, -0.525949, -2.43872, 14.8945, 2019-06-23T23:59:04, 1561334344000, 1h
null, Bitcoin SV, BSV, USD, coinmarketcap, 240.21827609, 454964948.678301, 0.148749, 0.466308, 13.0588, 2019-06-23T23:59:08, 1561334348000, 1h
null, Cardano, ADA, USD, coinmarketcap, 0.0980583375303, 243422893.156343, 0.610288, 3.29005, 6.24514, 2019-06-23T23:59:03, 1561334343000, 1h
null, Stellar, XLM, USD, coinmarketcap, 0.130295663508, 400972483.117484, 0.021737, 0.367441, 0.519684, 2019-06-23T23:59:02, 1561334342000, 1h
null, TRON, TRX, USD, coinmarketcap, 0.0377898180613, 795085626.275271, -0.19134, 3.07355, 13.9893, 2019-06-23T23:59:04, 1561334344000, 1h
null, Monero, XMR, USD, coinmarketcap, 118.966838187, 131287037.171107, 0.518571, 4.20597, 23.4606, 2019-06-23T23:59:02, 1561334342000, 1h
null, Dash, DASH, USD, coinmarketcap, 178.539344366, 367187079.611065, 0.77477, 1.63772, 13.3559, 2019-06-23T23:59:01, 1561334341000, 1h
null, Cosmos, ATOM, USD, coinmarketcap, 6.89691471572, 66215157.6296658, -0.60159, 3.58657, 6.06406, 2019-06-23T23:59:07, 1561334347000, 1h
null, IOTA, MIOTA, USD, coinmarketcap, 0.465176823034, 29130260.6464896, 0.108352, 0.854288, 3.42356, 2019-06-23T23:59:02, 1561334342000, 1h
null, NEO, NEO, USD, coinmarketcap, 17.0166590232, 767056172.94634, -0.580425, -1.5581, 20.5846, 2019-06-23T23:59:03, 1561334343000, 1h
null, Ethereum Classic, ETC, USD, coinmarketcap, 9.43143744637, 951549852.013953, 0.467301, 3.51511, 7.7353, 2019-06-23T23:59:03, 1561334343000, 1h
null, NEM, XEM, USD, coinmarketcap, 0.0920363939359, 33715518.2736327, 0.0270232, 0.195158, 4.13862, 2019-06-23T23:59:01, 1561334341000, 1h
null, Tezos, XTZ, USD, coinmarketcap, 1.19121846702, 5124554.66657076, -0.218335, -1.605, -7.52137, 2019-06-23T23:59:03, 1561334343000, 1h
null, Ontology, ONT, USD, coinmarketcap, 1.56003953427, 160960701.451666, -1.72481, -1.37265, 7.39513, 2019-06-23T23:59:05, 1561334345000, 1h
null, Zcash, ZEC, USD, coinmarketcap, 112.338914906, 410783766.589475, -0.218968, -0.636741, 19.1335, 2019-06-23T23:59:02, 1561334342000, 1h
null, Bitcoin Gold, BTG, USD, coinmarketcap, 31.2336133672, 23067490.9174594, 0.426214, 1.99244, 13.8889, 2019-06-23T23:59:03, 1561334343000, 1h
null, Dogecoin, DOGE, USD, coinmarketcap, 0.00335274392739, 41882149.651806, 0.603208, 2.5357, 4.76401, 2019-06-23T23:59:02, 1561334342000, 1h
null, VeChain, VET, USD, coinmarketcap, 0.00713438980614, 40142093.4772168, -1.58615, -0.0795772, -2.56921, 2019-06-23T23:59:06, 1561334346000, 1h
null, Qtum, QTUM, USD, coinmarketcap, 3.95640867084, 255836209.573505, 0.120915, 0.939008, 7.14301, 2019-06-23T23:59:03, 1561334343000, 1h
null, Decred, DCR, USD, coinmarketcap, 34.0819222396, 29112515.1035228, 3.90874, 11.5193, 20.9772, 2019-06-23T23:59:01, 1561334341000, 1h
null, Lisk, LSK, USD, coinmarketcap, 2.12247727981, 11031836.7834366, 0.743291, 0.901434, 0.29406, 2019-06-23T23:59:01, 1561334341000, 1h
null, Bitcoin Diamond, BCD, USD, coinmarketcap, 1.33418132052, 8595001.91622123, 0.154076, -0.978689, 7.15813, 2019-06-23T23:59:03, 1561334343000, 1h
null, Ravencoin, RVN, USD, coinmarketcap, 0.0626775661246, 21114259.1535434, -0.430718, -4.89682, 0.0727343, 2019-06-23T23:59:05, 1561334345000, 1h
null, Waves, WAVES, USD, coinmarketcap, 2.36206182556, 17684917.0026353, 0.37101, -2.49425, -2.27428, 2019-06-23T23:59:02, 1561334342000, 1h
null, Nano, NANO, USD, coinmarketcap, 1.5069807735, 7266400.60593419, -0.590301, -1.13266, -4.07154, 2019-06-23T23:59:02, 1561334342000, 1h
null, Bytom, BTM, USD, coinmarketcap, 0.19509593684, 23934859.9828851, 0.327926, 1.29797, 1.12023, 2019-06-23T23:59:02, 1561334342000, 1h
null, Bytecoin, BCN, USD, coinmarketcap, 0.00100734384367, 76977.2500569907, -0.577672, -1.96716, -1.10488, 2019-06-23T23:59, 1561334340000, 1h
null, BitShares, BTS, USD, coinmarketcap, 0.0662296306942, 7244820.9951943, 0.495912, 3.51626, 3.98137, 2019-06-23T23:59:01, 1561334341000, 1h
null, MonaCoin, MONA, USD, coinmarketcap, 2.64193063353, 15395649.1426632, 1.31908, -0.50111, 29.2272, 2019-06-23T23:59, 1561334340000, 1h
null, DigiByte, DGB, USD, coinmarketcap, 0.0139840169049, 1319349.822382, -0.222276, -3.64239, 8.82488, 2019-06-23T23:59, 1561334340000, 1h
null, HyperCash, HC, USD, coinmarketcap, 3.75645080694, 13199956.5792878, -0.0464823, -1.42364, 42.0072, 2019-06-23T23:59:02, 1561334342000, 1h
null, ICON, ICX, USD, coinmarketcap, 0.339318547682, 12511528.3516563, -0.402898, -2.12297, -8.42827, 2019-06-23T23:59:03, 1561334343000, 1h
null, GXChain, GXC, USD, coinmarketcap, 2.64909024336, 43857304.2591002, 0.0669366, 11.8076, 15.9565, 2019-06-23T23:59:02, 1561334342000, 1h
null, Komodo, KMD, USD, coinmarketcap, 1.37970087802, 8292221.34384226, -2.6103, -2.33057, -13.8839, 2019-06-23T23:59:02, 1561334342000, 1h
null, Verge, XVG, USD, coinmarketcap, 0.00952213668998, 7038936.0907267, -1.37234, 4.85476, 3.07417, 2019-06-23T23:59:01, 1561334341000, 1h
null, Aeternity, AE, USD, coinmarketcap, 0.523829875232, 42455269.6075737, 0.618707, -0.763429, -1.48312, 2019-06-23T23:59:02, 1561334342000, 1h
null, Siacoin, SC, USD, coinmarketcap, 0.00327912225855, 2590954.55478138, 0.598222, 4.04878, 2.32898, 2019-06-23T23:59:01, 1561334341000, 1h
null, Steem, STEEM, USD, coinmarketcap, 0.418837500208, 1978734.09226917, 0.464128, 4.56844, 0.267162, 2019-06-23T23:59:01, 1561334341000, 1h
null, Metaverse ETP, ETP, USD, coinmarketcap, 1.84730378975, 23202626.9164442, -1.68887, -3.40659, -1.19276, 2019-06-23T23:59:02, 1561334342000, 1h
null, ABBC Coin, ABBC, USD, coinmarketcap, 0.237391983763, 56718726.9981772, 2.88958, -4.1294, 25.3635, 2019-06-23T23:59:07, 1561334347000, 1h
null, Ardor, ARDR, USD, coinmarketcap, 0.118738396117, 2430644.61211509, 0.595974, 1.05239, 14.3544, 2019-06-23T23:59:02, 1561334342000, 1h
null, THETA, THETA, USD, coinmarketcap, 0.132801215815, 3577016.41089584, -0.250653, 0.132366, 2.58378, 2019-06-23T23:59:04, 1561334344000, 1h
null, Energi, NRG, USD, coinmarketcap, 5.83652347156, 868009.655396846, 1.14016, 12.9684, 43.1636, 2019-06-23T23:59:07, 1561334347000, 1h
null, Zcoin, XZC, USD, coinmarketcap, 12.9854297163, 4888972.55432119, -0.197104, 0.152659, 11.9808, 2019-06-23T23:59:02, 1561334342000, 1h
null, Stratis, STRAT, USD, coinmarketcap, 0.962608134502, 3155564.74133036, 0.133018, 1.65972, -8.94921, 2019-06-23T23:59:01, 1561334341000, 1h
null, Grin, GRIN, USD, coinmarketcap, 6.15397369714, 55689320.712031, -2.61647, 16.7697, 25.3158, 2019-06-23T23:59:08, 1561334348000, 1h
null, Nebulas, NAS, USD, coinmarketcap, 1.71637039476, 14733684.8206444, -1.15454, 12.0415, 9.15374, 2019-06-23T23:59:03, 1561334343000, 1h
null, TrueChain, TRUE, USD, coinmarketcap, 0.998007940437, 56720580.6297125, 0.147921, -1.04596, -4.74031, 2019-06-23T23:59:04, 1561334344000, 1h
null, Project Pai, PAI, USD, coinmarketcap, 0.0509920560214, 2742055.68912453, 0.352415, 5.06414, -4.10779, 2019-06-23T23:59:05, 1561334345000, 1h
null, Horizen, ZEN, USD, coinmarketcap, 10.7621610191, 789578.466965335, -1.3769, 0.981449, 4.40369, 2019-06-23T23:59:02, 1561334342000, 1h
null, ReddCoin, RDD, USD, coinmarketcap, 0.00239438912582, 465806.6976526, 3.13421, 0.375031, 23.1994, 2019-06-23T23:59, 1561334340000, 1h
null, NULS, NULS, USD, coinmarketcap, 0.934716852137, 10207037.083704, -0.523979, -2.91183, -3.03125, 2019-06-23T23:59:03, 1561334343000, 1h
null, Elastos, ELA, USD, coinmarketcap, 4.12496115263, 9223872.30131923, 0.503555, 8.1537, 5.34689, 2019-06-23T23:59:04, 1561334344000, 1h
null, Electroneum, ETN, USD, coinmarketcap, 0.00602751355199, 302169.014959297, -0.133337, 6.75536, -3.19243, 2019-06-23T23:59:03, 1561334343000, 1h
null, Ark, ARK, USD, coinmarketcap, 0.512992275094, 996086.084331777, -0.919567, -0.459393, -10.5037, 2019-06-23T23:59:02, 1561334342000, 1h
null, Factom, FCT, USD, coinmarketcap, 5.75909177849, 204248.238291745, -1.03463, 0.719611, -1.11794, 2019-06-23T23:59:01, 1561334341000, 1h
null, Beam, BEAM, USD, coinmarketcap, 2.31598383656, 49207169.3067396, -6.11703, 59.417, 150.017, 2019-06-23T23:59:07, 1561334347000, 1h
null, WaykiChain, WICC, USD, coinmarketcap, 0.283878326659, 2221339.42462674, -0.405324, -0.661714, 5.00826, 2019-06-23T23:59:03, 1561334343000, 1h
null, Thunder Token, TT, USD, coinmarketcap, 0.0178027276525, 9898862.28203579, -0.360574, -0.408391, -10.446, 2019-06-23T23:59:07, 1561334347000, 1h
null, Aion, AION, USD, coinmarketcap, 0.143316755391, 1991321.23439467, -0.404366, -2.81269, -18.7095, 2019-06-23T23:59:03, 1561334343000, 1h
null, Ether Zero, ETZ, USD, coinmarketcap, 0.266527754917, 2385974.42943764, 0.344773, 0.0713387, -2.64894, 2019-06-23T23:59:05, 1561334345000, 1h
null, Newton, NEW, USD, coinmarketcap, 0.00360414135083, 8587294.96211389, 0.128035, 2.5473, -3.37807, 2019-06-23T23:59:07, 1561334347000, 1h
null, Theta Fuel, TFUEL, USD, coinmarketcap, 0.0110045110912, 3923812.85183693, -0.0516328, -3.47169, -8.66721, 2019-06-23T23:59:08, 1561334348000, 1h
null, Metadium, META, USD, coinmarketcap, 0.0334709013286, 2440830.92676362, 0.795949, 8.53569, 3.97288, 2019-06-23T23:59:06, 1561334346000, 1h
null, MOAC, MOAC, USD, coinmarketcap, 0.659710438922, 23053.8360594536, 0.548767, -1.82208, -9.2557, 2019-06-23T23:59:04, 1561334344000, 1h
null, PIVX, PIVX, USD, coinmarketcap, 0.724437195727, 619108.545837658, 1.21273, 0.556263, -5.0776, 2019-06-23T23:59:01, 1561334341000, 1h
null, IPChain, IPC, USD, coinmarketcap, 0.52287114251, 2026113.270208, -0.186915, -2.50864, -4.76681, 2019-06-23T23:59:04, 1561334344000, 1h
null, Wanchain, WAN, USD, coinmarketcap, 0.373064206762, 1716518.67700618, -0.789542, -5.37656, -14.5683, 2019-06-23T23:59:05, 1561334345000, 1h
null, Nxt, NXT, USD, coinmarketcap, 0.0388766296565, 1161946.80777731, 0.314394, 1.43744, 8.40109, 2019-06-23T23:59, 1561334340000, 1h
null, TomoChain, TOMO, USD, coinmarketcap, 0.631241371515, 1873978.9891126, 0.928186, 0.148961, 19.1446, 2019-06-23T23:59:04, 1561334344000, 1h
null, CyberMiles, CMT, USD, coinmarketcap, 0.0466959522487, 11929173.9950037, -0.646949, 5.05033, -9.78175, 2019-06-23T23:59:03, 1561334343000, 1h
null, CasinoCoin, CSC, USD, coinmarketcap, 0.000867493826575, 50054.9931617022, 1.88145, 19.3079, 4.20726, 2019-06-23T23:59, 1561334340000, 1h
null, Unobtanium, UNO, USD, coinmarketcap, 160.174120749, 869.300610357941, -0.567512, 4.03419, 21.8618, 2019-06-23T23:59, 1561334340000, 1h
null, PLATINCOIN, PLC, USD, coinmarketcap, 45.647007146, 4618816.23323851, 0.821054, 22.9605, 49.6912, 2019-06-23T23:59:06, 1561334346000, 1h
null, Groestlcoin, GRS, USD, coinmarketcap, 0.423081172983, 1250149.89028744, -0.201824, -1.57802, -2.36836, 2019-06-23T23:59:01, 1561334341000, 1h
null, Vertcoin, VTC, USD, coinmarketcap, 0.612631473104, 536790.062389842, 0.182041, 4.95733, 13.1757, 2019-06-23T23:59, 1561334340000, 1h
null, Skycoin, SKY, USD, coinmarketcap, 1.92724563064, 684662.178896233, 0.933819, 1.57989, 19.1788, 2019-06-23T23:59:01, 1561334341000, 1h
null, Syscoin, SYS, USD, coinmarketcap, 0.0507065573239, 351015.118422244, -1.25637, -4.925, -16.3388, 2019-06-23T23:59, 1561334340000, 1h
null, Pirate Chain, ARRR, USD, coinmarketcap, 0.268694061452, 44951.3784445977, -1.7694, 12.4661, 41.7318, 2019-06-23T23:59:09, 1561334349000, 1h
null, #MetaHash, MHC, USD, coinmarketcap, 0.0226115477639, 233614.800750956, -0.325265, -0.185689, -5.11614, 2019-06-23T23:59:07, 1561334347000, 1h
null, BHPCoin, BHP, USD, coinmarketcap, 1.60870330707, 6521927.49970261, -0.470043, -1.13851, 0.0898844, 2019-06-23T23:59:06, 1561334346000, 1h
null, Obyte, GBYTE, USD, coinmarketcap, 37.2310935883, 32162.6276925672, 0.34741, 10.7132, -0.539163, 2019-06-23T23:59:01, 1561334341000, 1h
null, Einsteinium, EMC2, USD, coinmarketcap, 0.112990651438, 790720.930516978, -0.322123, 1.76314, -5.52092, 2019-06-23T23:59, 1561334340000, 1h
null, BOScoin, BOS, USD, coinmarketcap, 0.0389910346164, 35252.3316929274, 0.619541, 3.98691, 74.8329, 2019-06-23T23:59:03, 1561334343000, 1h
null, Nexus, NXS, USD, coinmarketcap, 0.373563314045, 339204.520798903, -3.61648, -2.12661, 5.93161, 2019-06-23T23:59:01, 1561334341000, 1h
null, IRISnet, IRIS, USD, coinmarketcap, 0.0684825190894, 1639914.11897433, -0.797956, 0.180967, 0.464924, 2019-06-23T23:59:07, 1561334347000, 1h
null, SaluS, SLS, USD, coinmarketcap, 22.1593184947, 8861.56926255187, -0.113043, 7.723, 26.7949, 2019-06-23T23:59:01, 1561334341000, 1h
null, TTC, TTC, USD, coinmarketcap, 0.11090603419, 1727870.60688488, 0.198072, 10.9171, 0.32483, 2019-06-23T23:59:06, 1561334346000, 1h
null, High Performance Blockchain, HPB, USD, coinmarketcap, 0.502953047617, 5633855.60781058, -0.111832, 3.33525, -2.32402, 2019-06-23T23:59:04, 1561334344000, 1h
null, Quantum Resistant Ledger, QRL, USD, coinmarketcap, 0.320780637643, 24718.1141404593, 0.201476, -2.84996, -11.5735, 2019-06-23T23:59:02, 1561334342000, 1h
null, Apollo Currency, APL, USD, coinmarketcap, 0.00143103456362, 21131.3199064729, 0.980694, -3.85834, -16.506, 2019-06-23T23:59:06, 1561334346000, 1h
null, Particl, PART, USD, coinmarketcap, 2.40222602399, 149777.373441774, -0.150627, -3.69132, -10.702, 2019-06-23T23:59:02, 1561334342000, 1h
null, VeriBlock, VBK, USD, coinmarketcap, 0.0388185659824, 740951.692891775, 0.503058, 3.82281, 16.7872, 2019-06-23T23:59:08, 1561334348000, 1h
null, Achain, ACT, USD, coinmarketcap, 0.020137255021, 1986533.35521881, -1.68257, 4.17085, 7.03514, 2019-06-23T23:59:02, 1561334342000, 1h