id, name, base, counter, api, priceUSD, volume24h, percentChange1h,percentChange24h, percentChange7d, dateTimeUSD, milisec, timeframe
null, Bitcoin, BTC, USD, coinmarketcap, 11145.406491, 19411226617.9694, -0.0633256, 4.1967, 20.3967, 2019-06-25T06:59:30, 1561445970000, 1h
null, Ethereum, ETH, USD, coinmarketcap, 311.012952052, 7992444220.13652, -0.336941, 2.23411, 14.6091, 2019-06-25T06:59:23, 1561445963000, 1h
null, XRP, XRP, USD, coinmarketcap, 0.46644471462, 1469684774.09988, -0.700515, 1.7194, 4.6181, 2019-06-25T06:59:03, 1561445943000, 1h
null, Bitcoin Cash, BCH, USD, coinmarketcap, 480.25886799, 1790893221.09508, -0.416852, 2.17799, 12.6349, 2019-06-25T06:59:04, 1561445944000, 1h
null, Litecoin, LTC, USD, coinmarketcap, 136.059956541, 3999923232.36632, -0.0716335, 0.664706, 2.33343, 2019-06-25T06:59:04, 1561445944000, 1h
null, EOS, EOS, USD, coinmarketcap, 7.25948953582, 2188469909.84404, -0.145443, 1.65348, 2.87128, 2019-06-25T06:59:03, 1561445943000, 1h
null, Binance Coin, BNB, USD, coinmarketcap, 36.9015447544, 326183288.565992, 0.0407155, 0.909447, 7.27134, 2019-06-25T06:59:03, 1561445943000, 1h
null, Bitcoin SV, BSV, USD, coinmarketcap, 236.963828269, 390512850.949027, 0.306012, 1.61941, 6.3334, 2019-06-25T06:59:11, 1561445951000, 1h
null, TRON, TRX, USD, coinmarketcap, 0.0384520017523, 952894215.39043, 0.145265, 3.10885, 14.4409, 2019-06-25T06:59:06, 1561445946000, 1h
null, Cardano, ADA, USD, coinmarketcap, 0.0977621922826, 133562367.332545, 0.635489, 2.99976, 6.17637, 2019-06-25T06:59:04, 1561445944000, 1h
null, Stellar, XLM, USD, coinmarketcap, 0.12807000108, 400947436.838437, -0.109264, 1.67643, -1.21729, 2019-06-25T06:59:01, 1561445941000, 1h
null, Monero, XMR, USD, coinmarketcap, 116.086406526, 132186135.253281, -0.596696, 2.24913, 18.0131, 2019-06-25T06:59:01, 1561445941000, 1h
null, Dash, DASH, USD, coinmarketcap, 176.741893204, 327825799.616954, -0.27714, 2.03211, 10.8644, 2019-06-25T06:59:03, 1561445943000, 1h
null, Cosmos, ATOM, USD, coinmarketcap, 6.66172265032, 58497789.1353787, -0.417659, 0.150372, -2.85707, 2019-06-25T06:59:12, 1561445952000, 1h
null, IOTA, MIOTA, USD, coinmarketcap, 0.453561446167, 21905693.6567877, -0.416391, 2.04911, 3.80528, 2019-06-25T06:59:03, 1561445943000, 1h
null, NEO, NEO, USD, coinmarketcap, 17.5696283751, 681999856.487498, -1.1788, 4.46263, 26.2482, 2019-06-25T06:59:02, 1561445942000, 1h
null, Ethereum Classic, ETC, USD, coinmarketcap, 9.1718287459, 744288882.844601, -0.728646, 1.48328, 5.32381, 2019-06-25T06:59:02, 1561445942000, 1h
null, NEM, XEM, USD, coinmarketcap, 0.0922508537933, 26341936.8112341, -1.00054, 2.75823, 3.76285, 2019-06-25T06:59:01, 1561445941000, 1h
null, Ontology, ONT, USD, coinmarketcap, 1.61435021964, 158818233.77779, 0.547609, 6.07484, 7.38199, 2019-06-25T06:59:06, 1561445946000, 1h
null, Tezos, XTZ, USD, coinmarketcap, 1.16957145169, 5684790.96320947, -0.0977523, 0.0333276, -10.5488, 2019-06-25T06:59:04, 1561445944000, 1h
null, Zcash, ZEC, USD, coinmarketcap, 107.610979444, 324071064.574867, -0.507474, 0.787175, 4.21533, 2019-06-25T06:59:03, 1561445943000, 1h
null, VeChain, VET, USD, coinmarketcap, 0.00975148428233, 125985555.134735, 35.8245, 36.8414, 33.5173, 2019-06-25T06:59:09, 1561445949000, 1h
null, Bitcoin Gold, BTG, USD, coinmarketcap, 30.3676779139, 18181692.9854057, -0.176978, 0.659417, 9.87883, 2019-06-25T06:59:04, 1561445944000, 1h
null, Qtum, QTUM, USD, coinmarketcap, 4.25481115959, 270145420.704003, -0.570241, 11.8224, 18.3741, 2019-06-25T06:59:03, 1561445943000, 1h
null, Dogecoin, DOGE, USD, coinmarketcap, 0.0033659395214, 41989771.1207376, -0.382213, 2.79094, 5.98081, 2019-06-25T06:59:02, 1561445942000, 1h
null, Decred, DCR, USD, coinmarketcap, 31.2256422383, 19519853.0719231, -1.29911, -7.22731, 6.64521, 2019-06-25T06:59:02, 1561445942000, 1h
null, Bitcoin Diamond, BCD, USD, coinmarketcap, 1.33193435421, 7845874.37008829, -0.590935, 2.71679, -1.17826, 2019-06-25T06:59:05, 1561445945000, 1h
null, Lisk, LSK, USD, coinmarketcap, 2.09296982836, 10583022.0912772, 0.165366, 0.0221214, 1.06078, 2019-06-25T06:59:02, 1561445942000, 1h
null, Ravencoin, RVN, USD, coinmarketcap, 0.0634581773562, 28297105.8004839, -0.285737, -3.31712, 3.62403, 2019-06-25T06:59:07, 1561445947000, 1h
null, Waves, WAVES, USD, coinmarketcap, 2.36396160877, 14976671.5927538, -0.296432, 0.833947, -2.33735, 2019-06-25T06:59:02, 1561445942000, 1h
null, Bytecoin, BCN, USD, coinmarketcap, 0.00107776002037, 51541.9219610862, 4.12733, 5.26666, 4.42563, 2019-06-25T06:59:01, 1561445941000, 1h
null, Nano, NANO, USD, coinmarketcap, 1.47404141074, 4579683.88955967, 0.365786, 0.330651, -4.99874, 2019-06-25T06:59:02, 1561445942000, 1h
null, BitShares, BTS, USD, coinmarketcap, 0.0704736252117, 16058540.3357165, -1.3406, 8.71868, 11.3263, 2019-06-25T06:59:02, 1561445942000, 1h
null, MonaCoin, MONA, USD, coinmarketcap, 2.92097618724, 21054781.2030685, 6.25726, 9.72485, 24.2175, 2019-06-25T06:59:01, 1561445941000, 1h
null, HyperCash, HC, USD, coinmarketcap, 4.36520417927, 16703676.4662379, -0.789714, 18.1447, 52.2591, 2019-06-25T06:59:03, 1561445943000, 1h
null, Bytom, BTM, USD, coinmarketcap, 0.18860033807, 34617747.51, -0.0472726, 1.02978, -4.15683, 2019-06-25T06:59:03, 1561445943000, 1h
null, DigiByte, DGB, USD, coinmarketcap, 0.0140310718684, 1349251.45501595, -0.136802, 2.12742, 11.7712, 2019-06-25T06:59:01, 1561445941000, 1h
null, ICON, ICX, USD, coinmarketcap, 0.343473477251, 9177469.26690666, -0.148748, 1.21036, -5.00085, 2019-06-25T06:59:04, 1561445944000, 1h
null, Aeternity, AE, USD, coinmarketcap, 0.580098024447, 63176097.1664766, -2.29394, -3.98765, 9.56856, 2019-06-25T06:59:02, 1561445942000, 1h
null, Komodo, KMD, USD, coinmarketcap, 1.3668598072, 3786807.94744426, -0.542964, 1.80247, -13.7321, 2019-06-25T06:59:02, 1561445942000, 1h
null, Verge, XVG, USD, coinmarketcap, 0.00915157609062, 3162131.40482063, -1.46819, -0.0272269, -0.553838, 2019-06-25T06:59:01, 1561445941000, 1h
null, GXChain, GXC, USD, coinmarketcap, 2.41107195936, 51292854.1861934, 0.907812, -10.0307, 4.24581, 2019-06-25T06:59:03, 1561445943000, 1h
null, Metaverse ETP, ETP, USD, coinmarketcap, 1.92526854439, 30067328.615215, 0.437174, 4.56375, -0.380411, 2019-06-25T06:59:03, 1561445943000, 1h
null, Energi, NRG, USD, coinmarketcap, 7.72442866899, 1859933.31132659, 0.491381, 36.4585, 82.7592, 2019-06-25T06:59:09, 1561445949000, 1h
null, Steem, STEEM, USD, coinmarketcap, 0.416760608751, 1200753.46083735, -0.183909, 3.0718, 0.744705, 2019-06-25T06:59:02, 1561445942000, 1h
null, Siacoin, SC, USD, coinmarketcap, 0.0032166093674, 2395278.74163922, -0.783641, 1.00603, 1.0477, 2019-06-25T06:59:01, 1561445941000, 1h
null, ABBC Coin, ABBC, USD, coinmarketcap, 0.261488136602, 69549621.3132555, 1.88008, 19.4009, 44.8492, 2019-06-25T06:59:10, 1561445950000, 1h
null, Ardor, ARDR, USD, coinmarketcap, 0.123715391235, 2016719.36310714, 1.90177, 6.81121, 16.9691, 2019-06-25T06:59:02, 1561445942000, 1h
null, THETA, THETA, USD, coinmarketcap, 0.132716565587, 3947026.98865314, -0.547481, 0.978463, 2.36265, 2019-06-25T06:59:05, 1561445945000, 1h
null, Zcoin, XZC, USD, coinmarketcap, 12.6826647073, 2970865.46677127, 0.219926, -2.37565, 6.40184, 2019-06-25T06:59:02, 1561445942000, 1h
null, Stratis, STRAT, USD, coinmarketcap, 0.990684711857, 2435042.33247151, -0.141631, 4.03123, 1.04528, 2019-06-25T06:59:02, 1561445942000, 1h
null, Nebulas, NAS, USD, coinmarketcap, 1.76320592571, 23988428.7482293, -0.36265, 1.59992, 14.7395, 2019-06-25T06:59:03, 1561445943000, 1h
null, Grin, GRIN, USD, coinmarketcap, 5.87461597838, 47165206.7153462, -1.05715, 0.116928, -1.15409, 2019-06-25T06:59:11, 1561445951000, 1h
null, TrueChain, TRUE, USD, coinmarketcap, 0.972607364323, 58230236.8358494, 0.0306938, -0.054874, -6.71048, 2019-06-25T06:59:06, 1561445946000, 1h
null, Project Pai, PAI, USD, coinmarketcap, 0.0522799651189, 3373959.43604535, 0.737136, 5.17612, 2.50145, 2019-06-25T06:59:08, 1561445948000, 1h
null, Cryptonex, CNX, USD, coinmarketcap, 1.24096677367, 7296725.79262533, 0.545664, 4.78755, -16.4044, 2019-06-25T06:59:04, 1561445944000, 1h
null, Horizen, ZEN, USD, coinmarketcap, 10.2360144151, 578676.95887519, 0.160365, -0.581397, -2.35629, 2019-06-25T06:59:02, 1561445942000, 1h
null, NULS, NULS, USD, coinmarketcap, 0.966526918217, 11504702.7101612, -0.440154, 3.80064, -3.86951, 2019-06-25T06:59:04, 1561445944000, 1h
null, ReddCoin, RDD, USD, coinmarketcap, 0.0023422236262, 251052.895385384, -1.40165, 1.74776, 9.19804, 2019-06-25T06:59:01, 1561445941000, 1h
null, Elastos, ELA, USD, coinmarketcap, 4.06648794301, 6006557.13309088, 0.916393, 1.38384, 6.27048, 2019-06-25T06:59:06, 1561445946000, 1h
null, Ark, ARK, USD, coinmarketcap, 0.533748550425, 620709.834537782, -0.143456, 3.28777, -5.38091, 2019-06-25T06:59:02, 1561445942000, 1h
null, Beam, BEAM, USD, coinmarketcap, 2.40097398597, 73381987.981238, -0.466795, 4.70087, 84.4005, 2019-06-25T06:59:11, 1561445951000, 1h
null, Factom, FCT, USD, coinmarketcap, 5.90687209088, 245061.709285601, 0.771141, 4.06449, -1.23953, 2019-06-25T06:59:01, 1561445941000, 1h
null, Electroneum, ETN, USD, coinmarketcap, 0.00563837237499, 182605.880390881, -2.12764, -3.89634, -7.77929, 2019-06-25T06:59:04, 1561445944000, 1h
null, WaykiChain, WICC, USD, coinmarketcap, 0.2831658257, 2262044.9317127, 0.0398646, 2.02969, -1.87831, 2019-06-25T06:59:05, 1561445945000, 1h
null, Thunder Token, TT, USD, coinmarketcap, 0.0176518164513, 15106989.1220374, 0.242865, 1.18872, -10.9943, 2019-06-25T06:59:12, 1561445952000, 1h
null, Aion, AION, USD, coinmarketcap, 0.142316768545, 2216642.74458855, 0.148234, -1.59608, -13.2367, 2019-06-25T06:59:04, 1561445944000, 1h
null, Theta Fuel, TFUEL, USD, coinmarketcap, 0.0111422362534, 3388385.88424459, -0.92122, 1.69866, -7.36522, 2019-06-25T06:59:12, 1561445952000, 1h
null, PIVX, PIVX, USD, coinmarketcap, 0.743384267825, 610524.385948862, 0.172549, 2.0237, 1.32193, 2019-06-25T06:59:02, 1561445942000, 1h
null, Newton, NEW, USD, coinmarketcap, 0.00348772414655, 11793900.015477, -0.39623, -0.609202, -2.18219, 2019-06-25T06:59:12, 1561445952000, 1h
null, Ether Zero, ETZ, USD, coinmarketcap, 0.251673831598, 2124737.32966357, -0.401294, -5.05421, -10.8621, 2019-06-25T06:59:08, 1561445948000, 1h
null, Wanchain, WAN, USD, coinmarketcap, 0.381007429595, 1163355.50288861, 0.905585, -1.60393, -9.24496, 2019-06-25T06:59:07, 1561445947000, 1h
null, Metadium, META, USD, coinmarketcap, 0.0321132031699, 2102274.79937742, 0.0774775, -2.7368, -6.47655, 2019-06-25T06:59:10, 1561445950000, 1h
null, Nxt, NXT, USD, coinmarketcap, 0.0386845990179, 1179286.22814123, 0.078541, 2.10345, 7.90591, 2019-06-25T06:59:01, 1561445941000, 1h
null, MOAC, MOAC, USD, coinmarketcap, 0.608875104296, 46149.0812116065, 0.226084, -5.17535, -11.062, 2019-06-25T06:59:05, 1561445945000, 1h
null, CyberMiles, CMT, USD, coinmarketcap, 0.0470503390388, 8474126.93213392, 1.32911, 5.20494, 0.418414, 2019-06-25T06:59:05, 1561445945000, 1h
null, IPChain, IPC, USD, coinmarketcap, 0.475952959896, 3776554.3414893, -1.43365, -5.80989, -21.8519, 2019-06-25T06:59:06, 1561445946000, 1h
null, CasinoCoin, CSC, USD, coinmarketcap, 0.000860725072681, 39438.7377003707, 0.391724, 12.5877, 13.7288, 2019-06-25T06:59, 1561445940000, 1h
null, TomoChain, TOMO, USD, coinmarketcap, 0.536384196775, 2724945.74908986, -0.458348, -9.1112, -6.41447, 2019-06-25T06:59:06, 1561445946000, 1h
null, Groestlcoin, GRS, USD, coinmarketcap, 0.422159188758, 1175553.09339709, -0.678645, 0.267976, -2.09016, 2019-06-25T06:59:01, 1561445941000, 1h
null, Vertcoin, VTC, USD, coinmarketcap, 0.610130044527, 573339.394996043, -2.50158, 1.67893, 12.8265, 2019-06-25T06:59, 1561445940000, 1h
null, Apollo Currency, APL, USD, coinmarketcap, 0.00186401347531, 189270.737619372, 3.88128, 23.289, 12.8616, 2019-06-25T06:59:08, 1561445948000, 1h
null, Syscoin, SYS, USD, coinmarketcap, 0.0492325978802, 313686.556873531, -0.434918, -2.33426, -22.2367, 2019-06-25T06:59:01, 1561445941000, 1h
null, Pirate Chain, ARRR, USD, coinmarketcap, 0.261618379239, 9282.95052146975, -1.94777, 1.74677, 35.0685, 2019-06-25T06:59:12, 1561445952000, 1h
null, Skycoin, SKY, USD, coinmarketcap, 1.81043745493, 558418.578084528, 0.167429, 1.69883, 6.63132, 2019-06-25T06:59:02, 1561445942000, 1h
null, BHPCoin, BHP, USD, coinmarketcap, 1.66212653142, 6078233.10317554, 0.0506694, 8.27328, 5.68411, 2019-06-25T06:59:09, 1561445949000, 1h
null, #MetaHash, MHC, USD, coinmarketcap, 0.0217594222703, 206900.826132274, 0.0972992, -1.71995, -7.297, 2019-06-25T06:59:11, 1561445951000, 1h
null, Einsteinium, EMC2, USD, coinmarketcap, 0.115085037877, 1036022.12283216, 0.47485, 3.11511, -0.977519, 2019-06-25T06:59:01, 1561445941000, 1h
null, Obyte, GBYTE, USD, coinmarketcap, 34.0748668484, 51174.1094242391, -4.07155, -4.32011, -9.19173, 2019-06-25T06:59:02, 1561445942000, 1h
null, Quantum Resistant Ledger, QRL, USD, coinmarketcap, 0.340608837771, 28343.9377913431, -0.348754, 9.82134, -4.05019, 2019-06-25T06:59:02, 1561445942000, 1h
null, Nexus, NXS, USD, coinmarketcap, 0.364679212839, 227170.24289051, -0.00119839, -1.45414, 5.67473, 2019-06-25T06:59:01, 1561445941000, 1h
null, SaluS, SLS, USD, coinmarketcap, 22.7274587281, 5245.08555285724, -0.518068, 3.13367, 17.2967, 2019-06-25T06:59:01, 1561445941000, 1h
null, IRISnet, IRIS, USD, coinmarketcap, 0.0680352478348, 6352166.70107227, 0.551221, -0.0442096, -6.15685, 2019-06-25T06:59:12, 1561445952000, 1h
null, Achain, ACT, USD, coinmarketcap, 0.0239870613255, 3625778.43350474, 8.05436, 19.2662, 25.5217, 2019-06-25T06:59:03, 1561445943000, 1h
null, High Performance Blockchain, HPB, USD, coinmarketcap, 0.494127575198, 4711067.6954814, -0.00105309, 1.84911, -4.88105, 2019-06-25T06:59:05, 1561445945000, 1h
null, TTC, TTC, USD, coinmarketcap, 0.107730048011, 1824537.21258948, -0.64521, -4.7558, 0.774939, 2019-06-25T06:59:09, 1561445949000, 1h
null, PLATINCOIN, PLC, USD, coinmarketcap, 28.9588769479, 3007938.1490513, -0.898209, -34.3255, -5.41186, 2019-06-25T06:59:10, 1561445950000, 1h
null, Particl, PART, USD, coinmarketcap, 2.32890475852, 168090.787381061, -0.0367976, -0.310851, -18.7722, 2019-06-25T06:59:03, 1561445943000, 1h
null, HYCON, HYC, USD, coinmarketcap, 0.0097135487043, 2416888.27499015, 1.48783, 11.7662, 12.3943, 2019-06-25T06:59:09, 1561445949000, 1h
null, ILCoin, ILC, USD, coinmarketcap, 0.0613219167609, 543874.311239097, 4.2166, 7.96625, -2.4524, 2019-06-25T06:59:11, 1561445951000, 1h