id, name, base, counter, api, priceUSD, volume24h, percentChange1h,percentChange24h, percentChange7d, dateTimeUSD, milisec, timeframe
null, Bitcoin, BTC, USD, coinmarketcap, 11331.4700076, 21195388969.0822, 0.241684, 4.09296, 23.2998, 2019-06-25T12:59:28, 1561467568000, 1h
null, Ethereum, ETH, USD, coinmarketcap, 313.559529344, 8450708079.90235, 0.214088, 1.69819, 16.4314, 2019-06-25T12:59:18, 1561467558000, 1h
null, XRP, XRP, USD, coinmarketcap, 0.469549372195, 1583266709.89949, 0.498658, 1.29469, 6.60008, 2019-06-25T12:59:03, 1561467543000, 1h
null, Bitcoin Cash, BCH, USD, coinmarketcap, 478.764303237, 1939033889.01258, 0.600211, 1.01486, 14.1048, 2019-06-25T12:59:05, 1561467545000, 1h
null, Litecoin, LTC, USD, coinmarketcap, 135.806123332, 4063891248.53422, -0.0568017, 0.00896176, 2.52934, 2019-06-25T12:59:06, 1561467546000, 1h
null, EOS, EOS, USD, coinmarketcap, 7.20378831634, 2271504512.90863, 0.0459044, 0.00603303, 3.36871, 2019-06-25T12:59:05, 1561467545000, 1h
null, Binance Coin, BNB, USD, coinmarketcap, 36.9615479138, 343274916.376314, -0.01176, -0.222118, 6.60145, 2019-06-25T12:59:04, 1561467544000, 1h
null, Bitcoin SV, BSV, USD, coinmarketcap, 238.96533229, 423693729.105772, 0.26418, 0.435433, 7.03453, 2019-06-25T12:59:09, 1561467549000, 1h
null, TRON, TRX, USD, coinmarketcap, 0.0391094546055, 995527869.768977, -1.0586, 0.843009, 18.0013, 2019-06-25T12:59:05, 1561467545000, 1h
null, Cardano, ADA, USD, coinmarketcap, 0.0964937060925, 137613546.143829, 0.272744, -0.82674, 6.29092, 2019-06-25T12:59:04, 1561467544000, 1h
null, Stellar, XLM, USD, coinmarketcap, 0.127236461307, 428733319.996152, 0.117596, -0.240585, -0.49127, 2019-06-25T12:59:03, 1561467543000, 1h
null, Monero, XMR, USD, coinmarketcap, 115.474206802, 137707512.022654, 0.424709, -0.47, 18.2436, 2019-06-25T12:59:03, 1561467543000, 1h
null, Dash, DASH, USD, coinmarketcap, 178.670717976, 325818116.183909, -0.0398535, 2.10629, 11.8554, 2019-06-25T12:59:02, 1561467542000, 1h
null, NEO, NEO, USD, coinmarketcap, 17.9918701703, 652606901.43993, 2.42904, 0.537955, 30.9184, 2019-06-25T12:59:03, 1561467543000, 1h
null, IOTA, MIOTA, USD, coinmarketcap, 0.454439719281, 24263852.0535255, 0.642504, -0.611249, 4.3459, 2019-06-25T12:59:03, 1561467543000, 1h
null, Cosmos, ATOM, USD, coinmarketcap, 6.61331229566, 66443580.1995215, 0.647531, -1.48271, -1.70467, 2019-06-25T12:59:09, 1561467549000, 1h
null, Ethereum Classic, ETC, USD, coinmarketcap, 9.18119337938, 772510077.895831, -0.173693, -0.589566, 6.73541, 2019-06-25T12:59:04, 1561467544000, 1h
null, Ontology, ONT, USD, coinmarketcap, 1.66036432178, 198272802.712824, 4.21791, 6.30961, 13.049, 2019-06-25T12:59:05, 1561467545000, 1h
null, NEM, XEM, USD, coinmarketcap, 0.0913051770174, 27997736.2790629, -0.02544, 0.910059, 4.37169, 2019-06-25T12:59:02, 1561467542000, 1h
null, Tezos, XTZ, USD, coinmarketcap, 1.13093537855, 6498112.4537552, -1.75342, -4.25062, -11.6141, 2019-06-25T12:59:03, 1561467543000, 1h
null, Zcash, ZEC, USD, coinmarketcap, 107.592153629, 336585849.063523, -0.0273909, -0.597872, 1.28914, 2019-06-25T12:59:03, 1561467543000, 1h
null, VeChain, VET, USD, coinmarketcap, 0.00968358304396, 217782668.028127, 1.7789, 34.5262, 33.4263, 2019-06-25T12:59:07, 1561467547000, 1h
null, Bitcoin Gold, BTG, USD, coinmarketcap, 30.311623965, 17831810.8701752, 0.0497247, -0.279921, 10.9917, 2019-06-25T12:59:03, 1561467543000, 1h
null, Qtum, QTUM, USD, coinmarketcap, 4.40450829961, 281423734.734758, 2.98743, 11.8, 23.1864, 2019-06-25T12:59:03, 1561467543000, 1h
null, Dogecoin, DOGE, USD, coinmarketcap, 0.00337333759186, 40191614.6493296, 0.0822188, 1.33802, 6.91453, 2019-06-25T12:59:02, 1561467542000, 1h
null, Decred, DCR, USD, coinmarketcap, 31.7969849848, 16265293.9937739, 0.101196, -4.06861, 8.87039, 2019-06-25T12:59:02, 1561467542000, 1h
null, Lisk, LSK, USD, coinmarketcap, 2.09011268005, 10412911.9853144, 0.728687, 0.613461, 0.97294, 2019-06-25T12:59:02, 1561467542000, 1h
null, Bitcoin Diamond, BCD, USD, coinmarketcap, 1.32161904067, 7582359.24743637, 0.208067, -0.272519, 0.83628, 2019-06-25T12:59:04, 1561467544000, 1h
null, Ravencoin, RVN, USD, coinmarketcap, 0.0634497155736, 25851516.9585703, -0.100823, -4.13068, 4.72802, 2019-06-25T12:59:06, 1561467546000, 1h
null, Waves, WAVES, USD, coinmarketcap, 2.3252868718, 15614730.0407537, 0.109911, -2.28105, -3.43427, 2019-06-25T12:59:04, 1561467544000, 1h
null, HyperCash, HC, USD, coinmarketcap, 4.70179695562, 31428734.5918846, -0.977583, 23.6737, 67.9134, 2019-06-25T12:59:03, 1561467543000, 1h
null, Nano, NANO, USD, coinmarketcap, 1.47413600196, 4961151.49911205, 0.0782861, -0.816576, -4.20526, 2019-06-25T12:59:02, 1561467542000, 1h
null, BitShares, BTS, USD, coinmarketcap, 0.0700510174611, 14355502.8249166, 0.00171651, 4.01063, 12.4002, 2019-06-25T12:59:02, 1561467542000, 1h
null, Bytom, BTM, USD, coinmarketcap, 0.188025217258, 39887136.2971441, 0.101336, 0.105354, -1.9363, 2019-06-25T12:59:03, 1561467543000, 1h
null, MonaCoin, MONA, USD, coinmarketcap, 2.83588124413, 26207350.2654406, 0.981693, 4.57915, 22.6647, 2019-06-25T12:59:01, 1561467541000, 1h
null, Bytecoin, BCN, USD, coinmarketcap, 0.00101109936229, 68573.4537088091, -3.10514, -0.927676, -0.277948, 2019-06-25T12:59:01, 1561467541000, 1h
null, DigiByte, DGB, USD, coinmarketcap, 0.0139196855191, 1406522.16397371, 3.00085, -0.0605139, 11.1174, 2019-06-25T12:59:01, 1561467541000, 1h
null, ICON, ICX, USD, coinmarketcap, 0.345474385861, 10765885.4819924, 0.752264, -0.195396, -3.68155, 2019-06-25T12:59:03, 1561467543000, 1h
null, Komodo, KMD, USD, coinmarketcap, 1.36443208509, 4724754.55209866, 0.8776, 1.3503, -12.7182, 2019-06-25T12:59:02, 1561467542000, 1h
null, Aeternity, AE, USD, coinmarketcap, 0.561264774358, 61332842.3856089, 0.50841, -5.24863, 8.21521, 2019-06-25T12:59:03, 1561467543000, 1h
null, Verge, XVG, USD, coinmarketcap, 0.00950285286058, 4049402.09670484, 1.50217, 1.85824, 4.40299, 2019-06-25T12:59:01, 1561467541000, 1h
null, Energi, NRG, USD, coinmarketcap, 8.22768514265, 2117278.52675152, 1.62109, 43.133, 97.5876, 2019-06-25T12:59:07, 1561467547000, 1h
null, GXChain, GXC, USD, coinmarketcap, 2.37783764951, 52571305.2032193, -0.276496, -10.2179, -0.305716, 2019-06-25T12:59:02, 1561467542000, 1h
null, Metaverse ETP, ETP, USD, coinmarketcap, 1.96448808683, 32161213.7392164, 0.53058, 3.91349, -1.13628, 2019-06-25T12:59:02, 1561467542000, 1h
null, Siacoin, SC, USD, coinmarketcap, 0.00328085458987, 2288585.92849366, 0.510059, 0.950704, 4.13023, 2019-06-25T12:59:02, 1561467542000, 1h
null, Steem, STEEM, USD, coinmarketcap, 0.413276432816, 1591899.93905845, 0.164909, 1.16251, 0.596194, 2019-06-25T12:59:02, 1561467542000, 1h
null, ABBC Coin, ABBC, USD, coinmarketcap, 0.258424827143, 69928262.0167885, 2.90856, 16.0936, 45.6674, 2019-06-25T12:59:07, 1561467547000, 1h
null, THETA, THETA, USD, coinmarketcap, 0.139433927815, 6055126.20582843, 0.204283, 3.74169, 8.91518, 2019-06-25T12:59:04, 1561467544000, 1h
null, Ardor, ARDR, USD, coinmarketcap, 0.120299215656, 2413511.00981511, 0.525509, 2.9107, 10.7695, 2019-06-25T12:59:02, 1561467542000, 1h
null, Zcoin, XZC, USD, coinmarketcap, 12.7513079279, 3027824.85337881, 0.362994, -2.02914, 5.62271, 2019-06-25T12:59:02, 1561467542000, 1h
null, Stratis, STRAT, USD, coinmarketcap, 0.978983920536, 2553121.79772897, 0.900636, 2.96479, 0.426114, 2019-06-25T12:59:02, 1561467542000, 1h
null, Nebulas, NAS, USD, coinmarketcap, 1.71007990054, 21342786.3141568, 0.976187, -12.8296, 11.8789, 2019-06-25T12:59:03, 1561467543000, 1h
null, Project Pai, PAI, USD, coinmarketcap, 0.0532043538771, 4449558.67957383, -0.078311, 6.73291, 6.36591, 2019-06-25T12:59:06, 1561467546000, 1h
null, TrueChain, TRUE, USD, coinmarketcap, 0.973211638849, 58263851.5206307, 1.54399, -0.904222, -5.68238, 2019-06-25T12:59:05, 1561467545000, 1h
null, Grin, GRIN, USD, coinmarketcap, 5.45208463457, 54301130.4497938, -1.31891, -8.87299, -2.96642, 2019-06-25T12:59:09, 1561467549000, 1h
null, Horizen, ZEN, USD, coinmarketcap, 10.0379617032, 749629.870495658, -0.73644, -2.12895, -4.1663, 2019-06-25T12:59:03, 1561467543000, 1h
null, NULS, NULS, USD, coinmarketcap, 0.952029185802, 10357377.1544994, -0.389047, 0.0447109, -3.81804, 2019-06-25T12:59:03, 1561467543000, 1h
null, Cryptonex, CNX, USD, coinmarketcap, 1.19898341991, 7035472.67066907, 0.699471, 9.31586, -18.6928, 2019-06-25T12:59:03, 1561467543000, 1h
null, ReddCoin, RDD, USD, coinmarketcap, 0.00230358169081, 406191.346755068, -0.688874, -0.867104, 8.19417, 2019-06-25T12:59:01, 1561467541000, 1h
null, Elastos, ELA, USD, coinmarketcap, 4.12595304115, 6357856.53849956, 1.89171, 1.37117, 10.0643, 2019-06-25T12:59:05, 1561467545000, 1h
null, Ark, ARK, USD, coinmarketcap, 0.515519303649, 774560.315201328, -0.132308, -0.38832, -7.73808, 2019-06-25T12:59:02, 1561467542000, 1h
null, Factom, FCT, USD, coinmarketcap, 5.78897730084, 215929.341529526, 0.74421, -0.851534, -5.79923, 2019-06-25T12:59:01, 1561467541000, 1h
null, WaykiChain, WICC, USD, coinmarketcap, 0.292013266196, 2377768.73401135, 0.0615443, 5.86163, 2.11133, 2019-06-25T12:59:04, 1561467544000, 1h
null, Beam, BEAM, USD, coinmarketcap, 2.23680840526, 74607274.4495688, -1.39626, -7.99312, 76.5895, 2019-06-25T12:59:09, 1561467549000, 1h
null, Electroneum, ETN, USD, coinmarketcap, 0.00554193584741, 277323.362393638, 2.39761, -6.07749, -5.04691, 2019-06-25T12:59:03, 1561467543000, 1h
null, Thunder Token, TT, USD, coinmarketcap, 0.0173767154237, 17370827.8632763, 0.156855, 0.357963, -12.3019, 2019-06-25T12:59:09, 1561467549000, 1h
null, Aion, AION, USD, coinmarketcap, 0.1448511025, 2582934.36298256, 0.37798, -1.21209, -10.0575, 2019-06-25T12:59:03, 1561467543000, 1h
null, PIVX, PIVX, USD, coinmarketcap, 0.746056822947, 625922.975479755, 1.12466, 0.544221, 1.77693, 2019-06-25T12:59:02, 1561467542000, 1h
null, Theta Fuel, TFUEL, USD, coinmarketcap, 0.0110127361286, 3902527.21330657, 0.880268, -0.388911, -7.42489, 2019-06-25T12:59:08, 1561467548000, 1h
null, Newton, NEW, USD, coinmarketcap, 0.00348947656666, 11071053.1582661, 0.596181, -0.667558, -1.28032, 2019-06-25T12:59:08, 1561467548000, 1h
null, Wanchain, WAN, USD, coinmarketcap, 0.389759033382, 1483549.85311712, 2.40188, 1.57723, -7.47709, 2019-06-25T12:59:05, 1561467545000, 1h
null, Metadium, META, USD, coinmarketcap, 0.0316797621752, 2961051.05807548, 0.660766, -2.69555, -5.17069, 2019-06-25T12:59:07, 1561467547000, 1h
null, Ether Zero, ETZ, USD, coinmarketcap, 0.238063436087, 2185503.95814607, 3.67906, -9.26436, -15.6104, 2019-06-25T12:59:06, 1561467546000, 1h
null, Nxt, NXT, USD, coinmarketcap, 0.0385751621892, 1234893.55952721, 0.169808, 2.2479, 6.56109, 2019-06-25T12:59:01, 1561467541000, 1h
null, CyberMiles, CMT, USD, coinmarketcap, 0.0480445958811, 9781192.87906286, -0.838371, 3.85758, 4.94348, 2019-06-25T12:59:04, 1561467544000, 1h
null, MOAC, MOAC, USD, coinmarketcap, 0.606634123138, 49611.4676815328, -3.13023, -3.69756, -12.0398, 2019-06-25T12:59:04, 1561467544000, 1h
null, IPChain, IPC, USD, coinmarketcap, 0.467821132753, 3493781.88059675, 0.721975, -5.4431, -21.9847, 2019-06-25T12:59:05, 1561467545000, 1h
null, CasinoCoin, CSC, USD, coinmarketcap, 0.000874092495157, 44450.7686205288, 2.08186, 7.62966, 18.8567, 2019-06-25T12:59:01, 1561467541000, 1h
null, Unobtanium, UNO, USD, coinmarketcap, 158.493579383, 756.667762115529, 0.206746, 4.04414, 19.0202, 2019-06-25T12:59:01, 1561467541000, 1h
null, TomoChain, TOMO, USD, coinmarketcap, 0.52086536385, 2823293.34510981, 2.33456, -12.9467, -8.99117, 2019-06-25T12:59:06, 1561467546000, 1h
null, Groestlcoin, GRS, USD, coinmarketcap, 0.424207204335, 1877134.96586682, 0.361754, 0.166164, -1.59031, 2019-06-25T12:59:01, 1561467541000, 1h
null, Vertcoin, VTC, USD, coinmarketcap, 0.611714220085, 549653.744475555, -0.203577, 1.23921, 13.7982, 2019-06-25T12:59:01, 1561467541000, 1h
null, Syscoin, SYS, USD, coinmarketcap, 0.0502296081625, 333678.589910696, 0.319358, -1.99939, -19.9796, 2019-06-25T12:59:01, 1561467541000, 1h
null, Skycoin, SKY, USD, coinmarketcap, 1.83728622527, 521809.844368436, 1.22099, 3.22786, 5.83472, 2019-06-25T12:59:02, 1561467542000, 1h
null, BHPCoin, BHP, USD, coinmarketcap, 1.68293785282, 6126873.79349307, 0.201136, 6.61917, 8.30439, 2019-06-25T12:59:06, 1561467546000, 1h
null, Apollo Currency, APL, USD, coinmarketcap, 0.00185540623889, 183208.596308313, -2.10909, 19.5181, 13.7844, 2019-06-25T12:59:06, 1561467546000, 1h
null, Pirate Chain, ARRR, USD, coinmarketcap, 0.252626100115, 12773.3987212067, 0.881178, -3.12093, 33.4018, 2019-06-25T12:59:09, 1561467549000, 1h
null, #MetaHash, MHC, USD, coinmarketcap, 0.0211361745551, 217766.432561302, -0.934279, -3.45648, -9.48962, 2019-06-25T12:59:08, 1561467548000, 1h
null, Obyte, GBYTE, USD, coinmarketcap, 36.7391384258, 75934.7695540893, -1.68265, 2.20025, -0.125999, 2019-06-25T12:59:02, 1561467542000, 1h
null, Einsteinium, EMC2, USD, coinmarketcap, 0.111469482429, 1339979.80465037, -0.450397, 0.0516114, -3.33464, 2019-06-25T12:59:01, 1561467541000, 1h
null, SaluS, SLS, USD, coinmarketcap, 23.1004441931, 6310.89179523314, 0.226695, 2.99145, 21.437, 2019-06-25T12:59:01, 1561467541000, 1h
null, Nexus, NXS, USD, coinmarketcap, 0.364158361434, 258227.126383527, 0.21143, -1.34196, 5.24454, 2019-06-25T12:59:01, 1561467541000, 1h
null, Quantum Resistant Ledger, QRL, USD, coinmarketcap, 0.329193953386, 32165.5585013215, 3.09439, 5.26532, -5.96524, 2019-06-25T12:59:02, 1561467542000, 1h
null, High Performance Blockchain, HPB, USD, coinmarketcap, 0.501178896392, 4600831.50592753, 1.16172, 2.12504, -2.45631, 2019-06-25T12:59:04, 1561467544000, 1h
null, IRISnet, IRIS, USD, coinmarketcap, 0.0667446193174, 8724207.42831744, 0.177143, -2.59691, -4.64674, 2019-06-25T12:59:08, 1561467548000, 1h
null, Achain, ACT, USD, coinmarketcap, 0.0230676386769, 3506849.33833872, -1.29291, 10.8873, 23.4391, 2019-06-25T12:59:03, 1561467543000, 1h
null, TTC, TTC, USD, coinmarketcap, 0.103357161512, 1992406.47555133, -0.666041, -8.94253, -3.29761, 2019-06-25T12:59:08, 1561467548000, 1h
null, PLATINCOIN, PLC, USD, coinmarketcap, 29.0769466235, 3155457.57593182, -2.84148, -35.6912, -5.08156, 2019-06-25T12:59:07, 1561467547000, 1h
null, Particl, PART, USD, coinmarketcap, 2.47499887779, 190525.92896109, 2.85741, 5.78994, -14.5196, 2019-06-25T12:59:03, 1561467543000, 1h
null, HYCON, HYC, USD, coinmarketcap, 0.0100330211264, 2773205.32145962, -0.469791, 10.2752, 19.4452, 2019-06-25T12:59:07, 1561467547000, 1h