id, name, base, counter, api, priceUSD, volume24h, percentChange1h,percentChange24h, percentChange7d, dateTimeUSD, milisec, timeframe
null, Bitcoin, BTC, USD, coinmarketcap, 10713.5914236, 28968151119.9743, -1.99103, 8.10532, 22.1192, 2019-06-22T20:59:30, 1561237170000, 1h
null, Ethereum, ETH, USD, coinmarketcap, 309.266577433, 10742754490.577, -0.212142, 6.23069, 15.5814, 2019-06-22T20:59:21, 1561237161000, 1h
null, XRP, XRP, USD, coinmarketcap, 0.487529239616, 3341609110.0586, 0.143755, 10.1303, 19.102, 2019-06-22T20:59:04, 1561237144000, 1h
null, Litecoin, LTC, USD, coinmarketcap, 143.327320849, 5331999181.43874, 1.11947, 3.83736, 4.50852, 2019-06-22T20:59:07, 1561237147000, 1h
null, Bitcoin Cash, BCH, USD, coinmarketcap, 495.276494715, 2968626500.84071, 7.7886, 14.0458, 18.0011, 2019-06-22T20:59:05, 1561237145000, 1h
null, EOS, EOS, USD, coinmarketcap, 7.52165587442, 3480770946.09837, 2.16054, 6.76544, 10.4053, 2019-06-22T20:59:05, 1561237145000, 1h
null, Binance Coin, BNB, USD, coinmarketcap, 38.5091303538, 456529573.636289, -0.486772, 1.05243, 17.0454, 2019-06-22T20:59:03, 1561237143000, 1h
null, Bitcoin SV, BSV, USD, coinmarketcap, 239.765760473, 737322363.410189, 0.823832, 8.58544, 13.8897, 2019-06-22T20:59:08, 1561237148000, 1h
null, Stellar, XLM, USD, coinmarketcap, 0.131083185464, 494073872.303691, 0.197252, 5.77791, 4.22839, 2019-06-22T20:59:03, 1561237143000, 1h
null, Cardano, ADA, USD, coinmarketcap, 0.0959815776461, 227335435.092391, 1.73998, 7.00521, 4.78852, 2019-06-22T20:59:03, 1561237143000, 1h
null, TRON, TRX, USD, coinmarketcap, 0.0365942640587, 901802757.380104, 0.118394, 9.57243, 12.3685, 2019-06-22T20:59:04, 1561237144000, 1h
null, Monero, XMR, USD, coinmarketcap, 115.742826094, 147516928.00623, -0.0238276, 6.94451, 23.7226, 2019-06-22T20:59:01, 1561237141000, 1h
null, Dash, DASH, USD, coinmarketcap, 176.722960574, 465821602.077175, 0.183937, 7.06384, 14.1444, 2019-06-22T20:59:03, 1561237143000, 1h
null, Cosmos, ATOM, USD, coinmarketcap, 6.77860435055, 71269710.6409395, 1.31191, 4.84314, 9.42565, 2019-06-22T20:59:08, 1561237148000, 1h
null, IOTA, MIOTA, USD, coinmarketcap, 0.459737994294, 38264064.1313388, 0.343712, 7.85345, 5.68367, 2019-06-22T20:59:02, 1561237142000, 1h
null, NEO, NEO, USD, coinmarketcap, 17.0821643419, 936266705.911534, 0.975417, 22.671, 21.5826, 2019-06-22T20:59:03, 1561237143000, 1h
null, Ethereum Classic, ETC, USD, coinmarketcap, 9.16434614782, 1068232775.63203, 1.20054, 5.84477, 6.5442, 2019-06-22T20:59:02, 1561237142000, 1h
null, NEM, XEM, USD, coinmarketcap, 0.0920407713483, 32979558.3595299, 0.774875, 5.01799, 7.68283, 2019-06-22T20:59:01, 1561237141000, 1h
null, Tezos, XTZ, USD, coinmarketcap, 1.21954253524, 10068148.5897778, -0.420123, 6.44284, -1.67854, 2019-06-22T20:59:02, 1561237142000, 1h
null, Zcash, ZEC, USD, coinmarketcap, 115.170649651, 715518627.668161, 0.238883, 3.62844, 24.2733, 2019-06-22T20:59:03, 1561237143000, 1h
null, Ontology, ONT, USD, coinmarketcap, 1.56474512613, 256048075.929808, -0.0578219, 10.4668, 8.62343, 2019-06-22T20:59:05, 1561237145000, 1h
null, Bitcoin Gold, BTG, USD, coinmarketcap, 30.9212021756, 30883813.3074655, 1.56716, 8.35138, 14.9348, 2019-06-22T20:59:03, 1561237143000, 1h
null, VeChain, VET, USD, coinmarketcap, 0.00733259731156, 58715355.8356294, -1.31387, 5.15261, -1.2112, 2019-06-22T20:59:07, 1561237147000, 1h
null, Dogecoin, DOGE, USD, coinmarketcap, 0.00326725938295, 56121092.41756, -0.673488, 1.94622, 3.82734, 2019-06-22T20:59:02, 1561237142000, 1h
null, Qtum, QTUM, USD, coinmarketcap, 3.89382254431, 331681319.170169, 0.242081, 9.58109, 10.3488, 2019-06-22T20:59:03, 1561237143000, 1h
null, Decred, DCR, USD, coinmarketcap, 30.439068329, 43697872.3386068, -0.851759, 4.07692, 11.3447, 2019-06-22T20:59:01, 1561237141000, 1h
null, Bitcoin Diamond, BCD, USD, coinmarketcap, 1.35404603267, 14281515.8748976, 1.14359, 4.84676, 10.1965, 2019-06-22T20:59:03, 1561237143000, 1h
null, Lisk, LSK, USD, coinmarketcap, 2.12117765042, 12196941.770038, -0.668193, 2.37783, 4.17356, 2019-06-22T20:59:01, 1561237141000, 1h
null, Waves, WAVES, USD, coinmarketcap, 2.44450276083, 24944764.0594241, -0.302291, 2.8836, 2.05139, 2019-06-22T20:59:03, 1561237143000, 1h
null, Ravencoin, RVN, USD, coinmarketcap, 0.0633876855235, 29768287.1280885, 1.11478, 4.33079, 2.13278, 2019-06-22T20:59:05, 1561237145000, 1h
null, Nano, NANO, USD, coinmarketcap, 1.51202033869, 9378532.2387302, 1.63918, 5.36688, -5.05433, 2019-06-22T20:59:02, 1561237142000, 1h
null, Bytom, BTM, USD, coinmarketcap, 0.193429737608, 30380671.5327822, 0.0325201, 5.50252, 13.8504, 2019-06-22T20:59:03, 1561237143000, 1h
null, Bytecoin, BCN, USD, coinmarketcap, 0.000980226711472, 117084.734363677, -2.80118, 0.797284, 1.8887, 2019-06-22T20:59:01, 1561237141000, 1h
null, BitShares, BTS, USD, coinmarketcap, 0.064297590545, 8501734.5468931, -1.01724, 1.28439, 1.95308, 2019-06-22T20:59:01, 1561237141000, 1h
null, MonaCoin, MONA, USD, coinmarketcap, 2.64877548097, 40092138.4945207, 1.21022, -3.06507, 33.9548, 2019-06-22T20:59:01, 1561237141000, 1h
null, DigiByte, DGB, USD, coinmarketcap, 0.0141032287623, 2169824.21520114, -1.90706, 1.21989, 10.0537, 2019-06-22T20:59:01, 1561237141000, 1h
null, ICON, ICX, USD, coinmarketcap, 0.349625909973, 17379484.6586469, 0.839062, 3.71658, -6.59349, 2019-06-22T20:59:04, 1561237144000, 1h
null, HyperCash, HC, USD, coinmarketcap, 3.68463391718, 14329848.7066155, 1.09794, 13.1497, 42.9971, 2019-06-22T20:59:02, 1561237142000, 1h
null, Komodo, KMD, USD, coinmarketcap, 1.37581244686, 5079519.51685368, 1.19381, -2.23455, -14.1519, 2019-06-22T20:59:02, 1561237142000, 1h
null, Verge, XVG, USD, coinmarketcap, 0.00910119083398, 4348347.06102241, -1.45398, 2.98537, -0.0196745, 2019-06-22T20:59:01, 1561237141000, 1h
null, Aeternity, AE, USD, coinmarketcap, 0.522247074264, 40758835.6209812, -0.506231, 2.00137, -1.84123, 2019-06-22T20:59:02, 1561237142000, 1h
null, GXChain, GXC, USD, coinmarketcap, 2.3359543516, 21480191.9383522, -0.914685, 3.01956, -0.317472, 2019-06-22T20:59:02, 1561237142000, 1h
null, Metaverse ETP, ETP, USD, coinmarketcap, 1.91691422346, 43649171.6784371, -0.479855, -1.90353, 3.54641, 2019-06-22T20:59:02, 1561237142000, 1h
null, Siacoin, SC, USD, coinmarketcap, 0.00319358523424, 4377765.03148187, 0.151214, 5.19623, -0.671685, 2019-06-22T20:59:01, 1561237141000, 1h
null, Steem, STEEM, USD, coinmarketcap, 0.398832057237, 2542193.78863949, -0.456904, 2.33582, -0.649418, 2019-06-22T20:59:02, 1561237142000, 1h
null, Ardor, ARDR, USD, coinmarketcap, 0.117163449999, 3842578.86356874, -0.40512, 1.59816, 12.6036, 2019-06-22T20:59:01, 1561237141000, 1h
null, THETA, THETA, USD, coinmarketcap, 0.13276034813, 6091662.78234687, 1.00473, 6.52457, 2.97601, 2019-06-22T20:59:04, 1561237144000, 1h
null, ABBC Coin, ABBC, USD, coinmarketcap, 0.2236198528, 50831755.2244006, 2.22141, 29.1419, 16.8258, 2019-06-22T20:59:07, 1561237147000, 1h
null, Zcoin, XZC, USD, coinmarketcap, 12.8832314903, 5402299.0148547, -1.95167, 0.427058, 7.76853, 2019-06-22T20:59:02, 1561237142000, 1h
null, Stratis, STRAT, USD, coinmarketcap, 0.943570287819, 3321867.23070565, 1.46009, 1.07698, 2.90851, 2019-06-22T20:59:01, 1561237141000, 1h
null, Energi, NRG, USD, coinmarketcap, 5.38798488517, 833115.683690292, 0.152909, 23.6844, 38.8086, 2019-06-22T20:59:06, 1561237146000, 1h
null, TrueChain, TRUE, USD, coinmarketcap, 1.01679328248, 64593749.718792, -0.385385, 3.01991, -3.81143, 2019-06-22T20:59:04, 1561237144000, 1h
null, Nebulas, NAS, USD, coinmarketcap, 1.5366448991, 11072995.4931077, -1.41542, 7.26039, -2.62836, 2019-06-22T20:59:02, 1561237142000, 1h
null, Project Pai, PAI, USD, coinmarketcap, 0.0498555406899, 3118984.61164743, 2.66373, 3.93112, -9.68983, 2019-06-22T20:59:05, 1561237145000, 1h
null, Horizen, ZEN, USD, coinmarketcap, 10.6539126235, 1580608.42923035, -1.34374, 1.36217, 1.95357, 2019-06-22T20:59:02, 1561237142000, 1h
null, Grin, GRIN, USD, coinmarketcap, 5.26746830971, 56114560.1213152, 0.865636, 4.44669, 20.585, 2019-06-22T20:59:08, 1561237148000, 1h
null, NULS, NULS, USD, coinmarketcap, 0.961279767515, 12573513.6024019, 1.37736, -0.592297, -4.18075, 2019-06-22T20:59:03, 1561237143000, 1h
null, ReddCoin, RDD, USD, coinmarketcap, 0.002248639923, 701953.214937461, -5.56694, -1.04198, 22.9609, 2019-06-22T20:59:01, 1561237141000, 1h
null, Elastos, ELA, USD, coinmarketcap, 3.81884003458, 11335108.4055951, 1.27861, 2.17851, -2.10378, 2019-06-22T20:59:05, 1561237145000, 1h
null, Ark, ARK, USD, coinmarketcap, 0.510178746108, 1048516.3043652, 0.390851, -2.24288, -12.0057, 2019-06-22T20:59:02, 1561237142000, 1h
null, Factom, FCT, USD, coinmarketcap, 5.94078088127, 577756.140914713, -0.256215, 7.04503, 1.03268, 2019-06-22T20:59:01, 1561237141000, 1h
null, Electroneum, ETN, USD, coinmarketcap, 0.00571863519536, 523874.507590021, -0.746583, 3.09315, 4.27253, 2019-06-22T20:59:03, 1561237143000, 1h
null, WaykiChain, WICC, USD, coinmarketcap, 0.287634113949, 2819022.62023943, 0.879451, 1.15016, 9.93493, 2019-06-22T20:59:03, 1561237143000, 1h
null, Thunder Token, TT, USD, coinmarketcap, 0.0176591899771, 13603738.951043, -2.49721, -7.63214, -11.3476, 2019-06-22T20:59:09, 1561237149000, 1h
null, Aion, AION, USD, coinmarketcap, 0.146044629153, 3577759.89323557, 0.740003, -5.43119, -17.9701, 2019-06-22T20:59:02, 1561237142000, 1h
null, Theta Fuel, TFUEL, USD, coinmarketcap, 0.01142662511, 7460350.67333649, 0.0297712, -3.371, -6.90358, 2019-06-22T20:59:09, 1561237149000, 1h
null, MOAC, MOAC, USD, coinmarketcap, 0.68060407176, 40070.2409442966, -1.47008, -3.67678, -11.9034, 2019-06-22T20:59:03, 1561237143000, 1h
null, Ether Zero, ETZ, USD, coinmarketcap, 0.259204751281, 2015652.98358418, -1.856, -6.4597, -4.79151, 2019-06-22T20:59:05, 1561237145000, 1h
null, Newton, NEW, USD, coinmarketcap, 0.00354321174944, 10158730.0165843, -0.196905, -0.787593, -3.42768, 2019-06-22T20:59:08, 1561237148000, 1h
null, Wanchain, WAN, USD, coinmarketcap, 0.391887601933, 3026163.99727826, 1.4084, -1.70863, -13.4102, 2019-06-22T20:59:04, 1561237144000, 1h
null, IPChain, IPC, USD, coinmarketcap, 0.540932884382, 2983209.5419651, 1.37612, 4.41287, 8.03895, 2019-06-22T20:59:04, 1561237144000, 1h
null, PIVX, PIVX, USD, coinmarketcap, 0.723779670806, 1078800.94661176, 1.77721, 0.64488, -0.872949, 2019-06-22T20:59:01, 1561237141000, 1h
null, Nxt, NXT, USD, coinmarketcap, 0.0383310757697, 1401349.29775765, -1.61808, 1.18138, 4.50967, 2019-06-22T20:59:01, 1561237141000, 1h
null, Metadium, META, USD, coinmarketcap, 0.030517570519, 6354566.32771275, -1.91687, -3.08245, -4.82997, 2019-06-22T20:59:07, 1561237147000, 1h
null, TomoChain, TOMO, USD, coinmarketcap, 0.632997389329, 1904597.32027295, -1.5853, -1.91302, 19.1635, 2019-06-22T20:59:04, 1561237144000, 1h
null, CyberMiles, CMT, USD, coinmarketcap, 0.0448088004803, 10275890.0182433, 1.54347, 1.55968, -19.5535, 2019-06-22T20:59:03, 1561237143000, 1h
null, Beam, BEAM, USD, coinmarketcap, 1.46694456479, 34882603.0082159, 1.03055, 19.2377, 84.8204, 2019-06-22T20:59:08, 1561237148000, 1h
null, Unobtanium, UNO, USD, coinmarketcap, 155.660429322, 1731.21850439967, -1.76932, 8.43922, 22.4222, 2019-06-22T20:59, 1561237140000, 1h
null, Groestlcoin, GRS, USD, coinmarketcap, 0.426732287517, 2062322.17550457, 0.26283, 2.30799, -0.324071, 2019-06-22T20:59:01, 1561237141000, 1h
null, Syscoin, SYS, USD, coinmarketcap, 0.0523471153681, 1016844.6495203, -2.98898, 0.993395, -16.9161, 2019-06-22T20:59:01, 1561237141000, 1h
null, Vertcoin, VTC, USD, coinmarketcap, 0.578170942347, 872501.357578839, -0.927989, 3.41466, 8.33691, 2019-06-22T20:59:01, 1561237141000, 1h
null, Skycoin, SKY, USD, coinmarketcap, 1.9109713379, 1685604.86812068, -0.393538, 0.606403, 15.8831, 2019-06-22T20:59:02, 1561237142000, 1h
null, #MetaHash, MHC, USD, coinmarketcap, 0.0230067806441, 448707.387869334, 0.420247, 1.37166, -3.34456, 2019-06-22T20:59:07, 1561237147000, 1h
null, CasinoCoin, CSC, USD, coinmarketcap, 0.000718408822119, 50315.5017485096, -3.65328, 3.05703, -14.0199, 2019-06-22T20:59:01, 1561237141000, 1h
null, BHPCoin, BHP, USD, coinmarketcap, 1.63100562234, 6289081.58355369, -2.13501, 1.57905, -0.170355, 2019-06-22T20:59:07, 1561237147000, 1h
null, BOScoin, BOS, USD, coinmarketcap, 0.0396410677781, 19710.8422901314, -1.55333, -0.166341, 84.04, 2019-06-22T20:59:02, 1561237142000, 1h
null, Nexus, NXS, USD, coinmarketcap, 0.388075111756, 506338.094162079, 2.38486, 0.901479, 8.00615, 2019-06-22T20:59:01, 1561237141000, 1h
null, Einsteinium, EMC2, USD, coinmarketcap, 0.109511909467, 1868628.34873758, -0.264501, 1.27955, -8.42075, 2019-06-22T20:59:01, 1561237141000, 1h
null, Obyte, GBYTE, USD, coinmarketcap, 33.6578685207, 58940.8505629417, -5.18278, 2.04607, -8.00851, 2019-06-22T20:59:02, 1561237142000, 1h
null, PLATINCOIN, PLC, USD, coinmarketcap, 33.4909936147, 3228633.5502908, -0.638524, 5.43599, 11.4247, 2019-06-22T20:59:06, 1561237146000, 1h
null, Pirate Chain, ARRR, USD, coinmarketcap, 0.220805457183, 15362.7726421594, -4.28094, -0.728515, 16.9766, 2019-06-22T20:59:08, 1561237148000, 1h
null, Quantum Resistant Ledger, QRL, USD, coinmarketcap, 0.330093023088, 240425.184743566, -1.04422, 3.18299, -9.32584, 2019-06-22T20:59:02, 1561237142000, 1h
null, IRISnet, IRIS, USD, coinmarketcap, 0.0688871415198, 1875009.84168866, -2.3443, 0.754764, 3.08957, 2019-06-22T20:59:09, 1561237149000, 1h
null, Apollo Currency, APL, USD, coinmarketcap, 0.00149683319235, 45416.6304335388, 2.59708, 4.4725, -11.7151, 2019-06-22T20:59:06, 1561237146000, 1h
null, High Performance Blockchain, HPB, USD, coinmarketcap, 0.49138218845, 6010004.1875773, 0.750432, -9.63863, 0.540975, 2019-06-22T20:59:03, 1561237143000, 1h
null, SaluS, SLS, USD, coinmarketcap, 20.7140818648, 5430.14871946119, -2.05525, 3.19346, 17.0199, 2019-06-22T20:59:01, 1561237141000, 1h
null, Particl, PART, USD, coinmarketcap, 2.44300610982, 64668.0723226633, -2.1689, 1.7477, -12.8708, 2019-06-22T20:59:02, 1561237142000, 1h
null, TTC, TTC, USD, coinmarketcap, 0.0987131593843, 2968071.96028394, -0.260909, 4.77184, -7.7514, 2019-06-22T20:59:08, 1561237148000, 1h
null, VeriBlock, VBK, USD, coinmarketcap, 0.0389286153523, 743119.463974353, 0.660905, 22.1307, 14.928, 2019-06-22T20:59:08, 1561237148000, 1h
null, Lightning Bitcoin, LBTC, USD, coinmarketcap, 4.65477974293, 7408957.57973085, -1.64142, 0.617093, -5.45711, 2019-06-22T20:59:03, 1561237143000, 1h