id, name, base, counter, api, priceUSD, volume24h, percentChange1h,percentChange24h, percentChange7d, dateTimeUSD, milisec, timeframe
null, Bitcoin, BTC, USD, coinmarketcap, 10791.9627257, 20508653785.9726, 0.326071, 0.633657, 17.4049, 2019-06-24T10:59:27, 1561373967000, 1h
null, Ethereum, ETH, USD, coinmarketcap, 307.415508729, 8082275911.12333, 0.590532, -1.41136, 13.4141, 2019-06-24T10:59:20, 1561373960000, 1h
null, XRP, XRP, USD, coinmarketcap, 0.460886139639, 2002151267.03459, 0.209302, -3.45412, 6.97116, 2019-06-24T10:59:02, 1561373942000, 1h
null, Litecoin, LTC, USD, coinmarketcap, 135.816519807, 3907389875.49088, 0.358327, -3.64539, -0.103176, 2019-06-24T10:59:05, 1561373945000, 1h
null, Bitcoin Cash, BCH, USD, coinmarketcap, 472.439050299, 2162208230.32397, 0.0608987, -3.04746, 9.48477, 2019-06-24T10:59:04, 1561373944000, 1h
null, EOS, EOS, USD, coinmarketcap, 7.17887448439, 2373880321.68499, 0.320342, -3.59383, 1.52265, 2019-06-24T10:59:03, 1561373943000, 1h
null, Binance Coin, BNB, USD, coinmarketcap, 37.2505061712, 373449518.016119, 0.829376, -1.5796, 12.6812, 2019-06-24T10:59:04, 1561373944000, 1h
null, Bitcoin SV, BSV, USD, coinmarketcap, 237.780173815, 526643211.639199, 0.0816813, -1.65389, 9.23823, 2019-06-24T10:59:08, 1561373948000, 1h
null, TRON, TRX, USD, coinmarketcap, 0.0389683123649, 904624854.441977, 2.11609, 6.15915, 17.3108, 2019-06-24T10:59:03, 1561373943000, 1h
null, Cardano, ADA, USD, coinmarketcap, 0.096093015587, 197267026.984955, 1.22417, -1.27751, 3.80568, 2019-06-24T10:59:04, 1561373944000, 1h
null, Stellar, XLM, USD, coinmarketcap, 0.127368730709, 385084145.987862, 0.405961, -2.27208, -1.558, 2019-06-24T10:59:04, 1561373944000, 1h
null, Monero, XMR, USD, coinmarketcap, 115.775214018, 137603102.041809, 0.643799, -0.630849, 18.4914, 2019-06-24T10:59:02, 1561373942000, 1h
null, Dash, DASH, USD, coinmarketcap, 174.623359949, 382068246.693925, 0.443372, -0.642868, 9.94445, 2019-06-24T10:59:02, 1561373942000, 1h
null, Cosmos, ATOM, USD, coinmarketcap, 6.71704075438, 62868110.4013044, 0.502173, -4.99596, 0.981448, 2019-06-24T10:59:09, 1561373949000, 1h
null, IOTA, MIOTA, USD, coinmarketcap, 0.454345049852, 24417308.5440949, 0.610604, -3.65639, 1.94728, 2019-06-24T10:59:02, 1561373942000, 1h
null, NEO, NEO, USD, coinmarketcap, 17.463394175, 702527575.339046, 0.909049, -1.59521, 20.4804, 2019-06-24T10:59:03, 1561373943000, 1h
null, Ethereum Classic, ETC, USD, coinmarketcap, 9.15328232391, 885848619.373562, 0.541696, -1.19339, 4.87688, 2019-06-24T10:59:02, 1561373942000, 1h
null, NEM, XEM, USD, coinmarketcap, 0.0903311440723, 29614126.612938, -0.0365492, -2.86702, -0.221439, 2019-06-24T10:59:02, 1561373942000, 1h
null, Tezos, XTZ, USD, coinmarketcap, 1.1824117067, 4891593.0273173, 0.145678, -3.16684, -10.1223, 2019-06-24T10:59:03, 1561373943000, 1h
null, Ontology, ONT, USD, coinmarketcap, 1.53272950844, 147815775.656076, 0.0504962, -4.26174, 4.98326, 2019-06-24T10:59:05, 1561373945000, 1h
null, Zcash, ZEC, USD, coinmarketcap, 108.485483611, 432437122.27188, 0.384229, -4.83713, 13.0211, 2019-06-24T10:59:03, 1561373943000, 1h
null, Bitcoin Gold, BTG, USD, coinmarketcap, 30.2941480452, 21817002.6234222, 0.265146, -1.41356, 9.4453, 2019-06-24T10:59:04, 1561373944000, 1h
null, VeChain, VET, USD, coinmarketcap, 0.00720470458045, 37946060.1720973, -0.332958, -0.0874036, -2.60189, 2019-06-24T10:59:07, 1561373947000, 1h
null, Dogecoin, DOGE, USD, coinmarketcap, 0.00331026324098, 43950923.0960503, 0.703936, 0.699046, 3.55163, 2019-06-24T10:59:04, 1561373944000, 1h
null, Qtum, QTUM, USD, coinmarketcap, 3.85122521102, 256843122.432978, -0.129221, -3.49367, 4.5758, 2019-06-24T10:59:03, 1561373943000, 1h
null, Decred, DCR, USD, coinmarketcap, 33.4007661923, 23586647.1341274, 3.08533, 6.66301, 18.023, 2019-06-24T10:59:02, 1561373942000, 1h
null, Ravencoin, RVN, USD, coinmarketcap, 0.0664328477261, 32412200.806292, 0.0120546, 3.66413, 7.10026, 2019-06-24T10:59:08, 1561373948000, 1h
null, Lisk, LSK, USD, coinmarketcap, 2.10351164555, 10487862.7090836, 0.0341167, -2.54673, -0.909294, 2019-06-24T10:59:02, 1561373942000, 1h
null, Bitcoin Diamond, BCD, USD, coinmarketcap, 1.31690776237, 7016616.64175207, 0.850502, -2.45685, 4.86514, 2019-06-24T10:59:03, 1561373943000, 1h
null, Waves, WAVES, USD, coinmarketcap, 2.37127155527, 16852286.6212602, 0.40344, -2.38296, -4.36289, 2019-06-24T10:59:03, 1561373943000, 1h
null, Nano, NANO, USD, coinmarketcap, 1.49362426604, 5683603.41506865, 0.446039, -4.57954, -5.02324, 2019-06-24T10:59:02, 1561373942000, 1h
null, Bytecoin, BCN, USD, coinmarketcap, 0.000980257594689, 48830.1127784465, -4.46406, -5.84569, -5.65761, 2019-06-24T10:59:01, 1561373941000, 1h
null, Bytom, BTM, USD, coinmarketcap, 0.187191616173, 23210490.2255377, 0.294575, -5.46599, -4.42795, 2019-06-24T10:59:03, 1561373943000, 1h
null, BitShares, BTS, USD, coinmarketcap, 0.0670789342049, 8216345.72631381, 2.0748, 2.28484, 4.52211, 2019-06-24T10:59:02, 1561373942000, 1h
null, MonaCoin, MONA, USD, coinmarketcap, 2.74429160026, 15553417.6169538, 2.0496, 4.4532, 29.523, 2019-06-24T10:59:01, 1561373941000, 1h
null, DigiByte, DGB, USD, coinmarketcap, 0.0138220839454, 1320765.43264029, 0.339046, -5.34711, 8.85137, 2019-06-24T10:59:01, 1561373941000, 1h
null, HyperCash, HC, USD, coinmarketcap, 3.78199378463, 8964835.040114, 0.469849, -0.109677, 42.148, 2019-06-24T10:59:03, 1561373943000, 1h
null, ICON, ICX, USD, coinmarketcap, 0.346671471488, 12226410.2717406, 1.55375, -1.30813, -6.88273, 2019-06-24T10:59:03, 1561373943000, 1h
null, Aeternity, AE, USD, coinmarketcap, 0.602571336236, 63688964.0035655, -1.03946, 14.8953, 12.6352, 2019-06-24T10:59:02, 1561373942000, 1h
null, GXChain, GXC, USD, coinmarketcap, 2.59354810229, 32067658.8654317, -0.71915, -2.37259, 12.9451, 2019-06-24T10:59:02, 1561373942000, 1h
null, Komodo, KMD, USD, coinmarketcap, 1.3362750676, 6551976.85518726, 0.00292926, -6.9243, -17.6594, 2019-06-24T10:59:02, 1561373942000, 1h
null, Verge, XVG, USD, coinmarketcap, 0.00938381267706, 6259963.59308042, 0.775214, -5.87747, 0.236286, 2019-06-24T10:59:01, 1561373941000, 1h
null, Siacoin, SC, USD, coinmarketcap, 0.00323630369535, 2768799.32002652, 1.12892, -0.850703, 0.722203, 2019-06-24T10:59:01, 1561373941000, 1h
null, Metaverse ETP, ETP, USD, coinmarketcap, 1.83048241042, 25659553.6960782, -0.408158, -2.51485, -3.40323, 2019-06-24T10:59:02, 1561373942000, 1h
null, Steem, STEEM, USD, coinmarketcap, 0.404323213967, 1502218.51005901, -0.0709903, -1.85246, -4.08575, 2019-06-24T10:59:02, 1561373942000, 1h
null, THETA, THETA, USD, coinmarketcap, 0.134903725189, 3646402.73310752, 1.11448, 1.45341, 4.01206, 2019-06-24T10:59:04, 1561373944000, 1h
null, Ardor, ARDR, USD, coinmarketcap, 0.116541201936, 1565071.99975421, 0.138822, -2.88214, 9.51422, 2019-06-24T10:59:02, 1561373942000, 1h
null, ABBC Coin, ABBC, USD, coinmarketcap, 0.224018178638, 59190645.2314443, 1.3129, -0.377213, 22.1013, 2019-06-24T10:59:08, 1561373948000, 1h
null, Zcoin, XZC, USD, coinmarketcap, 13.0408239005, 3492200.4289999, 0.753108, -3.79163, 12.9912, 2019-06-24T10:59:02, 1561373942000, 1h
null, Energi, NRG, USD, coinmarketcap, 5.75190233014, 784651.304493924, 0.583925, 6.1864, 37.4568, 2019-06-24T10:59:07, 1561373947000, 1h
null, Stratis, STRAT, USD, coinmarketcap, 0.957030997994, 2647744.93117934, 0.28496, -2.30344, -5.18634, 2019-06-24T10:59:02, 1561373942000, 1h
null, Nebulas, NAS, USD, coinmarketcap, 1.84164383494, 16694965.7325126, 3.45574, 11.971, 18.8044, 2019-06-24T10:59:03, 1561373943000, 1h
null, Grin, GRIN, USD, coinmarketcap, 5.79484050777, 54713258.1982351, 0.424272, -0.339257, 4.37388, 2019-06-24T10:59:09, 1561373949000, 1h
null, TrueChain, TRUE, USD, coinmarketcap, 0.973727327198, 56277487.9025193, 0.548732, -1.76765, -6.51419, 2019-06-24T10:59:04, 1561373944000, 1h
null, Project Pai, PAI, USD, coinmarketcap, 0.0494866594048, 2261718.93076802, -0.516657, -2.19954, -7.07838, 2019-06-24T10:59:06, 1561373946000, 1h
null, Horizen, ZEN, USD, coinmarketcap, 10.3198599784, 731040.855720327, 0.453345, -4.22988, 0.0289539, 2019-06-24T10:59:02, 1561373942000, 1h
null, NULS, NULS, USD, coinmarketcap, 0.97215807819, 11621581.1961104, 2.64856, 0.342458, -0.277702, 2019-06-24T10:59:03, 1561373943000, 1h
null, ReddCoin, RDD, USD, coinmarketcap, 0.00229788470727, 381508.785815104, 1.14724, -5.10362, 12.7676, 2019-06-24T10:59:01, 1561373941000, 1h
null, Elastos, ELA, USD, coinmarketcap, 4.01491050131, 8030835.62721349, -0.152259, -1.57776, 4.31422, 2019-06-24T10:59:04, 1561373944000, 1h
null, Ark, ARK, USD, coinmarketcap, 0.52377195508, 920499.937733387, -0.0489431, -2.38294, -9.33835, 2019-06-24T10:59:02, 1561373942000, 1h
null, Factom, FCT, USD, coinmarketcap, 6.1268732929, 158793.539603846, 7.28924, 3.82052, 4.28497, 2019-06-24T10:59:01, 1561373941000, 1h
null, Beam, BEAM, USD, coinmarketcap, 2.38861784738, 58565393.2327839, -0.0141918, 51.8977, 110.094, 2019-06-24T10:59:09, 1561373949000, 1h
null, Electroneum, ETN, USD, coinmarketcap, 0.00586579566836, 293384.060624825, -0.289782, 1.50008, -5.63466, 2019-06-24T10:59:03, 1561373943000, 1h
null, WaykiChain, WICC, USD, coinmarketcap, 0.274376459617, 1955130.90027583, 1.53449, -3.68832, -2.91724, 2019-06-24T10:59:04, 1561373944000, 1h
null, Thunder Token, TT, USD, coinmarketcap, 0.0173598121164, 11892943.1877981, -0.204543, -2.34472, -12.8296, 2019-06-24T10:59:09, 1561373949000, 1h
null, Aion, AION, USD, coinmarketcap, 0.149096163334, 2090803.74874138, 1.63577, -0.217427, -16.1272, 2019-06-24T10:59:03, 1561373943000, 1h
null, Ether Zero, ETZ, USD, coinmarketcap, 0.266772661562, 2569279.97208354, -0.433117, -0.9797, -4.22363, 2019-06-24T10:59:06, 1561373946000, 1h
null, Theta Fuel, TFUEL, USD, coinmarketcap, 0.0110726180225, 3722583.26683791, 1.08202, -3.08918, -10.3869, 2019-06-24T10:59:09, 1561373949000, 1h
null, Newton, NEW, USD, coinmarketcap, 0.00353146497856, 10535563.2887864, 0.235394, -1.31853, -3.55644, 2019-06-24T10:59:09, 1561373949000, 1h
null, PIVX, PIVX, USD, coinmarketcap, 0.738338307096, 815438.5030443, -0.577185, 1.22638, -3.32544, 2019-06-24T10:59:02, 1561373942000, 1h
null, Wanchain, WAN, USD, coinmarketcap, 0.389629035921, 1899123.13969018, 0.975774, -1.43311, -12.8978, 2019-06-24T10:59:05, 1561373945000, 1h
null, Metadium, META, USD, coinmarketcap, 0.0331077310074, 1830936.96614341, 0.533428, 2.58753, -1.17012, 2019-06-24T10:59:08, 1561373948000, 1h
null, MOAC, MOAC, USD, coinmarketcap, 0.621609278116, 34587.9719371357, -0.564631, -6.84894, -12.8137, 2019-06-24T10:59:04, 1561373944000, 1h
null, IPChain, IPC, USD, coinmarketcap, 0.498301318491, 2438378.87692807, -1.18547, -6.18435, -12.3813, 2019-06-24T10:59:04, 1561373944000, 1h
null, Nxt, NXT, USD, coinmarketcap, 0.0378675912882, 1162428.82917544, -0.435613, -1.66981, 3.62349, 2019-06-24T10:59:01, 1561373941000, 1h
null, CyberMiles, CMT, USD, coinmarketcap, 0.0451485826512, 12169247.2739463, 0.200529, -3.22899, -10.4347, 2019-06-24T10:59:04, 1561373944000, 1h
null, TomoChain, TOMO, USD, coinmarketcap, 0.594834171349, 1933117.80667573, 0.886925, -3.50588, 7.14277, 2019-06-24T10:59:05, 1561373945000, 1h
null, PLATINCOIN, PLC, USD, coinmarketcap, 44.4805510961, 4238023.53319317, 0.889684, 17.2036, 45.269, 2019-06-24T10:59:07, 1561373947000, 1h
null, Groestlcoin, GRS, USD, coinmarketcap, 0.421998771882, 1125020.91509186, 0.249216, -0.420826, -2.76062, 2019-06-24T10:59:01, 1561373941000, 1h
null, Unobtanium, UNO, USD, coinmarketcap, 151.0736373, 5925.62618518654, 0.341254, -2.8008, 14.5695, 2019-06-24T10:59:01, 1561373941000, 1h
null, Vertcoin, VTC, USD, coinmarketcap, 0.596102731669, 521666.440553932, -0.578071, 1.18443, 9.77426, 2019-06-24T10:59:01, 1561373941000, 1h
null, CasinoCoin, CSC, USD, coinmarketcap, 0.000754955128089, 49768.9579102589, -0.306621, -1.29714, -8.19588, 2019-06-24T10:59:01, 1561373941000, 1h
null, Syscoin, SYS, USD, coinmarketcap, 0.0517323947091, 382343.213246673, 1.75168, -2.91287, -14.3692, 2019-06-24T10:59:01, 1561373941000, 1h
null, #MetaHash, MHC, USD, coinmarketcap, 0.0219950807706, 266116.214929369, -0.631778, -3.08331, -7.72778, 2019-06-24T10:59:09, 1561373949000, 1h
null, Skycoin, SKY, USD, coinmarketcap, 1.78273882899, 849922.909569454, -0.472006, -8.82965, 10.087, 2019-06-24T10:59:02, 1561373942000, 1h
null, Pirate Chain, ARRR, USD, coinmarketcap, 0.25017179654, 46009.8505613581, -0.124087, 4.97057, 33.1964, 2019-06-24T10:59:11, 1561373951000, 1h
null, BHPCoin, BHP, USD, coinmarketcap, 1.56339920482, 5943940.13975794, 0.749381, -0.788133, -2.49713, 2019-06-24T10:59:06, 1561373946000, 1h
null, Obyte, GBYTE, USD, coinmarketcap, 36.1498297635, 12276.5576853829, 0.387766, 2.26396, -3.12407, 2019-06-24T10:59:02, 1561373942000, 1h
null, Einsteinium, EMC2, USD, coinmarketcap, 0.11106044325, 758833.082064861, -0.28068, -1.30124, -7.80019, 2019-06-24T10:59:01, 1561373941000, 1h
null, BOScoin, BOS, USD, coinmarketcap, 0.0375587619389, 35504.2292139466, 0.832893, -4.42154, 46.2477, 2019-06-24T10:59:04, 1561373944000, 1h
null, Nexus, NXS, USD, coinmarketcap, 0.369645187999, 382370.898752352, 0.245262, -5.60417, 4.29693, 2019-06-24T10:59:01, 1561373941000, 1h
null, TTC, TTC, USD, coinmarketcap, 0.115134383521, 1730377.60570516, 0.3147, 13.5677, 5.32462, 2019-06-24T10:59:07, 1561373947000, 1h
null, SaluS, SLS, USD, coinmarketcap, 22.2437430877, 7974.36098107657, 0.394594, 3.45624, 18.2298, 2019-06-24T10:59:01, 1561373941000, 1h
null, IRISnet, IRIS, USD, coinmarketcap, 0.0686341955009, 1689364.8352535, 0.334142, -2.33799, -2.57104, 2019-06-24T10:59:09, 1561373949000, 1h
null, Apollo Currency, APL, USD, coinmarketcap, 0.00152827561428, 54817.2058156898, -0.306464, 1.19171, -11.7255, 2019-06-24T10:59:06, 1561373946000, 1h
null, Quantum Resistant Ledger, QRL, USD, coinmarketcap, 0.315687974294, 19317.61501672, 1.24168, -3.2617, -13.4316, 2019-06-24T10:59:02, 1561373942000, 1h
null, High Performance Blockchain, HPB, USD, coinmarketcap, 0.485726681932, 5386138.31140145, -0.284769, -1.96249, -5.50018, 2019-06-24T10:59:04, 1561373944000, 1h
null, Particl, PART, USD, coinmarketcap, 2.3401846397, 77475.3927736052, 0.822577, -1.15564, -13.9568, 2019-06-24T10:59:02, 1561373942000, 1h
null, Achain, ACT, USD, coinmarketcap, 0.0209990968925, 2350037.65333185, 1.04481, 3.34107, 9.35485, 2019-06-24T10:59:03, 1561373943000, 1h
null, VeriBlock, VBK, USD, coinmarketcap, 0.0379842987366, 667797.186140202, 0.39463, 0.0633038, 15.7198, 2019-06-24T10:59:09, 1561373949000, 1h