id, name, base, counter, api, priceUSD, volume24h, percentChange1h,percentChange24h, percentChange7d, dateTimeUSD, milisec, timeframe
null, Bitcoin, BTC, USD, coinmarketcap, 9882.3657108, 20721808143.4221, 0.446514, 5.64297, 17.2277, 2019-06-21T19:59:29, 1561147169000, 1h
null, Ethereum, ETH, USD, coinmarketcap, 289.785675978, 9041924132.49454, 1.03999, 8.00026, 12.3353, 2019-06-21T19:59:21, 1561147161000, 1h
null, XRP, XRP, USD, coinmarketcap, 0.441212815002, 1606944147.17783, 0.221337, 3.27331, 10.8198, 2019-06-21T19:59:05, 1561147145000, 1h
null, Litecoin, LTC, USD, coinmarketcap, 137.819791122, 4415386152.46831, 0.227659, 2.549, 5.82307, 2019-06-21T19:59:04, 1561147144000, 1h
null, Bitcoin Cash, BCH, USD, coinmarketcap, 434.847605043, 1847522474.70843, 1.17568, 6.00673, 6.02809, 2019-06-21T19:59:07, 1561147147000, 1h
null, EOS, EOS, USD, coinmarketcap, 7.03412130473, 2395816915.34024, 0.503791, 4.09652, 8.9858, 2019-06-21T19:59:08, 1561147148000, 1h
null, Binance Coin, BNB, USD, coinmarketcap, 38.1028736923, 473101324.982353, 1.26866, 4.9402, 17.3441, 2019-06-21T19:59:06, 1561147146000, 1h
null, Bitcoin SV, BSV, USD, coinmarketcap, 221.013412583, 491168872.456338, 0.574575, 2.73982, 5.21544, 2019-06-21T19:59:10, 1561147150000, 1h
null, Stellar, XLM, USD, coinmarketcap, 0.123868938821, 284819836.268229, -0.123367, 1.98818, 0.732731, 2019-06-21T19:59:04, 1561147144000, 1h
null, Cardano, ADA, USD, coinmarketcap, 0.0895170947038, 149958609.928732, 0.136764, 1.95136, 1.99595, 2019-06-21T19:59:06, 1561147146000, 1h
null, TRON, TRX, USD, coinmarketcap, 0.0333221944402, 570855131.675025, 0.523462, 1.9279, 4.94571, 2019-06-21T19:59:06, 1561147146000, 1h
null, Monero, XMR, USD, coinmarketcap, 108.126433937, 161348320.888196, 0.278032, 5.61311, 22.04, 2019-06-21T19:59:03, 1561147143000, 1h
null, Dash, DASH, USD, coinmarketcap, 164.531845829, 303791749.326816, 0.771239, 3.04613, 8.25217, 2019-06-21T19:59:03, 1561147143000, 1h
null, Cosmos, ATOM, USD, coinmarketcap, 6.44439803151, 69754980.011186, -0.11888, 1.18041, 5.94374, 2019-06-21T19:59:10, 1561147150000, 1h
null, IOTA, MIOTA, USD, coinmarketcap, 0.426414610795, 28329372.0894888, -0.17535, 1.69855, -0.0849549, 2019-06-21T19:59:05, 1561147145000, 1h
null, NEO, NEO, USD, coinmarketcap, 13.8937201273, 432523315.384042, 0.382527, 4.13963, 7.87725, 2019-06-21T19:59:06, 1561147146000, 1h
null, Ethereum Classic, ETC, USD, coinmarketcap, 8.6347378838, 813851743.821924, -0.0465144, 2.28623, 3.09301, 2019-06-21T19:59:05, 1561147145000, 1h
null, NEM, XEM, USD, coinmarketcap, 0.0876197341904, 30560818.4400183, 1.05414, 2.7047, 4.05308, 2019-06-21T19:59:04, 1561147144000, 1h
null, Zcash, ZEC, USD, coinmarketcap, 111.043234861, 488036374.14234, 0.74476, 2.49328, 24.0533, 2019-06-21T19:59:05, 1561147145000, 1h
null, Tezos, XTZ, USD, coinmarketcap, 1.14118693319, 9357581.9227668, 0.570115, -0.97934, -7.1906, 2019-06-21T19:59:05, 1561147145000, 1h
null, Ontology, ONT, USD, coinmarketcap, 1.41323964407, 175880757.965853, 0.202712, 1.72567, 1.38192, 2019-06-21T19:59:07, 1561147147000, 1h
null, Bitcoin Gold, BTG, USD, coinmarketcap, 28.4909898091, 19573660.8969578, 0.14741, 1.59304, 7.05248, 2019-06-21T19:59:06, 1561147146000, 1h
null, VeChain, VET, USD, coinmarketcap, 0.0069613541394, 31562053.2126678, 0.0656657, -0.487542, -4.91581, 2019-06-21T19:59:09, 1561147149000, 1h
null, Dogecoin, DOGE, USD, coinmarketcap, 0.00319607430059, 42240849.7232153, 0.395508, 1.75142, 3.85811, 2019-06-21T19:59:04, 1561147144000, 1h
null, Qtum, QTUM, USD, coinmarketcap, 3.53945661723, 219838812.358537, 0.550292, 2.81662, 5.54666, 2019-06-21T19:59:06, 1561147146000, 1h
null, Decred, DCR, USD, coinmarketcap, 29.3129983391, 6569423.18991753, 0.840722, 2.55072, 11.8766, 2019-06-21T19:59:04, 1561147144000, 1h
null, Lisk, LSK, USD, coinmarketcap, 2.0651765063, 10264606.487631, -0.958138, 1.20607, 2.12632, 2019-06-21T19:59:04, 1561147144000, 1h
null, Bitcoin Diamond, BCD, USD, coinmarketcap, 1.29285498028, 5241700.72964764, 0.69518, 3.98297, 7.57755, 2019-06-21T19:59:06, 1561147146000, 1h
null, Waves, WAVES, USD, coinmarketcap, 2.37923483587, 19763368.4498633, -0.382594, 0.422477, 1.71487, 2019-06-21T19:59:05, 1561147145000, 1h
null, Ravencoin, RVN, USD, coinmarketcap, 0.0601738696006, 17639143.7858225, -0.922607, -3.60872, -1.32863, 2019-06-21T19:59:07, 1561147147000, 1h
null, Nano, NANO, USD, coinmarketcap, 1.4467766862, 6005516.10959837, 0.296544, -1.05581, -8.27414, 2019-06-21T19:59:05, 1561147145000, 1h
null, Bytom, BTM, USD, coinmarketcap, 0.182813414289, 73796557.3382816, 0.847914, 1.18684, 11.1963, 2019-06-21T19:59:05, 1561147145000, 1h
null, MonaCoin, MONA, USD, coinmarketcap, 2.74173101113, 83120721.6609266, -0.776505, 16.9152, 39.9008, 2019-06-21T19:59:02, 1561147142000, 1h
null, Bytecoin, BCN, USD, coinmarketcap, 0.000957774797914, 81623.0341096479, -2.65437, -1.83769, 1.73266, 2019-06-21T19:59:02, 1561147142000, 1h
null, BitShares, BTS, USD, coinmarketcap, 0.0631736369627, 6571928.96176289, -0.165284, 1.82431, 3.18112, 2019-06-21T19:59:04, 1561147144000, 1h
null, DigiByte, DGB, USD, coinmarketcap, 0.0139527546636, 1469605.12085533, 0.560803, -2.35508, 16.562, 2019-06-21T19:59:03, 1561147143000, 1h
null, Komodo, KMD, USD, coinmarketcap, 1.411748357, 4274062.87281613, -1.58489, -0.52368, -11.4546, 2019-06-21T19:59:04, 1561147144000, 1h
null, ICON, ICX, USD, coinmarketcap, 0.338440582765, 11550852.2230651, -0.801812, -3.44884, -7.63455, 2019-06-21T19:59:06, 1561147146000, 1h
null, HyperCash, HC, USD, coinmarketcap, 3.2709492291, 8663246.36651728, 2.33611, -1.19877, 23.6347, 2019-06-21T19:59:05, 1561147145000, 1h
null, Verge, XVG, USD, coinmarketcap, 0.00880046862888, 2547960.60143307, -0.781526, -0.173075, 1.51543, 2019-06-21T19:59:03, 1561147143000, 1h
null, Aeternity, AE, USD, coinmarketcap, 0.510128534286, 35949704.0521067, 1.14179, -0.551212, -1.48728, 2019-06-21T19:59:05, 1561147145000, 1h
null, Metaverse ETP, ETP, USD, coinmarketcap, 1.92007620205, 118582015.397811, -0.775712, 2.24983, 5.88075, 2019-06-21T19:59:05, 1561147145000, 1h
null, GXChain, GXC, USD, coinmarketcap, 2.26185373578, 16857990.2138381, -0.220761, -1.07358, 3.49219, 2019-06-21T19:59:05, 1561147145000, 1h
null, Siacoin, SC, USD, coinmarketcap, 0.0030394593259, 2191539.37223351, 0.304506, -1.36449, -4.35, 2019-06-21T19:59:04, 1561147144000, 1h
null, Steem, STEEM, USD, coinmarketcap, 0.389107235243, 2038974.06001424, -0.267517, -3.15438, -3.2076, 2019-06-21T19:59:04, 1561147144000, 1h
null, Ardor, ARDR, USD, coinmarketcap, 0.115888927931, 2132709.00445088, 0.123998, -3.65102, 13.6891, 2019-06-21T19:59:04, 1561147144000, 1h
null, THETA, THETA, USD, coinmarketcap, 0.124452062595, 3357647.6256331, -0.058865, -3.18165, -3.28437, 2019-06-21T19:59:06, 1561147146000, 1h
null, Zcoin, XZC, USD, coinmarketcap, 12.9443822154, 4398944.97785158, -0.933615, -1.93362, 18.3292, 2019-06-21T19:59:04, 1561147144000, 1h
null, Stratis, STRAT, USD, coinmarketcap, 0.931339536244, 2643768.84335524, 0.422697, -1.92334, 3.51919, 2019-06-21T19:59:04, 1561147144000, 1h
null, ABBC Coin, ABBC, USD, coinmarketcap, 0.173051540891, 41724051.023194, 0.624333, 1.82658, -6.93002, 2019-06-21T19:59:10, 1561147150000, 1h
null, TrueChain, TRUE, USD, coinmarketcap, 0.990121938353, 55543421.4597927, 0.625462, -1.64149, -4.55746, 2019-06-21T19:59:07, 1561147147000, 1h
null, Energi, NRG, USD, coinmarketcap, 4.38352020462, 311079.569427609, 1.8636, 8.95111, 15.5071, 2019-06-21T19:59:09, 1561147149000, 1h
null, Horizen, ZEN, USD, coinmarketcap, 10.5179668759, 883010.039998208, -0.0897869, -0.356265, 4.54442, 2019-06-21T19:59:05, 1561147145000, 1h
null, Project Pai, PAI, USD, coinmarketcap, 0.0486114917631, 1714225.54365012, 3.85906, 3.86537, -3.35991, 2019-06-21T19:59:08, 1561147148000, 1h
null, Nebulas, NAS, USD, coinmarketcap, 1.43543763614, 6040029.89240278, -1.20917, -1.5493, -6.34601, 2019-06-21T19:59:05, 1561147145000, 1h
null, NULS, NULS, USD, coinmarketcap, 0.972083045247, 11534987.8772179, 0.356712, -1.87404, 1.7752, 2019-06-21T19:59:05, 1561147145000, 1h
null, Grin, GRIN, USD, coinmarketcap, 5.06565391082, 34665163.8536466, 0.0152341, -4.77523, 37.0134, 2019-06-21T19:59:10, 1561147150000, 1h
null, ReddCoin, RDD, USD, coinmarketcap, 0.00227109395206, 358190.934404254, 2.78043, 7.883, 29.884, 2019-06-21T19:59:02, 1561147142000, 1h
null, Ark, ARK, USD, coinmarketcap, 0.529248740109, 931244.807923031, -2.4014, 0.59967, -7.84194, 2019-06-21T19:59:05, 1561147145000, 1h
null, Elastos, ELA, USD, coinmarketcap, 3.68277277287, 7822520.20261486, -0.0237, -1.52364, -0.662105, 2019-06-21T19:59:07, 1561147147000, 1h
null, Thunder Token, TT, USD, coinmarketcap, 0.0191182826143, 7577902.52039687, 0.919066, -1.96226, -4.28744, 2019-06-21T19:59:11, 1561147151000, 1h
null, Factom, FCT, USD, coinmarketcap, 5.56133831091, 877114.292115883, 0.197103, -2.05879, -4.44128, 2019-06-21T19:59:04, 1561147144000, 1h
null, Electroneum, ETN, USD, coinmarketcap, 0.00554824507214, 342436.928652131, 1.41277, -3.22062, 10.2642, 2019-06-21T19:59:06, 1561147146000, 1h
null, WaykiChain, WICC, USD, coinmarketcap, 0.281115209292, 2455302.41751307, -1.5707, -2.17364, 5.56788, 2019-06-21T19:59:06, 1561147146000, 1h
null, Aion, AION, USD, coinmarketcap, 0.155038616506, 2582288.0946634, 0.275176, 0.631613, -11.2497, 2019-06-21T19:59:05, 1561147145000, 1h
null, Theta Fuel, TFUEL, USD, coinmarketcap, 0.0118083099884, 7306206.41935982, 0.7442, -6.89559, -4.42717, 2019-06-21T19:59:10, 1561147150000, 1h
null, Ether Zero, ETZ, USD, coinmarketcap, 0.277588049395, 2714416.40865583, 0.447654, -2.03424, 0.861485, 2019-06-21T19:59:08, 1561147148000, 1h
null, MOAC, MOAC, USD, coinmarketcap, 0.713857134365, 58252.9532070073, 1.84706, 3.23625, -5.55476, 2019-06-21T19:59:06, 1561147146000, 1h
null, Wanchain, WAN, USD, coinmarketcap, 0.402191987364, 2259621.27990923, -0.110987, -2.7431, -9.00353, 2019-06-21T19:59:07, 1561147147000, 1h
null, Newton, NEW, USD, coinmarketcap, 0.00356079599174, 8735254.86617372, 0.246885, -2.44573, -0.349717, 2019-06-21T19:59:10, 1561147150000, 1h
null, PIVX, PIVX, USD, coinmarketcap, 0.717211923624, 655656.612932406, -0.640585, -3.1215, 1.07503, 2019-06-21T19:59:04, 1561147144000, 1h
null, IPChain, IPC, USD, coinmarketcap, 0.519190768512, 2785859.07768297, -0.561162, -4.61625, 6.90328, 2019-06-21T19:59:06, 1561147146000, 1h
null, Metadium, META, USD, coinmarketcap, 0.0315395045849, 5641508.53979106, 0.336758, -4.71742, -1.71936, 2019-06-21T19:59:09, 1561147149000, 1h
null, TomoChain, TOMO, USD, coinmarketcap, 0.647339107033, 2046975.7189189, 1.49747, -0.954982, 24.4866, 2019-06-21T19:59:07, 1561147147000, 1h
null, Nxt, NXT, USD, coinmarketcap, 0.0380445478814, 1280913.09955034, 0.0678297, 2.94221, 3.41419, 2019-06-21T19:59:02, 1561147142000, 1h
null, CyberMiles, CMT, USD, coinmarketcap, 0.044566111202, 9167032.7406987, 0.90951, 0.00353247, 3.70273, 2019-06-21T19:59:06, 1561147146000, 1h
null, Groestlcoin, GRS, USD, coinmarketcap, 0.418332334672, 1395561.98151935, 0.227784, -1.91399, -1.86386, 2019-06-21T19:59:02, 1561147142000, 1h
null, Beam, BEAM, USD, coinmarketcap, 1.26459482583, 23460566.5290627, -3.40421, -14.3224, 88.0052, 2019-06-21T19:59:10, 1561147150000, 1h
null, Syscoin, SYS, USD, coinmarketcap, 0.051931463743, 575505.173770385, 0.29124, -6.66861, -15.0768, 2019-06-21T19:59:03, 1561147143000, 1h
null, Skycoin, SKY, USD, coinmarketcap, 1.90730428304, 1315572.91765479, 2.02726, 11.5491, 24.2057, 2019-06-21T19:59:05, 1561147145000, 1h
null, Unobtanium, UNO, USD, coinmarketcap, 143.124901509, 1135.0328376722, 0.434406, 6.30336, 16.7132, 2019-06-21T19:59:02, 1561147142000, 1h
null, #MetaHash, MHC, USD, coinmarketcap, 0.0228368608461, 272879.729565548, -1.01544, -0.591895, -4.52567, 2019-06-21T19:59:10, 1561147150000, 1h
null, Vertcoin, VTC, USD, coinmarketcap, 0.55752120983, 1250340.26851681, -0.363003, -2.93691, 5.05168, 2019-06-21T19:59:02, 1561147142000, 1h
null, BHPCoin, BHP, USD, coinmarketcap, 1.59966209367, 6547405.07527782, -0.901041, 3.02393, 0.22592, 2019-06-21T19:59:08, 1561147148000, 1h
null, CasinoCoin, CSC, USD, coinmarketcap, 0.000668408632177, 74979.3120995582, -3.64142, -13.1713, -20.6032, 2019-06-21T19:59:02, 1561147142000, 1h
null, BOScoin, BOS, USD, coinmarketcap, 0.03964198887, 85083.5111031649, -2.62855, -3.87094, 118.158, 2019-06-21T19:59:05, 1561147145000, 1h
null, Nexus, NXS, USD, coinmarketcap, 0.382973247112, 341500.6249502, -0.371578, 3.96028, 9.33334, 2019-06-21T19:59:03, 1561147143000, 1h
null, Obyte, GBYTE, USD, coinmarketcap, 33.9146042099, 40293.8262541452, 1.28486, -1.98443, -9.00651, 2019-06-21T19:59:04, 1561147144000, 1h
null, High Performance Blockchain, HPB, USD, coinmarketcap, 0.54742675126, 5553000.36144039, 1.21828, 1.962, 17.2409, 2019-06-21T19:59:06, 1561147146000, 1h
null, Einsteinium, EMC2, USD, coinmarketcap, 0.107983487255, 1383139.33212705, -0.0507577, -6.67228, -11.4606, 2019-06-21T19:59:02, 1561147142000, 1h
null, Pirate Chain, ARRR, USD, coinmarketcap, 0.21895769125, 7890.0173454383, -4.40777, 0.0671034, 37.0958, 2019-06-21T19:59:11, 1561147151000, 1h
null, IRISnet, IRIS, USD, coinmarketcap, 0.0681541333785, 2466681.22578532, -0.842524, -1.9777, 3.59001, 2019-06-21T19:59:11, 1561147151000, 1h
null, PLATINCOIN, PLC, USD, coinmarketcap, 31.7210807783, 3191388.06001472, -0.160616, 2.38112, 10.3415, 2019-06-21T19:59:09, 1561147149000, 1h
null, Quantum Resistant Ledger, QRL, USD, coinmarketcap, 0.317665015595, 132236.518718879, 1.06343, -11.3004, -8.56893, 2019-06-21T19:59:05, 1561147145000, 1h
null, Apollo Currency, APL, USD, coinmarketcap, 0.00145066128301, 40044.7718476449, -0.102603, -0.888046, -17.1781, 2019-06-21T19:59:08, 1561147148000, 1h
null, SaluS, SLS, USD, coinmarketcap, 19.8127917445, 10456.5008013285, 0.83256, 5.75729, 15.9085, 2019-06-21T19:59:04, 1561147144000, 1h
null, Particl, PART, USD, coinmarketcap, 2.37671309736, 97733.0005461091, -3.46249, -10.8417, -22.8378, 2019-06-21T19:59:05, 1561147145000, 1h
null, TTC, TTC, USD, coinmarketcap, 0.0945343344233, 3316520.79219911, 0.121228, -3.07742, -12.6119, 2019-06-21T19:59:09, 1561147149000, 1h
null, Lightning Bitcoin, LBTC, USD, coinmarketcap, 4.61924470019, 7301244.55583095, 0.273303, -3.70627, -6.46059, 2019-06-21T19:59:06, 1561147146000, 1h
null, ILCoin, ILC, USD, coinmarketcap, 0.0589292942017, 1207386.49324061, 1.77034, 0.896109, -0.713687, 2019-06-21T19:59:10, 1561147150000, 1h